movie_title,title,review,rating,helpful,total,date
Zombieland," Nut Up or Shut Up
","Columbus is a big wuss -- but when you're afraid of being eaten by zombies, fear can keep you alive. Tallahassee is an AK-toting, zombie-slaying' bad ass whose single determination is to get the last Twinkie on earth. As they join forces with Wichita and Little Rock, who have also found unique ways to survive the zombie mayhem, they will have to determine which is worse: relying on each other or succumbing to the zombies.For this review, I'll refrain from comparing ZOMBIELAND with SHAUN OF THE DEAD, even though I probably will in the course of writing it. To start things off, ZOMBIELAND has one of the most beautiful opening credits scene in movie history. In fact, it's reminiscent of one I saw in WATCHMEN months earlier. But let's get to the point, much like the movie, which runs at a scant 80 minutes: ZOMBIELAND is one of those laugh-per-minute movies in which most of the jokes thrown on the screen work because they are clever and witty.It's also not one of those movies in which survivors are looking for a cure or loved ones. In fact, there's not much of a story structure in here. Just think of it as a road trip movie that happens to take place in a world filled with zombies and that's part of the fun in this movie. It's about a group of people who, at first, don't trust each other but slowly, and surely, start to grow on one another. This adds humanity to the movie. At one point, one of the characters call ANACONDA an R rated movie when it's really rated PG-13. This shows that everybody makes mistakes and aren't perfect.As funny the movie is, there's also a sweet and an endearing side to it. One such character we come to love the first minute we see him is played by Jesse Eisenberg, whom many will compare to Michael Cera, although Eisenberg has appeared in movies before Cera, including CURSED by Wes Craven. Along with him, the rest of the cast really make the movie have a higher standard than most in this genre. Woody Harrelson is just perfect for the role, having some great one-liners too. Emma Stone and Abigail Breslin also do a great job. There's also one great, hilarious cameo in here which I dare not spoil. You will have to see it for yourself.Although the zombie genre may seem dead, movies like ZOMBIELAND give it a reason to stay. The movie is very funny but also has a sweet side to it. The movie has it's touching moments along with some zombie action, especially towards the end. Oh, and if you're worried about the short running time, don't worry about it. The movie felt longer than that. Watch it if you're a fan of the zombie genre. If you're not, I still think it's worth the watch. Oh, and I've managed to not compare this film with SHAUN OF THE DEAD!",7,1,5,4 October 2009
Harry Potter and the Chamber of Secrets," The Magic Continues!
","Forced to spend his summer holidays with his muggle relations, Harry Potter gets a real shock when he gets a surprise visitor: Dobby the house-elf, who warns Harry Potter against returning to Hogwarts, for terrible things are going to happen. Harry decides to ignore Dobby's warning and continues with his pre-arranged schedule. But at Hogwarts, strange and terrible things are indeed happening: Harry is suddenly hearing mysterious voices from inside the walls, muggle-born students are being attacked, and a message scrawled on the wall in blood puts everyone on his/her guard - 'The Chamber Of Secrets Has Been Opened. Enemies Of The Heir, Beware'.This film is darker than the first film (obviously each Harry Potter films get darker within each sequel) and there's much more great action sequences and faster paced. This movie is faithful to the book but it's like Chris Columbus wants to fit everything in the movie (unlike the third and fourth movie) which results them to be almost three hour movies instead of focusing to the plot. Well, I don't mind that.There are much funnier comedic and more scarier scenes in this movie. Those who haven't read the books will get more information of Voldermort and Harry Potter and those who haven't seen the first film needs to see it to understand this second film. It's not a movie that stands for itself.Again, the score is terrific, giving the movie a magical feel. The CGI for Dobby, ghosts, and the action sequences are fantastic. The main trio's acting is yet again terrific and fits well with the book's characters. And I would give a moment to remember Richard Harris, who sadly passed away after filming this movie. He portrays a great Dumbledore.I wouldn't know if this movie is better than the first. Each Harry Potter films are terrific and some of the best films ever created. If you're a Harry Potter fan, you'll like this movie. If not, well, you'll still enjoy it as much as I did. It's a fantastic family film!",9,0,2,25 June 2007
Mr. & Mrs. Smith," Fun
","A married couple are getting bored with their quiet domestic life. What they don't know, however, is that they're both assassins, secretly hopping the world and killing for hire. But their separate lives are about to collide when each finds out their next target is their own spouse.This is a very entertaining fun film from the very beginning to the end. It's pure excitement and fun. There are great action scenes, funny comedic scenes, and sweet emotional scenes. The dialog is well written with some witty one liners.It's an entertaining popcorn movie. The CGI is well done within the action scenes. It looks like Brad Pitt and Angelina Jolie are having a good time making this film that we also enjoy it as much as they did making it. The chemistry by those two are great as well with their acting.If you would like to be entertained in a movie with great action scenes and great dialog, this is the film. It's just a fun film, although not anything great or Oscar material.",6,3,6,24 June 2007
Die Hard," Yippy-Kay-Yay Motherf*cker
","New York cop John McCLane flies to Los Angeles on Christmas eve to spend the holidays with his family. He arrives at the Nakatomi corp. building for his wife's office party. International terrorists take over the building and hold every one as hostage to steel $600 million of bonds from the vaults of the building. Now its up to McCLane to face the terrorists and save his wife and the other hostages.I wouldn't know why this film is rated so high on IMDb, but this site is known for having bizarre ratings. Well, I would call this your average action film. It has one liners, a lot of violence, guns, profanity, explosions, villains, and many people.I would love to say this is a very entertaining action flick, although it's running time is longer than it needs to be (I mean, two hours for an action film?). I love some memorable dialog, made by Bruce Willis' character, and the humor of it. It just doesn't take itself too seriously. Just relax.I like, or love, Bruce Willis' acting. John McClane is a fun character to play, I imagine. Other acting, like Alan Rickman, were pretty good too. I also love the mindless action here and there. They never seem to end, do they?This is your usual action flick with humor and doesn't take itself too seriously. If you would like to watch this film with your brain turned off to have a good time, this is the film.",7,2,4,9 June 2007
Transformers: Revenge of the Fallen," Revenge is coming.
","Decepticon forces return to Earth on a mission to take Sam Witwicky prisoner, after the young hero learns the truth about the ancient origins of the Transformers. Joining the mission to protect humankind is Optimus Prime, who forms an alliance with international armies for a second epic battle.So there it was. The trailer. Played on the silver screen. It looked darker than the previous film. The tagline 'Revenge is coming' reinforces that aspect. It excited me. This could really be a serious, dark movie, like THE DARK KNIGHT. I was wrong. So wrong. But that's not necessarily a bad thing. I was insane hoping for a serious, dark, gritty action flick from Michael Bay. In fact, the trailer doesn't show any of the crude and sexual humor throughout the film. And you know what? I found the jokes pretty funny. Sure, some of the jokes are just disgusting (you'd be surprised what lays hidden in this movie), but I liked the laid back feel.The plot was...confusing, I will admit, but in a film like this, does it really matter? The movie never ceases to be entertaining. The action sequences are amazing, but directed by Michael Bay, it's not surprising. If there is one thing I have to say about him, he knows how to entertain audiences. And he was right when he said there would be more action scenes in the film. You thought the first movie had a lot of action scenes? Oh, God, I wouldn't even begin. To keep it simple, the special effects are nothing short of being flawless. I loved the score by Steve Jablonsky, most of it being brought back from the first movie.In an interview with Megan Fox, the sexy actress said the following: 'This movie is not about acting.' And she's right. I can go on saying that the humans in the films were actually the robots, but that's not particularly true. You have to give credit to Shia LaBeouf's part, at least. He does a swell job, given the material. I found John Turturro to be quite annoying in the first film but the producers or writers decided it was a good idea to bring him back. I still found him annoying in the film and I especially rolled my eyes when he was doing a serious scene.This goes along with Sam's parents in the film, Kevin Dunn and Julie White, although I don't find them quite as annoying. In fact, I enjoyed most of their scenes. They give some good comic relief throughout the film. I just didn't like them being serious because you just can't take them seriously. The writers apparently thought Ramon Rodriguez's character was a good idea. I just really hated him. Josh Duhamel and Tyrese Gibson also returned for the sequel, although they don't have much to do. Overall, the whole cast pretty much had one thing to do: Run in slow motion.With all the positives, there was no doubt some negatives. The most obvious is the overly long running time. I don't think Michael Bay ever made a movie less than two hours. I would've liked the movie if it were thirty minutes shorter. It was until the third act that I realized how long the movie was going to be. It started to meander a bit after that and there came a point in the film that there was just overkill. The movie was just really long. Another thing that annoyed me was a pair of twin Transformers. Actually, add another Transformer. All three of them were yelling profanity throughout. Not my thing.If you walk into the movie with the right mindset, you'd be surprised that you had enjoyed most of the film. The action sequences are just fantastic but the plot is lacking. The actors don't have much to do but to run around and scream. But really, what are you going to expect when you walk into a Michael Bay film? A plot? Great performances? A delightful script? Nah. You'd expect action. Action. And did I mention action?",6,0,4,28 June 2009
Steve Jobs," Simply Masterful
","Is Steve Jobs the movie of the year? Obviously. Clearly. The first 30 minutes of the film itself is so well constructed from the writing, directing, performances, pacing, soundtrack, and editing that you are witnessing masters do what they do best. With the names of Boyle, Sorkin, Fassbender, and Winslet, would anyone expect less? No, I'm not saying these things because I love Apple products or I think Steve Jobs himself was a genius, a visionary. It's just the simple fact that the film is masterful in nearly every way. It puts to shame almost every film released this year and the previous ten years. It's that good.Running at about two hours, the film feels like one, which is impressive considering it's essentially a bunch of scenes of people talking to each other. The film rarely feels slow and remains compelling to the very end, moving at an incredibly brisk pace. Not even The Social Network could pull that off. Then again, Steve Jobs is an entirely different beast, with the only similarities being their Sorkin-ess scripts. Everything else is unalike because Danny Boyle is a completely different director from David Fincher. Yeah, it would have been cool to see a Social Network reunion, but it's just as great to witness Boyle's distinct style overtake the screenplay. Again, these are masters who know their craft.The performances are top notch, but of course they are. Michael Fassbender is a chameleon, transforming into the titular role of Steve Jobs. Sure, he doesn't look like Jobs but does it even matter when he's this good? Kate Winslet is alongside Fassbender through most of the film, and while her European accent comes in and out for a few scenes, she's fantastic. Other supporting roles range from good to great, including Michael Stuhlbarg and even Seth Rogen, but it is Perla Haney-Jardine who stands out as Jobs' daughter. She's in a small but nevertheless important section of the film and becomes instantly memorable in her limited screen time.The success of the film isn't that it's about Jobs himself or the products that he made. In fact, Sorkin cleverly ditches the cradle to the grave biopic we've seen too many times and instead, focuses on Jobs' relationship with his daughter. It's an affecting storyline, tapping into the universal themes of family, love, wanting to be loved or, at the very least, acknowledged. It's the beating heart of Steve Jobs, the thing that keeps the film alive, and don't be surprised when you're crying by the end because you will. That, perhaps, might be the most surprising aspect of the film of all.",10,11,27,14 October 2015
War of the Worlds," Run! Run for Your Lives!
","The plot is easy to understand: Ray Ferrier lives in New Jersy, divorced by his wife who got his two kids which spends with one another every couple of days. Ray works in the docks. Rachel and Robbie are never happy to see Dad compared to Mom, for a couple of days to stay. As they stay and Mom leaves them with Dad, a lightning hits the ground. The ground shakes and a tripod comes out and we figure that aliens are inside and are invading the Earth. Now Ray must protect his two kids to survive from the invasion as they walk to Mom's in Boston.The tripods shoot people with their heat rays which turns them to dust. The designs for each tripod are amazing. There are three types of tripods that do different things. The movie is one of Steven Spielberg's best movie. The CGI effects are terrific. It's a first rate edge-of-your-seats thriller! It's so exciting, you'll have to watch it again! The acting is great in this film. Steven's vision for the film is good. Do not believe the other reviewers who said that this film is bad because it's not. Maybe the ending is what bothers them. The ending was the true ending from the book by H.G. Wells. The ending is satisfying for me enough.Once, Steven made a film called E.T. It's sweet and heart warming, This movie is no where close to that. this film is rather dark and scary in some parts. If you compare the special effects to The Day After Tomorrow, The Day After Tomorrow will win, although it would be close. Steven also makes it feel that they might survive in the invasion as many bad things occur to the family.It's just a harmless fun entertaining summer blockbuster. Yes, there are some clichÃ©s here and there but don't bother with them. Just watch it and you'll forget it.",9,3,7,16 June 2006
Love Actually," Love Actually Is All Around
","This film follows the lives of eight very different couples in dealing with their love lives in various loosely and interrelated tales all set during a frantic month before Christmas in London, England.This film is one of the best romantic film. It could probably have anything you ever wanted in a romance. There's the old marriage proposal in a restaurant and language barriers.The acting is great by all of the cast. There are some sweet and sometimes very funny moments in the film. There are some very great dialog in the film too.In this world, you probably think there are greedy and bad people out there but this film actually shows that love is all around us. It even mentions the 9/11 moment where each people call their families with love rather than hatred.This is a very well made film that is light-hearted and funny at times. If you don't mind this film being that long, then you can watch it if you want to.",7,0,2,17 February 2007
30 Days of Night," Good Concept, Decent Storytelling
","This is the story of an isolated Alaskan town that is plunged into darkness for a month each year when the sun sinks below the horizon. As the last rays of light fade, the town is attacked by a bloodthirsty gang of vampires bent on an uninterrupted orgy of destruction. Only the small town's husband-and-wife Sheriff team stand between the survivors and certain destruction.No, I'm not a fan of the comic book(s) and yes, I'm a fan of David Slade's previous movie, 'Hard Candy'. So was this a film as good as 'Hard Candy'? Certainly not. But this film is better than most movies with this genre (AKA vampire movies).What I think might disappoint fans is the slow beginning.Like usual horror movies, there always come a bloody prologue resulting to kills and gore. Well, this one does not. Instead, literally nothing happens in about 40 minutes, if you exclude the random scenes of animal and human kills.I like the set up and the slow beginning obviously wants you to get to know the characters but what you get is no less than other horror movies that start off the violence right away. So yes, I think that might disappoint horror fans out there.What's after that is your usual bloody kills, chases with the shaky cam, and some decent plot themes. What I like most from the movie is the cinematography and the look/effects of the film. This film looks beautiful. It makes Alaska look beautiful.What I also like are the scenes that had some tension. There are little but that's better than most horror movies I've seen because I seem to never get scared of anything. The performances by the actors/actresses are decent but nothing special.What I find annoying is that the movie takes place over 30 days, or nights. So if you're watching the film and when 40 minutes passed with 'Day 7' on the bottom of the screen, it will mostly cause you to make a huge sigh. When another 30 minutes pass and says 'Day 17' on the bottom screen, you might look at your watch. Yes, these things annoy me because it makes the movie feel slow. Just to remind you, this is about two hours long. Maybe they should've gone with '12 Hours of Night'? Yes, there is lots of blood. Yes, the violence is relentless (some kills are off screen, though). And yes, the ending is so similar to one other vampire movie that I will not say, which is encouraging and depressing, I suppose. Horror fans might be disappointed with the slow beginning but will love the remaining parts of the movie. I just thought it was your above-average vampire movie, which doesn't mean that much.",6,14,29,22 October 2007
To Kill a Mockingbird," Remains True With The Book
","Atticus Finch, a lawyer in the Depression-era South, defends a black man against an undeserved rape charge, and his kids against prejudice. The kids also tries to have a look a Arthur 'Boo' Radley, who is known to stay at his house without ever coming out.Some scenes were not in the movie that were in the book, which made me disappointed. I know people say that the movie is never exactly like the book but there were really rushing things. It felt like a short movie.Although it has some flaws, I would like to say there were some memorable scenes and great portrayal of the characters in the book. One memorable scene is the court scene, of course. That's the scene where Atticus Finch, Gregory Peck, makes his famous speech.The acting by Gregory Peck is fantastic winning him an Oscar for Best Actor in a Leading Role. Others like Mary Badham and Phillip Alford are believable, which I really find useless in the book and in the film. Well, perhaps they were to make the film not so dark.This film is fantastic, with great acting but has its flaws. Still, it's one of the best movies and should be seen.",9,0,1,13 March 2007
The Bridge on the River Kwai," A Fantastic War Epic
","The film deals with the situation of British prisoners of war during World War II who are ordered to build a bridge to accommodate the Burma-Siam railway. Their instinct is to sabotage the bridge but, under the leadership of Colonel Nicholson, they are persuaded that the bridge should be constructed as a symbol of British morale, spirit and dignity in adverse circumstances. At first, the prisoners admire Nicholson when he bravely endures torture rather than compromise his principles for the benefit of the Japanese commandant Saito. He is an honorable but arrogant man, who is slowly revealed to be a deluded obsessive. He convinces himself that the bridge is a monument to British character, but actually is a monument to himself, and his insistence on its construction becomes a subtle form of collaboration with the enemy. Unknown to him, the Allies have sent a mission into the jungle, led by Warden and an American, Shears, to blow up the bridge.If anyone who knows me, I'm reluctant to see classic films. I just don't like old films but I was quite interested to see this film. The script is fantastic! I'm surprised that the movie was gripping and filled with suspense and humor.What I like about the movie is that you wouldn't know who is the villain. The so called 'hero' will act as a villain in some point in the film and the so called 'villain' will act as if he's a hero. I liked the realism of the movie. It's more of what the payoff of the movie is.Everything builds up until the end and I would like to say it's great with the climax. The whole scenery in the movie is great, as well as the cinematography. The score is brilliantly made and is very memorable until this day.The performances are Oscar-worthy. Sometimes one actor leaves the spot light for another actor to give his great performance. I liked the acting by William Holden and certainly Alec Guinness. Sessue Hayakawa's acting was also good, giving a strong realistic performance.This movie was great from the beginning to the end, although I find some scenes unnecessary because it's a long, long movie. With great and solid performances and a fantastic script and score, this is one masterpiece no one should miss!",9,1,3,29 June 2007
Die Hard with a Vengeance," Think fast. Look alive. Die hard.
","John McClane is back and is facing one of his greatest challenges yet. It's New York City and an individual, known only as 'Simon'. He has planted explosive devices in different locations of the city, and the only way for McClane to stop them is to follow what Simon says. Dragging Zeus into the problem, McClane must solve every riddle that Simon gives and get to each bomb before it goes off.Bruce Willis looks tired. Really tired. I am tired. Really tired. Seeing how this is the fourth Die Hard film I've seen and this is the third Die Hard film in the franchise, I'm not surprised I got this reaction. Everything is just too tiring to watch and enjoy anymore. To top it off, this movie takes entirely too long to set up everything and entirely too long itself. If the movie was fast paced and cut about 40 minutes out, I'm sure it would've worked.Anyway, I was looking forward to this movie. I was disappointed. I don't know. I just expected much more and some ingenious ideas floating around. There is maybe one idea that I remember that was smart and neat but other than that, nada. No, this is on a much larger scale than the first two, yes, but everything gets old and boring and uninteresting after 40 minutes and the climax is just unnecessarily long too.Bruce Willis' performance the third time around seems too tiring. He doesn't look interested in his character anymore. The one liners aren't as fun to hear as the other three movies and that one liner seemed out of place, as if placed in there because the previous two movies had that line. Jeremy Irons performance was decent, I guess, but not anything special though and Samuel L. Jackson's performance was pretty good.In the end, the movie was a big let down and a huge disappointment. I found Die Hard a decent action movie, Die Hard 2 really entertaining, and Live Free or Die Hard the most fun I've had in the cinema! This one just seems dead and out there for no other reason then to just make another movie for the fun of it. I wasn't having fun. Instead, I was yearning this film to finish. Oh, well.",6,0,3,21 April 2008
