movie_title,title,review,rating,helpful,total,date
Hercules," Good animated film from the House of Mouse but not the best Disney movie ever.
","Hercules was made in 1997 and Disney kinda lost its marbles a bit with this one and I'm gonna start off with the negative side first just to get it out of the way.......THE SONGS. I swear I do like I Can Go The Distance and I Won't Say I'm In Love,but the rest of the songs were just dreadful and the man who's responsible for this is ALAN MENKEN the same man that brought us Pocahontas,Beauty & The Beast,Enchanted and Tangled(which had a better score BTW). Its kinda confusing because the ending credits song was sung by Micheal Bolton(yeah that husky male singer who sings When A Man Loves A Woman)I mean what is the score suppose to represent Gospel Church Music or Pop music,cause I'm confused.Well alright enough about me bashing the songs what's the movie about well the movie is about a Greek God named Hercules(voiced first by Josh Keaton and later by Tate Donovan)who was sent to Earth by Hades and his sidekicks who are body shifters(they can literally turn themselves into humans or animals)cause Hades wants to rule the kingdom and his got a grudge against Hercules dad(voiced by Rip Thorn). Of course when Hercules grows up and becomes a hero(like Superman or Rocky)he meets a sly sarcastic woman named Meg(voiced by Broadway Singer and Actress Susan Egan)who's also very flirty,but is she for real or is she hiding something from Hercules.Bottom line I did enjoy Hercules for its animation and the charcthers were great(if I had to be honest I found Meg to be my favourite cause she was mysterious and sarcastic yet nice at the same time).One scene did have me laughing and it was when Meg said this I'm a damsel i'm in distress,I can handle this,have a nice day, that was funny.Overall is Hercules the best Disney movie ever NO its not its pretty above average,but do I like it yeah sure its a good flick,despite the fact the songs to its credit are good but some of them are just all over the place.So its a 6 from me.",6,1,3,14 August 2013
Love Actually," If you like Gary Marshalls Valentines Day you will love Richard Curtis Love ActActually uslly
","Love Actually is a 2003 Romantic comedy starring Hugh Grant,Colin Firth,Kiera Knightly,Kris Marshall,Emma Thompson,Liam Nesson,Alan Rickman and Martine McCutheon and tells the story of a group of people who all somewhat go through ups and downs along with falling in love a long the way.
Some plots include a gay singer named Bill Mack,who sings Christmas all around, a prime minister who falls for a young Secretary, a man whos in love with his best friend whos married to someone else,another guy who falls for a Portuguese woman after he spots his former wife having an affair,another woman finds out her husband is having an affair with his secretary and many more stories intertwining together during the Christmas season.
Overall I enjoyed this film yet I hate when the plot has way too many scenarios going on.Keep an eye out for cameos from Rowan Atkinson, Ant and Dec,Elisha Culbert,January Jones,Ivana Makuviec(she was in just like heaven ) and Billy Bob Thornton.
6/10",6,0,2,11 December 2018
Wedding Crashers," Funny movie starring a very young Bradley Cooper
","Owen Wilson and Vince Vaughan team up again (having starred in Zoolander,The Internship and Starsky and Hutch) in this hilarious rom com opposite Rachel McAdams, Jane Seymor and Christopher Walken. The film is about 2 single guys named John and Jermery who gate crash weddings to bed girls. One wedding however they attend and John falls for Claire(McAdams who also worked with Owen in Midnight In Paris) who is dating a sleazy guy named Lodge ( a very young Bradley Cooper),while Jermey falls for Claire's sister(Isla Fisher) who is obsessed with him while Claire's mam(Jane Seymor) is faturated with John.So will it all end well?Overall if you are a fan of Owen Wilson then check it out. Bradley Cooper was great too as mentioned the hot headed jerk who wants to dig deep into uncovering the truth about John and Jermery. It was interesting to watch Bradley Cooper evolve from starring in romantic comedies to becoming one of the greatest actors of all time starring in A Star is Born. Isla Fisher was hilarious as Gloria as she played the quirky childish woman who's drawn to Jermery.",7,1,1,25 January 2020
Ice Age," Good movie but with terrible animation
","I have seen this movie so many times before so I had the privilege to finally get the first and second Ice Age movies on DVD recently. The story is about a grumpy mammoth named Manfried(voiced by Everybody Loves Raymond's star Ray Romano)who teams up with Sid (John Leguizamo)and Diego(voiced by Denis Leary from The Amazing Spiderman)who have to bring an abandoned baby back to his family again,as his family were attacked by Diego's pack and Diego of course had no other choice but to tag along with Manfried and Sid to get back the baby and bring Manfried to his pack to make a meal out of him.So will Manfried and Sid bring back the abandoned baby back to his father as his mother drowned when she ran from her life on Diego's pack?Bottom line I did enjoy this movie but firstly I have to talk about the animation and why I thought it was bad. It felt like the animators were so lazy they forgot to make it more realistic looking as the backgrounds look so generic its like what you see in a Barbie movie or a made for TV or straight to DVD animated film with the quality of the film. Maybe its only my opinion on it but it didn't seem as realistic as let's say Big Hero 6 or Tangled which had more realistic backgrounds than this but I guess the two I have mentioned are from Disney,while this is 20th Century Fox.Overall thought if you love Shrek,you will like this film.4/10",4,0,0,25 February 2015
Burlesque," If you are a die hard fan of Christina Aguilrea and you love hearing her singing than this is for you.
","I cannot believe that Cher's song beat Mandy Moore's I See the Light song at the Golden Globes a few years back. But anyway moving on from that.Christina Aguilrea follows the likes of Mariah Cary(Glitter),Jessica Simpson(Employee of The Month),Britney Spears(Crossroads) and a few more stars who failed to become an actress while the likes of Justin Timberlake,Will Smith and Mandy Moore are now full time actors but out of the three Timberlake is still both an artist and an actor. Here Aguilrea plays Ali a girl who dreams of being a burlesque dancer in Los Angelus. Of course she does go there and meets Tess(Cher who I swear looks like Gothel from Tangled) who was also a burlesque dancer herself. But a drunk burlesque dancer called Nikki(played by Kristen Bell who stars in the most overrated movie of all time Frozen wearing a dark wig here)doesn't want Ali to shine on stage. But can Ali pull of the launderette outfit at the strip club where they lip synch and not sing? or will she use her own voice to blow them away with romance blossoming between her and Cam Gandent)?.So what did I think of this movie. Well its not the best movie of all time and certainly not my all time favorite movie but if you like Aguilrea than check it out. The movie also stars While You Were Sleeping's Peter Gallagher,Grey's Anatomy star Eric Dane who plays a ruthless property owner who also has the hots for Ali,Maid In Manhattan's Stanley Tucci(as Cher's Assistant) and Julianne Hough (from Safe Havan,sporting a red wig here too like Bell). Bottom line if you like Aguilrea than you'll like it.I'm only giving it a 3 because it wasn't that great but for Aguilrea I give her a thumbs up for her singing.",3,1,4,27 May 2014
Pitch Perfect 2," A fairly good movie sequel to the 2012 original of the same name
","Pitch Perfect 2 is directed by Elizabeth Banks who also produces and stars in this movie where the Bellas(formed by Brittany Snow,Anna Kendricks,Rebel Wilson and co)are hosting a show in front of President Barackk Obama and his wife Michelle when Fat Amy(Wilson)makes a show of the group and they are forced to drop out as they are now suspended and been taken over by a new German group who threatens their career. So the Bellas stumbles across a new girl played by Hailee Steinfield who wanted to audition with the Bellas since her mother(played by Kathy Segel from 8 Simple Rules)used to be a Bella herself and Steinfield wanted to make her mom proud. So will the Bellas win their status back again from the new group?Overall I really enjoyed this movie,the music segments were great,the actors did a good job,Rebel Wilson is litreally the next big thing to come out of this film she's funny entertaining and she always refers to herself as Australian(since she is an Aussie). The rest of the film is very similar to the original one and both films are very good. If you are a fan of Glee then check it out.Be sure to keep an eye out for a cameo by Snopp Dogg and David Cross.",7,0,0,22 August 2016
Ice Age: Continental Drift," Gotta love The Pirates Of The Caribbean parody in this flick.
","Alright so i've liked the Ice Age legacy since 2000 and I seen all of them. The first one was good,the second was nice,the third was alright but this one is actually not that bad. This time we've got new voice talents from Josh Gad(who can be seen later this year in the anticpated 2nd CGI Disney fairytale after Tangled,Frozen),Peter Dindage(from Underdog and played one of the dwarfs in Mirror Mirror)and the queen diva herself Ms Jennifer Lopez(Maid In Manhattan,and Monster In Law). This time the world is at risk as Scatty the squirell who's obsessed with this acorn destroys the world causing Manny,Sid and Diego to part ways with Manny's family(Queen Latifah)and end up meeting more animals as Manny and his friends try to find a way home. SO is Ice Age the best cartoon ever made,well the animation is really good but you wouldn't be talking about it non stop compare to other animated films, but this one was actually good,but I wish this is the last one because if they keep adding more you'll lose interest in it.Overall out of 5 its a 3 out of 5. Out of 10 i'll give it a 6.",6,0,1,6 October 2013
Snow White and the Seven Dwarfs," Ladies and Gentlemen may I present the film that started it all in the Disney Company back in 1937
","A man named Walt Disney changed movie goers lives forever when he started his first film called Snow White & The Seven Dwarfs. Before this of course was Steamboat Willie(which is now used in the Walt Disney Animation Studios as its logo). Everyone knows what this film is about,a young princess named Snow White is threatened by her evil stepmother the Queen who wants her dead(cause she wants to be the fairest one of all)so Snow White hides out in a nearby cottage with her animal buddies to keep her safe and its turns out that the cottage belongs to seven dwarfs including Dopey,Bashful,Sleepy,Sneezy,Grumpy,Doc and Happy(all these are personality traits that each dwarf has). So when the dwarfs arrive on the scene Snow White explains to them that her stepmother is trying to kill her and so they help her out. But when later on in the film,when the wicked queen catches her in the cottage disguised as an old begger woman,its up to the dwarfs to save her from the evil woman.Lets face it Walt Disney wouldn't have happened only for this film. Disney today sure has changed as gone are the hand drawn films and now its all CGI films like Frozen,Big Hero 6 and of course Disney's 50th Tangled. As far as I know I think Snow White was the film that I watched as a child and now at the age of 24 I still love Disney movies to this day no matter what age I am.Good: The Animation is beautiful and the characters are engaging. The songs are memorable too especially the cute love ballad Someday My Prince Will Come.Bad: Snow White is a really irritating character. She has this piercing voice that drives you mad it even gets worse when she sings. Also does anyone of you notice that Snow White,Aurora and Cinderella all have one thing in common........there princes. I swear Snow White's prince is so bland,so boring his just not that great at all and it was a shame that Snow White hadn't got any screen-time with him except for the I'm Wishing song. Also the ending is a bit weird,like why was the castle up in heaven for anyway?But still having said this I truly loved this movie. Is it the best animated film(well its a yes and no answer for me cause like I said without Snow White we wouldn't have DisneyLand or Euro Disney or anything Disney and our lives well wouldn't be as engaging without the man himself who died in 1966 and now its over by John Lasseter(the man responsible for Pixar in 1995) who changed Walt Disney Pictures to just Disney.8.6/10 B-",8,1,2,31 May 2015
The Lion King," My second favourite movie of all time after Tangled
","What can I say I love The Lion King. From the opening scenes of the sunrise of the African Plains, to the ending this film is brilliant. The story is about a young cub named Simba who's next in line to be King of Pride Rock after his father.But tragically his father gets killed by stampedes by his father's evil brother Scar (voiced by Jeremy Irons)who wants to take over as King Of Pride Rock. Simba runs away only to meet up with two hilarious sidekicks Timon and Pumbaa. They of course tell Simba that his got to put the past behind him and move on with life. As he gets older(now voiced by Matthew Broderick) he meets with his former friend Nala(voiced by Moira Kelly)who is shocked to discover that Simba is next in line to become King.Overall what do I think of this movie well at the age of 22 this movie NEVER fails to make me cry(this was the first ever Disney movie in history to make me cry,the second is Tangled which is hands down my all time favourite movie ever) and to this day TLK never gets old even though its 17 years old its still to this day my 2nd favourite movie of all time. Beautiful Animation,excellent voice cast,brilliant story(even though some people say its a rip off of Hamlet,yeah who gives a hoot). Overall im giving this a solid 10/10",10,0,0,22 June 2013
Inception," One of those films where you only see it once
","Inception is an Academy Award winning movie starring Leonardo Di Caprio,Ellen Page,Tom Hardy,Joseph Gordon Levitt and Micheal Caine and tells the tale of a man named Cobbs (DiCaprio)who is a skilled thief who can enter into one's mind and gain information with each dream that he is in along with his co buddies(Levitt,Page and Hardy). But each dream may cost them their lives. Will they get what they are looking for in the end?
The real star of this movie is the special effects which are very good as it is the sort of effects that would be spectacular in 3D. The acting was great too and the story is good but is the sort that you need to pay close attention too and not leave your eyes off the screen or you will be saying to yourself,what on earth am I watching here.If you are looking for a film that is confusing,mind-boggling or like me a fan of Leonardo Di Caprio then do check it out. For me I wouldn't be bothered watching it again.6/10OK",6,0,3,21 January 2019
Murder on the Orient Express," Actually very good from the man that brought you Cinderella
","Murder on the Orient Express is directed by Kenneth Branagh(who also produced and starred in this film) alongside an all star cast with Johnny Depp,Josh Gad,Michelle Phiefer,Daisy Ridley,Willem Defoe and Judi Dench and tells the tale of Hercule Pirot(Branagh sporting a French accent) who happens to be a detective and is on a case to solve an unsuspected murder on the Orient Express which revolves around Johnny Depp and its up to Pirot to find out who is the person that killed Depp's characther and why?. With outstanding cinematography done by the same man who did Cinderella,and a great score done by Patrick Doyle(again did Cinderella with Kenneth Branagh who also directed Cinderella). This film was actually very good. My main grip is the twist in the end which I can't say but all I have to say is that the audience will be surprised by how many were involved with the murder case.8/10",8,6,18,5 November 2017
The Secret Life of Pets," Just back from seeing this movie. Actually it was good
","The Secret Life Of Pets stars Louis C.K,Eric Stonestreet and Jennie Slater and tells the tale of a dog called Max who lives in NYC with his owner Katie. But when Katie gets a new dog called Duke,Max gets jealous of Duke and tries to get rid of him causing the pair to get lost in New York City. So they team up with a wise-cracking bunny voiced by Kevin Hart and his crew and the two dogs try to find their way back home in time before Katie comes back. SO will Max and Duke find their way back.Parts of this film reminded me of Garfield meets Bolt with a hint of Toy Story involved as the whole premise is what do your pets do at home while the owner goes out of their homes.It was overall a very funny tale and myself and my family all loved it today as we seen in in 3D. Kevin Hart was funny as the bunny rabbit and Jennie Slater(who was the voice of the sheep in Zootopia)was funny as Max's love interest.If you are a dog or cat lover and you love animated films. Then check it out.7.5/10B+Verdict: Not original but it was a solid film nonetheless.",7,7,15,26 June 2016
WALL·E," The most depressing film of all time
",This was on TV last night and I never even heard of it before so I decided to check it out last night. I absolutely hated it and here is why. I saw the 1st 30 mins of this film and I was so bored I could fall asleep half way through. Its basically about a robot who works in a scrapyard in (I think by the looks if it)New York. He falls for a robot named Eve and he is obsessed with some film called Funny girl(you know the one with Barbara Stresland and Walter Mattheu and Micheal Crawford from that old TV sitcom Some mothers do have em. The film had no dialouge like Sleeping Beauty which was dreadful too and I cannot believe that this heap of junk won an Oscar(what is wrong with you people) and 45 awards from other film companies. I never liked Pixar except Toy Story was good but I rather watch the 1990s Disney movies or Enchanted which I loved than this pile of garbage. This should have won worst picture as it was dreadful.1/10,1,7,34,2 January 2011
Finding Dory," My family loved it
","Finding Dory is a sequel to the 2003 hit film Finding Nemo only this time its Dory's story that we get to witness instead of Nemo's(who is now voiced by a different actor since the other actor that voiced him was too old for the part).The story shows Dory having flashbacks about her family(voiced by Diane Keaton and Eugene Levy) and she ends up getting lost. Problem is she suffers from Short Term Memory Loss and can't remember a thing about her family. Fast forward a few years later and Dory(DeGeneres)and her friends Nemo and Marlin,takes part in a school talk about families and Dory figures that she had a family also. But when she goes up ashore(like Nemo in the first movie)she ends up getting taken away by marine biologists and its up to Marlin and Nemo to rescue her again. While she is there at the marine exhibit voiced by Signovery Weaver she teams up with an octopus called Hank(voiced by Ed O Neill) and she later meets a shark called Destiny(who she was friends with since she was a little tadpole). So the question though is this; will Dory find her family again and discover who she really is.The animation was very good and the plot is very familiar to the 2003 version as we see a scene that happened in Finding Nemo and the movie gets very predictable during the 3rd act of the film but still it was very good. Ellen DeGeneres was very good as Dory as she has this humor that is very witty and charming at the same time. For some strange odd reason she reminds me of Meg Ryan in a way as both of them have the same features and they have that same humor.There is also some new characters that I have mentioned that are hilarious especially the whale with the bottle-head and Hank who was very funny.In my honest opinion this is one of my favorite movies of this year next to The Jungle Book and Zootopia,probably in my top 5 list of movies I have seen in 2016. Idris Elba, Diane Keaton and Eugene Levy if you loved the first movie then you should check it out. All my family loved it.Keep an eye out for a very cute short called Piper which tells the story of a cute bird who is afraid of the water. Verdict: Pixar has done it again. Well done.",9,1,8,31 July 2016
The Blind Side," Hands down one of my all time favourite movies with the Brilliant Sandra Bullock in the mix
","OK i've been a huge fan of Sandra Bullock since I seen her in the likes of Speed, Practical Magic,Miss Congeniality and so many more so I had the absolute delight to see her here in this truly moving motion picture. Winner of Best Actress at the Oscars back in 2009 the movie is based on a true story about a man named Micheal Oar who was later brought off by Social Workers from his cracked addict mother along with his brother as it was unsafe for himself and his brother to stay their with her.Fast forward a few years later and Micheal has moved on with his troubled past and is living with a man who helped him get into some sort of Catholic school,but he later tragically died and Micheal has no where else to go as he always runs away from his foster family. Enter Leanne Tuohy played by the brilliant Sandra Bullock who's children Collins and her son Sean Jr attend the same school as Micheal goes to.Micheal of course is struggling with his homework and the teachers sorta give him a hard time as they think that's dumb but his actually not dumb at all. Being such a headstrong housewife she stumbles across him walking in the rain and heading back to the Gym,she demands Micheal where his going and he says to the Gym,but she refuses a No from him and decides for him to stay with her and her doting husband Sean played by former Country Western Singer Tim Mcgraw who I must admit was barely recognizable without his hat and his beard.With Leanne's help Micheal soon becomes an international American Football Player for his school and fights for winning.SO why is this my all time favourite live action movie,well its because of the story I absolutely love the story to this as it moves you and you can sorta root for the charcthers. Sandra Bullock was brilliant as Leanne Tuohy even though she looked hardly noticeable because of her blonde hair which sorta looks alright on her,as for the rest of the cast there brilliant too including Quinton Aaron who is a newcomer as he plays the American Football Player Micheal Oar. The editing was great I see absolutely nothing wrong with this film its one of those movies where you can watch over and over again. Tangled,and A Walk To Remember are also my all time favourite movies so its a privilege to add The Blind Side to my list of all time favourite movies. A lot of people love that film The Shawshank Redemption but for me nah its not my cup of tea but The Blind Side is a brilliant movie.10/10",10,0,2,8 May 2013
The Shawshank Redemption," The most overrated hyped up movie I have ever watched but its good.
","I cannot believe that it took me 17 years to see this movie and was it worth the wait well here's what the film is about.The story is about a young banker played by Tim Robbins who was convicted of murdering his wife and her lover and is sentenced to life in Shawnshank prison where he meets a former crook named Reed played by the brilliant actor of our generation Morgan Freeman. The two become inseparable as they deal with prison life and the guards betting the HELL out of some of the prisoners; one got killed to death by the guard while the other hanged himself to death.Everyday they have to dig up holes and eating disgusting food, but will Andy(aka Robbins)ever get out of prison and did he really kill his wife and her lover in cold-blood?Bottom line is this; I'm 22 years of age a female who hates watching these kind of movies as there really not my cup of tea,I'm sort of a romantic/fantasy/cartoon/drama/weepie kind of chick and I hate watching violent movies,but this movie was really good;but seriously is it the best movie in the world? well for me its not in fact its all about dealing with prison life and the whole motto is get busy or die trying. Overall I did enjoy this movie but I wouldn't be watching it again. Once is enough for me.SO I'm giving it a 7.5/10",7,0,1,29 June 2013
