movie_title,title,review,rating,helpful,total,date
Gone Girl," If Fincher was looking to out do himself...he has succeeded.
","Gone Girl marks Fincher's tenth feature film and his most mature work since Fight Club. Centering on Nick Dunne, a husband desperately trying to find his wife all while having police and media accuse him of murder. The story sounds straight out of the Scott Peterson case and the film looks unlike any film I've seen in recent years. Lead by an all star cast featuring Ben Affleck, Rosamund Pike, Tyler Perry and Neil Patrick Harris, Gone Girl rises above the pack with smart storytelling, phenomenal pacing and perfect performances. What Gone Girl does so brilliantly is taps into the audience's psyche regarding marriage and the ideology behind a sanctioned union that is corrupt. It is really heavy stuff when the story really gets to the meat and bones of it all. With plenty of twists and turns, Gone Girl keeps you, not only second guessing the whole idea of marriage, but the intentions of every character in the film. It is truly one of the most twisted films adapted from an even sicker and twisted book that's out there right now. Gillian Flynn does wonders with her adaption from her own novel. The dialog is crisp, the characters are multi-layered, it truly is a pitch perfect script that doesn't have one false moment in it. Ben Affleck and Rosamund Pike are EXCELLENT in this film. This is a different Affleck, a very human and realized Affleck. Nick Dunne is a wonderful role for him and captivates just how good he can be with a terrific director. Harris and Perry give well rounded performances as well but are nothing compared to Affleck and Pike. David Fincher and his long time collaborator and cinematographer, Jeff Cronenweth create a dreary, horrific tone for Gone Girl that makes every twist and turn that much more gut wrenching. Every shot is meticulously planned, showing each shot as if it were a still frame that spoke a thousand words. It is truly gorgeous filmmaking. And now for the score...Trent Reznor and Atticus Finch deliver a perfect score, besting their Social Network and Girl with the Dragon Tattoo score. If Reznor won for Social Network, I fully expect not only a nomination but a win for this film. Overall, this is a mesmerizing film that demands multiple viewings to truly get the full experience. It is impeccably made, beautifully acted and an all around near perfect film.",10,429,772,1 October 2014
Get Out," While the film does boast some talent, the film itself wallows in self importance.
","Let me start off by saying this: Get Out is far from a bad film. It is genuinely frightening at times and, dare I say, even genius at some moments. But the film's biggest problem is that it knows it is a step above other horror films and it reeks of self importance. When you take into consideration the political climate in America, Get Out is a film that is hitting at a right time. It is tackling white liberal racism in the upper middle class and it does a very good job at making its point. However, as the film goes on and the scares become more frequent, the film starts feeling cheesy and overwritten even if the performances are truly stunning.Director Jordan Peele makes the most out of his cast. Daniel Kaluuya gives a truly magnificent performance as Chris while Bradley Whitford and Catherine Keener are utterly horrifying as the Armitages. However, Allison Williams is a weak link and is very dry in her delivery which makes her performance comes off as wooden. She is the weak link and it isn't hard to figure it out especially in her scenes with Kaluuya. The story progresses and Williams' performance is slowly twiddled down which then leaves the glaring issue of the script. While the characters in this film are really layered and relate-able, the story they are in is so overwritten and self indulgent that it is hard to consider this the horror gem many critics and audiences are calling it.The idea of a great horror film is to thrill and scare while making a social commentary. We look back on such films as Rosemary's Baby, Night of the Living Dead, Friday the 13th (maybe), Halloween...these films have weight to them and you don't know it until it's over. With Get Out, we know this is a film with political undertones, we know it wants us to think this is something more than a horror film. In some regards it is, but in most it is just a horror film that thinks it is more important than it actually is. This takes from what Peele is trying to achieve with directing a horror film. Everything comes off being very tongue-in- cheek instead of being straight horrifying and that is probably the most disappointing factor with Get Out. Instead of sinking these political undertones in the writing, Peele makes them abundantly clear and it ends up taking away from a film that is, otherwise, pretty good.Get Out is a step above your average horror film and features some pretty amazing performances. Despite this, the film suffers from a very weak script that will feel as if you're being hit over the head with political banter rather than having the sh*t scared out of you. Overall, I was pretty disappointed in Get Out but the film does feature some awesome performances and some genuine scares that will be enough to make you wish the film was better.",7,37,93,23 February 2017
Drive," One of the best films of the decade
","Nicolas Winding Refn's hyper stylized vision, Ryan Gosling's darkly timid hero, Newton Thomas Sigel's flawless cinematography, these are the key components to Drive that make it one of the best films of the decade. Drive tells the story of a mysterious and nameless hero who is embroiled with the underbelly of the LA mob all while falling in love with his neighbor. In a nut shell, this is two films in one. The first half of the film focuses on Driver's relationship with Irene (Carey Mulligan) while the second half is a livewire crime thriller that never lets up. The beauty about this is Refn strikes the perfect balance between telling the love story and telling the real story, this setting up motive after motive in a grand finale that is unforgettable. There isn't a 'strongest' player here, everyone involved, both the actors and the crew, are at the top of their game. Some of which have yet to achieve this level of greatness even four years later. Ryan Gosling delivers a performance likened to De Niro's Travis Bickle. He is quiet and timid but taking one look at him, you can tell that there is a rage building up in him. Gosling does an amazing job in this role and its hard to take your eyes off the screen with a performance like that. The supporting roles are equally colorful, Ron Perlman, Albert Brookes, Carey Mulligan, Bryan Cranston and Oscar Issac are all magnificent here. An especially excellent turn by Albert Brookes makes him one of the most memorable villains in a crime film. Bernie Rose is evil, manipulative and psychotic but Brookes plays him with a certain sense of entitlement that makes it hard for you too look at him for too long because you're that afraid of what he might do next. Refn plays with silence much like Stanley Kubrick and some scenes even feature a Kubrick-ian feel to it all, it is engrossing and thoroughly enjoyable. Overall, Drive is a modern masterpiece that is beautifully shot, excellently acted and an all around amazing film.",10,1,2,13 February 2015
The Theory of Everything," Redmayne and Jones are excellent in this heartbreaking love story.
","The Theory of Everything tells the uphill struggle that world renowned genius Stephen Hawking went through when dealing with his, now, infamous disease and trying to maintain his relationship with his loving wife, Jane. The strengths of this film rely solely on Eddie Redmayne and Felicity Jones. These two actors are absolutely, one hundred percent, PHENOMENAL in these two roles. Stephen Hawking is the role that Redmayne was born to play. Hawking is portrayed as a charming and intellectually superior individual that behaves just like any one else. After a bit, we start to wonder what was every so amazing about him...then the heartbreak starts. Jane Hawking is a sweet, loving and determined person that will go to the lengths of the universe to make sure her husband, Stephen can survive. I get chills just thinking about certain scenes, some of which will most definitely be requiring a large box of Kleenex. The truth is, anything that I say here about these performances, no matter what it is, is still criminally underselling the sheer brilliance of them. Eddie Redmayne and Felicity Jones are simply incredible and I'd be even willing to go to the extreme to say that both actors will not only be nominated, but I'd be surprised if they didn't win the Oscar gold. Now, with that being said, this film's structural issues are severely hampering this film's chances at being a classic. I wasn't completely sold on the structural integrity of the film. It showed enough of the relationship aspect behind Stephen and Jane but it very briefly touched base on Hawking's intellectual discoveries and I thought that if it was a bit more balanced in that respect, it would be a near perfect film. One plot point that I did find utterly enthralling is the idea that Hawking struggles throughout the film to do simple things. These scenes are, by far, the most heart wrenching scenes to watch. James Marsh directs his actors effortlessly and can evoke the type of emotional response out of his audience through them, but when left with telling a story, Marsh falters. Marsh, known for 2012 IRA drama, Shadow Dancer proves that he is an actor's director. He cares about human drama over anything in a tangible sense, which benefits this film greatly but also harms it in the way of progression. Despite these minor infractions, The Theory of Everything is a film that everyone can enjoy and turns into a real audience movie. It is a film that will have you laughing one minute and crying the next, no easy feat for any film, and this one does it effortlessly.",7,96,123,11 November 2014
The Amazing Spider-Man 2," Watch the 34 trailers they have out and you've seen it already.
","The Amazing Spider Man 2 is something that falls short of its predecessor, and hits every branch on the way down. The action is loud, the acting is obnoxious, and the overall story is so jumbled and fractured that it is hard to keep track of what is going on. Andrew Garfield delivers a solid performance as Peter Parker while Emma Stone, Jamie Foxx and even the great Paul Giamatti fall flat...right on their faces. Marc Webb confidently directs his action but leaves the actual story and character development for the sidelines. While it is far from the most important thing a Spider Man movie should have, it would have been nice to have a coherent storyline to adhere too. The technical aspects of the film are somewhat mediocre, the CGI effects often look cheesy (ie. Jamie Foxx as Electro), the editing is very choppy and jumbled. This makes for a frustrating watch to say the least. I would say the biggest problem I had with this film was Dane DeHaan. DeHaan is a gifted and talented individual...but this film makes him look like a soap actor. Marc Webb seemingly fails to direct him as Harry Osborne with any confidence or competence, either or, it remains as the most disappointing and frustrating aspects of this film. Overall, the kids are going to enjoy this one, which isn't saying too much. Between the dozens of trailers they released online, when you walk out of Amazing Spider Man 2, you'll see every beat coming from a mile away. If you have kids, they will love this film and be thoroughly entertained...if you have a brain, you might want to switch it off when watching this and try your hardest to enjoy it because I know I didn't.",5,8,17,2 May 2014
Hidden Figures," A film so concerned with being a political statement that it forgets to be a good film.
","Hidden Figures tells the story of three African American women in the late sixties as they become instrumental to NASA in putting John Glen on the moon. Directed by Theodore Melfi and stars Taraji P. Henson, Octavia Spencer, Kevin Costner and Kirstin Dunst, Hidden Figures would be a good film had it not been so concerned with the idea of the empowerment of women that it forgot to be a good, engaging film. It has the proper ingredients to become a heavy hitter but trades it in using its excellent cast as more of a political statement than anything else.The film starts off by introducing us to Katherine Johnson, Dorothy Vaughn, and Mary Jackson (Henson, Spencer and Janelle Moàne) in almost the exact same ways. We see that Katherine is a number cruncher and a brilliant woman all around...then the exact same character traits are rehashed for Spencer and Moàne's characters. There is nothing different between the women, there are 3 of the same character in one film. The only difference between the three is Taraji P. Henson's excellent performance that makes her thoroughly enjoyable throughout a film that would have been a direct-to-digital film otherwise. The film does very little to give any development to these women and keeps drowning us in the notion that 'this is girl power.' It became extremely redundant after awhile and left me waiting for the film to get serious but it never did. This is a film that is more about what the characters did rather than how and why they did it.Overall, Hidden Figures is a bland film with paper thin characters that tries to make more of a political statement rather than make a good film. This is a perfect example of political climate affecting creative endeavors. If there were anything I could say it is: if you're going to see the film, see it for no other reason than Taraji P. Henson's excellent performance. Taking her out of this film in any way, shape or form would have probably stopped this film in the development process but then again, maybe that is where this should have stayed.",2,262,533,29 December 2016
Guardians of the Galaxy," Fun, campy and wildly entertaining. One of the best Marvel films to date.
","Guardians of the Galaxy plays out like Star Wars on crack, its fast, ferocious and a badass entertaining thrill ride throughout. Following a rag tag group of intergalactic criminals, Guardians has the plot line of a Star Wars film, the characters of a Dirty Harry film and the action of every Marvel movie combined. What makes this film stand out from the rest of the Marvel films is that it engages you knowing that you have absolutely no idea who or what the hell this is. It does a great job filling you in with information from the comic and it makes for an enjoyable watch. Unlike the fans of the comic, I had no knowledge of Guardians of the Galaxy and walking out of it, it really educates you on anything you may have missed out on all while giving proper character growth and development without heavily relying on the comic books as 'common knowledge'. Chris Pratt is awesome in this film, he reminds me a lot of Indiana Jones in space. He's a wise cracking, ass kicking criminal that can beat with his words or his fists (more times than not, its his fists). Dave Batista, Zoe Saldana, Michael Rooker, Vin Diesel, and Bradley Cooper along with Pratt gives Guardians of the Galaxy a better cast than Avengers. The film comes at you like a bullet train thats about to derail, you're always engaged with these characters despite most of them being an alien, a talking tree or a talking raccoon. The film is really amazing in that you look at these characters and the ridiculousness of the situation and still don't even question it. Now there are some plot holes that will more than likely be cleared up the Marvel way, meaning down the line something will happen to patch up a couple holes here and there. While that may prove to be lazy writing, I think Marvel films have now earned the right to do whatever the hell they want. Guardians of the Galaxy is a great comic book film and this is coming from someone who was so apprehensive about seeing this film that I almost didn't go. This is a surprising, entertaining, gut busting thrill ride that is impossible to disappoint especially to fans of the Marvel universe and franchises. But even if a superhero movie isn't your thing, I'm confident enough to say that you'll have a great time seeing this movie. It is that good.",9,6,16,30 July 2014
The Imitation Game," Cumberbatch is terrific but the film itself is a jumbled piece of storytelling
","Alan Turning, the man, the legend...he single handedly built the world's first computer and helped win WWII for the Allies due to his discoveries only to be sought out as a spy when in reality the only double life he was leading was that of a homosexual. The Imitation Game chronicles his discovery and his ultimate medical torture as British Parliament tries to 'rid him' of his homosexuality. This is a heart wrenching biopic that really is a mere showcase of how good Benedict Cumberbatch is as an actor. Despite this very talented showcase, The Imitation Game achieves very little during its two hour runtime other than letting us know, sometimes a bit too heavily, that Cumberbatch is an amazing actor. Working from Graham Moore's impeccable BlackList script, Morten Tyldum tries to make this film more of an espionage thriller but it couldn't be further from that. The Imitation Game is a character study and straight biopic that falls into the well treaded clichés that make up the genre. The story is slow moving, and extremely jumbled as it jumps from 1951 to 1939 a little too often, making it very hard to end up caring about each storyline in their own rights. While I commend Tyldum's work here with his actors, he misses the mark in telling this engaging story. Instead, he throws most of the load on Cumberbatch. Any other actor would have probably crumbled under such pressure but Cumberbatch rises to not only give the performance of his career but the performance of a decade. Cumberbatch as Turning isn't very likable, but he is articulate, shy and extremely intelligent and Cumberbatch uses that to his advantage. His performance as Turning is somber, articulate and intelligent, much like the man he is portraying. It is a marvelous performance that makes the film worth watching based solely on that. The supporting cast is decent here, Kiera Knightley is very good in this film as she plays Joan Clarke, a woman that tries desperately to get close to Turning throughout the course of the 1939 storyline. Other actors include Matthew Goode, Charles Dance and Mark Strong. Each of them are decent in their roles but pale in comparison to Cumberbatch. Overall, while The Imitation Game may have one of the best performances of the year in it, it doesn't make up for its jumbled narrative.",6,2,7,22 January 2015
Prisoners," Brilliant Performance on top of masterful film making, the best film of 2013 thus far
","At first glance, this film will strike many people as a typical Hollywood revenge film resembling the likes of Death Wish and Payback. However, that is furthest from the truth. Prisoners packs one hell of a punch, giving the audience not only something very entertaining, but also something very human in the process. The film plays out more like Seven, Zodiac and Mystic River, allowing the audience inside the mind of Keller Dover, a man searching for his daughter while teetering on the brink of insanity. The story kicks off when the Dover and Birch families are celebrating Thanksgiving. What seems like a normative celebration quickly descends into a frantic search for two young girls. Detective Loki (Jake Gyllenhaal)arrives at the Dover house after the abduction and soon finds a suspect in Paul Dano's character. But as time passes without finding the girls, Dano is finally let go. Much to his dismay, Keller Dover takes matters into his own hands and kidnaps the suspect, subjecting him to brutal torturous methods as he searches for the truth in finding his daughter. What makes Prisoners so well crafted is the performances from Hugh Jackman and Jake Gyllenhaal, both of whom are at the top of their game in this film. The chemistry between these two actors is impeccable, bringing a natural presence to the screen. The supporting cast, including an unrecognizable Melissa Leo, is superb. Viola David, Maria Bello and Paul Dano also give caliber performances, and keep the film entertaining just on their performances alone.The story keeps moving and moving and never slows up despite a two and a half hour running time. While that seems like a deterrent nowadays for most audiences, this film is good enough for anyone to sit through happily and be able to walk out of the theater satisfied with the final product. This is a heavy hitting movie that Hollywood very seldom makes. It is rooted in classic revenge films from the golden age of Hollywood while introducing new style and substance, making for a truly intriguing watch.If there's any film that you should see right now, trust me, it is most definitely Prisoners.",10,7,15,20 September 2013
Logan," If there was ever a comic book movie deemed worthy of perfect, Logan is it.
","The word 'perfect' is very objective especially when it comes to film. While Logan may not be a perfect film, it is most certainly a perfect comic book film. It is a masterpiece of the most epic proportions and leaves us with a brilliant swan song for producer and star Hugh Jackman in his final outing as Wolverine. The film, directed brilliantly by James Mangold, is a two plus hour comic book fan's wet dream as we see the version of Wolverine every fan has wanted to see for nearly two decades. While many will be very sad to see Jackman step down from the role, he couldn't have picked a better or more satisfying film to end his cinematic legacy with.The film takes place in 2029 and shows the world in shambles. Mutants are nearly extinct, water is scarce and the world is just an overall wasteland. This is where we find Logan. He is a limo driving cantankerous caretaker to an even more cantankerous Professor X, who is now suffering from dementia and seizures. He is a borderline alcoholic suffering from a mysterious illness that limits his mutant abilities. Due to this, he lives this quiet life until he meets a young girl who he feels he must protect. Without giving too much away, there is much more here than I can go into but I will say, if you are a fan of the Wolverine comics, this film will bring a tear to your eye. This is probably the most faithful adaptation of a comic book character EVER, Marvel and DC combined. The way the story goes, the way Logan behaves, the selflessness and the rage, this is an all around realized version of this character. While it may have taken a little longer than it should have, this film was worth the wait. James Mangold does a fantastic job at creating the world Logan knows now. This is more of a film like Mangold's 3:10 to Yuma. It is bleak, violent and absolutely heartbreaking. This is far from the PG-13 character we're used to. This is a foul mouthed, miserable and very VERY bloody rendition of the source material. This is a film very much like The Guantlet or Badlands, a crime thriller and on-the-road drama. It very much embodies the look and feel of a film from the mid-70s and it plays to this very well. The performances in this film are amazing. Hugh Jackman's performance here is the best as the character and may be one of the best of his career. He is miserable and broken in this film and to see him like this as the character, it is bittersweet especially because Jackman has been so attached to this role. If he hurts, we hurt. If he's mad, we're mad. It is a true testament to Jackman as an actor to make his audience feel this connected to someone who is, by traditional standards, completely unrelateable. Boyd Holbrook brings a sinister performance to this and continues to build a very impressive resume. Holbrook is someone who you'll love to hate. The real standout performance here is from Dafne Keen who plays Laura. Without giving away any spoilers, she is BADASS in this film and even gives Logan a run for his money on the brutality.Overall, Logan is a perfect comic book adaptation that is as heartbreaking as it is visually stunning. Mangold and Jackman create a special film with this that should be talked about for years to come. Believe the hype, Logan is a seriously amazing comic book film that just may be the best ever made and embodies the definition of a perfect adaptation.",10,426,733,23 February 2017
