movie_title,title,review,rating,helpful,total,date
Selma," A good MLK biopic that could have been great.
","Selma tells the story of Martin Luther King as he organizes the infamous marches during the height of the civil rights movement. To be fair, Selma is a good film. It isn't a great film, but it is good. David Oyelowo gives a great performance as MLK despite feeling like a bit of a miscast but it isn't enough to sustain interest in his character, which is shameful considering the great and brilliant man that he is portraying. All in all, Oyelowo doesn't pack the punch that we all want to see out of a MLK based film. At 122 minutes, this film wallows in cheap drama surrounded by some serious heavyweight performances, it creates an uneven balance between what is great and what is mediocre. Actor Tim Roth does great work here in portraying the ruthless and racist George Wallace. Roth delivers an evil performance that will turn your stomach with every syllable that spews out of his mouth. Roth does a great, outstanding job in making you hate him and I definitely give him high praise in this film. Another stand out performance is Carmen Ejogo, who portrays Coretta Scott King with such honesty and velocity that she's hard to ignore. Ejogo's performance is one that I continuously am thinking about even as I'm writing this. The supporting cast is huge in this film, featuring Tom Wilkinson, Cuba Gooding Jr, Giovanni Ribisi, Common and Oprah Winfrey. But just because the star power is here, doesn't mean they're all good. Honestly, the supporting cast outside of Tim Roth and Common are mediocre at best. Oprah Winfrey delivers a performance that we've seen multiple times over the course of her acting career. It is nothing new, especially because it feels she is just rehashing the same performance from last year's The Butler or from the much superior The Color Purple. Winfrey serves as more of a distraction than anything else. Common is awesome in this film in a small but crucial role to what Oyelowo's King wants to achieve. Common proved before that he can act, but here, he proves that he isn't just another rapper turned actor, he really delivers force to this film with blunt and swift justice. The screenplay here is Selma's downfall. Written by first time screenwriter, Paul Webb, it really feels like Webb's first rodeo, making classic first time mistakes between cheesy dialog and long drawn out scenes that, in retrospect, serve little purpose to the film as a whole. Despite these issues with the screenplay, it was in the most capable hands possible for this film...Ava DuVernay. While there are major pacing issues with the film, DuVernay directs this with a determined efficiency that oozes out of every second of the film. While this can't save Selma from falling casualty to a lot of cliché scenes and cheesy dialog, she does make up for all of what's wrong with the film with a handful of great performances and awesome cinematography. Overall, Selma is nowhere near the Oscar contender that I wanted it to be nor is it the biopic that a man as great as Martin Luther King, Jr deserves but Selma is a decent film that reminds me more of Spike Lee's 'Malcolm X' or Lee Daniels' 'The Butler' rather than last year's instant classic '12 Years a Slave'. It's a good movie, nothing more, nothing less.",4,149,241,9 December 2014
La La Land," An Exercise in Classical Hollywood Filmmaking
","La La Land, the wildly beloved Oscar frontrunner, is just as mystifying as critics and audiences said it was. The sweeping cinematography, the perfect, strategically placed lighting, the performances, the dance numbers...it all makes La La Land exactly what people were NOT expecting out of 21st century musical. This is a mystifying burst of classical Hollywood filmmaking. To that effect, there is nothing new rather just a new voice to an old dialog. Directed by Damien Chazzelle, La La Land is an analytical odyssey of the price of fame as told through the eyes of two big dreamers, an aspiring actress (Emma Stone) and a struggling Jazz musician (Ryan Gosling) as they coast through life in Los Angeles. Emma Stone and Ryan Gosling are fantastic in this film. Emma Stone gives a career best performance and seems to be riding the same prestigious wave she caught with 2014's Birdman. Gosling is equally great but we've come to expect this type of performance from him. The charismatic dreamer with a golden tongue fits Gosling a little too well at this point even if he does it better than any other working actor in Hollywood. While the film is well acted and the choreography in the dance numbers are mesmerizing, La La Land is still a hard film to recommend to anyone not already gung ho for musicalsDespite being toted as the best film of the year, La La Land is exceptionally underwritten. Trading great storytelling for grand musical numbers that are expertly planned and executed, Damien Chazzelle knows the film's strengths and weaknesses. While he plays off of the film's strengths in an expert fashion, he does very little to cover up the film's number one weakness: its script. However, despite this being a weakness, Chazzelle does a wonderful job at making us forget the problems and sinks us into enjoying the film for what its worth.Overall, La La Land is most certainly an ambitious yet flawed musical from Damien Chazzelle which proves that Whiplash was far from a fluke. Featuring a career best performance from Emma Stone and brilliant camera work along with excellent choreography in its musical numbers, La La Land is a film that will most certainly leave you feeling satisfied even if it doesn't hold the lasting power of Whiplash.",2,1,6,3 December 2016
Snowden," A cold and rather banal addition to Oliver Stone's filmography.
","Snowden tells the story we already know so much about and yet, the film treats it as if we know nothing. Oliver Stone's latest political protest of a film results in a ridiculously boring and rather banal addition to his once colorful but now lackluster filmography. The film starts by introducing exactly who Edward Snowden really is. He is a solider, a genius, and someone who, very much so, cares about his country. He is eventually hired by the NSA and the rest is history. First off, the film does nothing for Snowden other than paint him as more a patriot than anything. All personal opinions of the man aside, I'm strictly judging the character in the film. Even then, this film paints him as more a patriot than Clint Eastwood did for Chris Kyle. It becomes ham-fisted in its delivery and ends up really making for a cold film especially after what happens to him. Rather than going into what makes this film the way it is, I'll put it very simply: the film is not very good. The film is not good as a biopic and it is even worse as a political thriller. What starts off as possibly giving us, at the very least, an entertaining neo-political thriller it quickly turns into an assault on the US government. Again, I'm far from willing to interject a personal opinion in this but my opinion on the film is that it feels as though Oliver Stone wanted to make an anti-political propaganda film that is dressed up like a thriller. That is exactly what you will get when seeing this film. It does nothing in the way of expanding dramatically on the far superior CitizenFour and it does nothing to keep you engaged as the runtime slowly ticks by, giving nothing to the audience in the way of the audacious film that we deserve on such a hot button subject matter such as Edward Snowden. Now, with that being said, there is some good in the film. The performances here I found to be quite solid. Shailene Woodley gives a very good performance as Lindsay Mills, Edward Snowden's curious and worrisome girlfriend. Joseph Gordon-Levitt gives a fine performance as Snowden but more so nails down his voice rather than his look and mannerisms, both of which came off as parody- esque to me. The supporting cast is filled to the brim here, starring Melissa Leo, Zachary Quinto, Rhys Ifans and Nicholas Cage to name a few. Each of the supporting cast members give their best with what they're dealt with. Cage is also a very good (and very brief) side actor that almost steals the film, not because he is particularly ground breaking in the film but because it is Nicholas Cage. If anything, it felt distracting but I didn't mind with all things considering. By the time the film ended, it left me with nothing more than the feeling of being watched. It won't let you feel the drama or the weight of it all, it will leave you beaten down in the worst way because it feels like the equivalent of two people having a heated political debate in ear shot of you and all you want to do is tell them to 'shut the f- up'. Overall, Snowden is a lop-sided political thriller wearing its agenda on its sleeve, reeking of the very idea that Oliver Stone never had the best interests of the film at heart. If you are a hardcore fan of Oliver Stone or if you have never seen Citizenfour then Snowden might be a safe bet for you, otherwise, this is merely a rental at best.",4,29,77,14 September 2016
Beauty and the Beast," When All is Said and Done, Everyone Deserves a Better Film Than This.
","The highly anticipated release of the live action remake of Beauty and the Beast had all the ingredients of a future classic. With the animated film approaching it's 25th anniversary, the hunger for something like this is unfathomable. Yet, when the lights go on and the credits roll, I was left feeling like I was swindled. The Bill Condon film looks and sounds beautiful but the film is very thin in live action form. Emma Watson is woefully underselling as Belle and Dan Stevens does the best he can under the CGI-laden Beast. There are many issues with the film at the heart of it but one thing sticks out like a sore thumb: the complete and utter lack of originality.The film does nothing in the way of introducing anything new to the age old story. The film is literally almost a shot for shot remake of the animated film. While die hard Beauty and the Beast fans along with their kids will probably enjoy the film, those looking for an extra layer will leave sorely disappointed. Despite this, the film does offer some explosive moments of action that are extremely well choreographed along with Josh Gad's wonderful performance as the comic relief that, despite his performance being marred with controversy, ends up being one of the stand-outs of the group. Then there are the musical numbers and these renditions are just as magical as it was in the 1992 animated film. They're infectious little numbers that are bound to be hummed for days after seeing the film. Despite these very positive attributes, the film just misses the mark and never rises to be more than just another remake.Overall, I was very disappointed by Beauty and The Beast. I thought Bill Condon's best work is left to be desired, the two leads are very much so miscast, and the film offers nothing new in the way of a remake. However, if these things don't bother you, it is still a good family movie that can entertain for a solid 2 hours but will do very little outside of that. Is it worth going to see in the theater? No but if you have kids, chances are you're going to be dragged to it anyway so just try and enjoy it for what it's worth.",5,98,199,16 March 2017
Guardians of the Galaxy Vol. 2," It doesn't deliver like it should but that doesn't mean you won't have fun.
","Guardians of the Galaxy was a surprise hit in 2014. No one expected the film to do the business it did, especially me. However, the film delivered on every single thing you would want out of a summer blockbuster. It had heart, action, comedy, thrills and the right slice of drama to make it a little better than your average summer film. Now, fast forward 3 years and we've got its much anticipated sequel. Many fans will absolutely love this film and rightfully so. James Gunn has done a great job with these two films and it will definitely be enjoyed even if it is half the measure of the first film.First off, the movie is good. It is light, funny and definitely digestible. There is not one moment where you find yourself lost or wondering what is going on. That is a definite plus for a sequel. Sure, having a handle on the source material or, at least the first film, will help but it isn't really needed. Considering there has been a plethora of Marvel Universe films since Guardians of the Galaxy, not needing to brush up on some plot points is a good thing. While I could easily go into a 10 page essay on this film and its quirks and why it works, I am giving a short, sweet spoiler free review here. So, in short, the film itself is a decent sequel to a great movie.The cast returns and delivers even more banter and jeering at each other than the first film which adds to the characters. Chris Pratt and the voice work of Bradley Cooper really tie this film's characters together. Supporting cast members such as newbie to the series, Kurt Russell or seasoned alumni Michael Rooker, all deliver with Rooker giving a career best performance here. The man is so good in this film, you forget which side he's on. It's not that you love to hate him. It's that you can't wait to see what he does next. The film's strong point is its cast and James Gunn knows it. He uses it to his complete advantage. We care about these characters, no matter how other worldly they end up being. That is a true testament to James Gunn as a director. He really does an amazing job both as a filmmaker and screenwriter. But, no matter how good of a job he does, the film is a bit of a mess at times.Now for the problems it has...there are quite a few. The biggest issue facing this film is that it is too similar to the first. There isn't enough to distinguish it from the original and that is a bad thing at times. It doesn't allow for the freshness and inventiveness that the first one had and that was where a lot of its magic happened. Truthfully, the only way to distinguish both films apart are the soundtracks. While both soundtracks are awesome, they're both different in a lot of ways. From Blue Suede to Fleetwood Mac, that's the big difference musically...but visually, it's more of the same. That's probably the biggest and only complaint that I have with this film. As much as I like seeing these guys and gals kick some otherworldly ass, I still wish there was just a little bit more to it than what we got.Overall, Guardians of the Galaxy Vol. 2 is a complete rehashing of the first film with a new character here and there and a revamped soundtrack. While many will be happy with the end product, those of you who are wanting something fresh and new will have to holster those expectations. The film is definitely a crowd pleaser and will go over quite well with audiences and fans. At the end of the day, I think that is all James Gunn and Co could dream of getting.",7,0,4,4 May 2017
American Made," American Made is conventional Hollywood biopic filmmaking
","American Made tells the story of Barry Seal, the pilot who transported drugs for Pablo Escobar from Columbia to the States. Seal was a crafty, good looking guy with a golden tongue that allowed him to operate as freely as he did. But just as crafty as Seal was, he was a daredevil. While Seal's life story is surely interesting enough to sustain a film, American Made is merely tipping the hat at conventional filmmaking and never really tries to do anything different to distinguish it from other crime films. And being directed by Doug Liman makes it feel like that much more of a missed opportunity.American Made, while being conventional, is also very watchable. Tom Cruise brings everything Tom Cruise to the role where it is hard to distinguish whether Barry Seal was actually like this or if Tom Cruise thinks he is still playing Ethan Hunt. For me, I didn't see anything distinguishable from Cruise other than a half baked accent. This is especially frustrating because Tom Cruise can act and he can act better than most working actors. The problem is, his film choices have limited him to one liners and bombastic stunts. Not that I don't appreciate his work, I simply don't appreciate it in this film because it feels like Cruise is just getting by. I think he was an absolute miscast. The rest of the cast does well but we barely see them enough to make an opinion of them as we are with Seal for the majority of the movie which becomes exhausting.Overall, American Made is a very conventional crime drama that makes sense for Hollywood to make. Unfortunately, those looking for a dark and gritty telling of Seal's life will be sorely disappointed as the film is the definition of conventional and plays rather light despite its dark ending. Tom Cruise makes the best out of his role and makes sure that he has more fun than anyone else...including its audience. American Made is a taxing film that relies on the star power of Tom Cruise rather than relying on the heft of its true story to carry it.",4,10,27,11 September 2017
Jersey Boys," Melodramatic, gloomy and moody, Jersey Boys disappoints
","Jersey Boys tells the story of Frankie Valli and the Four Seasons as they shot from neighborhood kids to super stars with perfect voices. This a been there, done that affair that rarely catches your attention. Outside some very well acted scenes with Christopher Walken and classic Eastwood framing, Jersey Boys is nothing more than a failed musical adaptation for the big screen. To start, the actors all come from the stage and carry that style of acting to the big screen. Everything is bright and bold in their performances, and the film's cinematography paints a rather dull and dreary sense of reality. The cinematography, while fitting for a thriller of some sorts, its wildly out of place here. That heavy white lighting, foggy filters, that dreadful sensibility we saw in Hereafter and J. Edgar are all carried over into Jersey Boys? It doesn't fit, not in the very least. As far as this being a Clint Eastwood directed picture, it is surprising considering this is just plain and simple, not a good film. Eastwood can definitely direct, we've seen proof of this as he has delivered some instant classics our way...however, Jersey Boys is one of his lesser films. Quite frankly, if this is one of his lesser films, that's okay because this film is far from a train wreck. There are things to like here, some humor sprinkled about and some decent drama keep this from being a total wash up but overall, is this the film everyone wanted it to be? Not by a long shot. The film feels long and under cooked and never really goes to where Dreamgirls or Rent took us. Jersey Boys is not a great film, it is barely even decent but if you are a fan of the Broadway musical, you may let it slide.",5,6,27,23 June 2014
Whiplash," JK Simmons is the ONLY reason to see this
","Whiplash chronicles a jazz drummer's tumultuous relationship with a volatile instructor. While this is well acted and shot beautifully, Whiplash fails to catapult itself to greatness with bogging down its story with rather wooden supporting characters and a slow as molasses storyline. Whiplash tells the story of Andrew, a jazz drummer coming into a cutthroat art school and his instructor, Terrence Fletcher, an off the wall and emotionally abusive instructor. The strengths of Whiplash lie solely in the hands of J.K. Simmons. Simmons delivers a tour de force performance, turning a fiery rage into something inspiring for our lead, Miles Teller. Simmons has some truly great scenes, spouting off profanity laced rants when trying to bring out the best in Andrew. The scenes with Simmons send the film into overdrive, making you want to know what happens next. However, this feeling of excellence on screen quickly turns into boredom as we see Miles Teller try to captivate us the same way his co-star did and falters. At the end of it all, this comes down to talent. J.K. Simmons sets a high bar for his co-stars, and this actually ends up hurting the film because of his performance. Miles Teller seems as if he can't keep up in scenes with Simmons and rather than captivating us with his relentless drumming until his blood hits the sweat filled drum kit, it actually ends up feeling as if he is trying too hard to top his co-star in regards to intensity. This creates for an uneven film, one that never truly becomes the masterpiece it wants to be. Despite these lesser qualities, Whiplash does feature some truly great scenes of Simmons berating his students with some of the best delivered insults this side of Full Metal Jacket. Damien Chazelle does showcase his talents, lingering on the physical and emotional tolls that the environment takes on Andrew and other students. Despite this quality, Chazelle fails to connect his characters to his audience. But one thing that won't be lost in translation is where these characters are and how competitive it is. Quite honestly, I feel this worked better as a short film. There is simply not enough for audiences to latch on to or enough for them to care about. But one thing is for sure, J.K. Simmons is ON FIRE in this film and delivers one of the best performances of his career.",8,9,24,5 October 2014
The Wolf of Wall Street," Goodfellas meets Wall Street, its one helluva ride.
","To say The Wolf of Wall Street isn't the best Scorsese film would be accurate, it doesn't even crack the man's top five films. But, with that being said, Scorsese is THAT good that saying this isn't his best film just means it is the best of the year and not of the decade. This film is insightful, poignant, and downright hysterical from start to finish. It leans more towards Scorsese's comedy genre, much in the vein of After Hours with a little smidgen of Goodfellas and Casino added to intensify the film high you get when you watch this. The Wolf of Wall Street is a roaring film with energy to spare and performance to marvel at. Martin Scorsese directs yet another unforgettable performance from DiCaprio and gives Jonah Hill a high point in his career. Between all the Quaalude, cocaine, and hookers, there is a Greek tragedy playing out before our eyes. Belfort goes from being the top broker/criminal at his firm to being a drug fueled, yuppie with high minded ambitions that always seem to have a funny and hysterical way of falling through. The film is a chronicle of his rise and fall and clocking in at 3 hours, you barely feel it. The film is so energetic in telling this story that it is hard to look the other way even when we are exposed to characters smoking crack, popping Quaalude like Skittles and snorting more cocaine than Tony Montana along with banging every hooker north of Manhattan. This film is pure entertainment and worth seeing in the theater. Go and see this film, you won't be disappointed.",7,5,14,30 December 2013
Birdman or (The Unexpected Virtue of Ignorance)," Sweeping cinematography mixed with brilliant performances makes Birdman one of the very best of the year.
","Birdman is a brilliant, mind blowing experience that is filled with grand performances, Hitchcock-esque camera movements and a brilliant way of storytelling. Above all, Birdman's all star cast featuring Michael Keaton, Edward Norton, Emma Stone and Zach Galifinakis propel this film to greatness, telling the story of a has been actor, Riggan, who was once known for a comic book franchise from yesteryear as he struggles to regain the stardom he once had through an off Broadway play. This proves to be harder and harder for Riggan as he deals with the disappointments of his own life while dealing with the difficulties of making this play his ticket back to stardom. This film serves as a somewhat personal film to Michael Keaton, giving the mere fact that he was known for playing Batman, a comic book hero eerily similar to Birdman. Keaton is an actor that proved time and time again that he can play virtually anything from heavy and hard hitting dramatic roles to silly and funny comedic roles as well. In Birdman, he strikes a perfect balance between the two and turns in the best performance of his entire career. He is firing on all cylinders and truly rises to perfection especially in scenes with an equally great Edward Norton. Another highlight of Birdman is the cinematography. First off, WOW. This film has some of the best cinematography I have seen in quite some time. Focusing on extremely long and spiraling takes, it submerses you in the scene, giving you the type of voyeuristic experience that Birdman calls for. We very much follow these actors as if we're watching a documentary on LSD. The camera movements are slow and bouncy, the tracking shots are nothing short of amazing and it gives an overall, dream like experience when watching this film, something that really benefits the film towards the latter half of it. I fully expect the film's Director of Photography Emmanuel Lubezki to score a Best Cinematography nomination come Oscar time. Director Alejandro Gonzalez Inarritu has given us some new age classic films such as Babel, Biutiful, and 21 Grams. Birdman is no exception and, to be honest, this very well may be his masterpiece. He directs his actors with grace and never lets them miss a beat and with some extreme long takes throughout the film, it shows just how good of a director he is and just how good his actors can be, especially Michael Keaton. Overall, I could go on and on about this film and just how great it is but nothing of what I say here can really do Birdman justice. It is a film that you need to experience for yourself. With that being said, Birdman features amazing performances including a jaw dropping turn from Michael Keaton, along with some of the best cinematography I've seen in years. If there is one film to see during the Awards season, it is Birdman.",10,125,249,16 October 2014
