movie_title,title,review,rating,helpful,total,date
The Incredible Hulk," HULKKKKK SMASHHHHH
","The best out of all the MCU still to this day, a perfect rendition of the hulk and still even with all the hulks weve seen in endgame and ragnorok this hulk is still by far the best, hopefully he will come back on the MCU in this form👌👌👌",10,0,2,31 August 2019
Captain Marvel," What the hell have i just watched
","Have never seen so much woke sexest crap in all my life!!! If it was possible to give it 0 stars i would, if the futures female and this rubbish is leading the way then endgame litterally was the end!!! Il give a couple of more films a chance but i wont be watching no more craptain marvel woke garbage💩🤡",1,11,22,19 October 2019
Us," 💩
","I nned to boil my eyes!!! I cudnt wait for the end, i kept thinkin either die or get away so i can clear out of there, no character feel, same old yet it was well below the average same old. I duno how imdb rate films!!!! Cus theres no way this was half as good as age of ultron!! Never mind getting the same score, truelly rubbish",3,0,2,1 April 2019
Deadpool 2," Top dark humour!!!
","Finally a fight with the juggernaut vs colossus, 2 heavy hitters go toe to toe!! the humour is top notch the comedy is quality its not predictable i thoroughly enjoyed it! Hoping for a 3rd, brill film",8,11,33,15 May 2018
Avengers: Endgame," Almost perfection, but everythin has flaws
","This film was a marvel masterpiece, and had it not hav had the flaws im gona mention it wud hav got 10/10, but what they did with hulk and thor gutted me, hulk, since avengers 1 has had a weakend state, in each and every film, weaker and weaker, i gave them infinity war because i was expecting a big thanos finalè with hulk, but saying i was let down is an understatement!!! He was there biggest trump card!!!! And theyve totally taken all the aggression out of him, stupid!!! Really stupid!!! Then thor was made to look a gimmick, even wen he was worthy with both axes he was still fat, stupid. Then the lineup with the women superheros was totally ridiculous!!! Then theres captain marvel, who didnt even get a messed up hair doo by thanos never mind a whopping!! So who cares who captain marvel fights in capt marvel 2??? Cus if the powerfullest villian in the universe cant beat her then who cares!!! U can tell which way marvel are going in the future. These flaws was totally ridiculous to me, if these errors had of been rectified i wud hav given it 10/10 but if 8.5/10 was a fair score to me,",9,1,4,28 April 2019
Star Wars: Episode VIII - The Last Jedi," Utter trash
","Is leia indestructable????
Are all the captains female????
Why are all the men killed off????
And luke skywalker!?!? I thought it was all about luke??? Not just to kill him off also!!!! And rey absolutely annoys me to death!!!! Is she unstoppable?!?!? Iv never seen such trash!!! What a way to ruin one of the best franchaises ever!!! I am totally done with starwars!!!!the vader days are long long gone in a galaxy far far away!!!!",1,12,17,19 October 2019
