movie_title,title,review,rating,helpful,total,date
Sucker Punch," good action film
","Yes its entertaining yes it is jaw opening yes it is a bit confusing (when u not very focus in the story) and plus bonus sexy chick too ,,over all this is a good movie nb:where had i been that i just watch this good movie ,,so lucky to see this movie ,,its awesome good",8,5,5,22 May 2020
Ready Player One," another magic of steven spielberg
","Wow i amazed how this film came on to ,,good story flow and beyond imagination ,,its a second magic from spielberg again (off course after avatar ),,good job spilberg",9,1,1,19 May 2020
Spider-Man: Homecoming," well it is quite bored nor still intresting to watch
","Yes the films does not fit with all spidey fans ,,trust me i've seen the worst movie ,,but this quite interesting and a bit bored ,,so much childish act ,,so much un worthy dialogue ,,lack of story line ,,but i had to admit ,,yes i watch it until done and theres surprise scene too ,,just need a good touch to main character,,over all its quite entertaining",6,0,2,23 May 2020
Aladdin," great remake from disney
","I had saw aladdin film throughtout many years ,,i think this aladdin 2019 is the best remake ,, i said yes to this remake alddin films ,,salute to the disney team it succed to amaze the audience ,,all part of it ,,story line ,,actor and actreses,,wardrobe,,dancing ,animation,,sound and other s is just perfect ,,specially with will smith become genie with his own way ,,i like it alott ,,sometimes i rewind the scene just to see the actors and actres mimic to respons some condition ,,good casting thought ,,cant wait for next aladdin",9,0,0,24 May 2020
The Shape of Water," bizarre love story !!
","Well it is bizarre enough to love another creature from deep water but hey this is fantasy film ,,what u expected then??another great film from master of storyteller guilermo del torro ,,with time background around 60's - 70's it;s so perfect well play ,,the building,,the street,,the wardrobe ,,the cars ,,the banner ,,the shop just so at that time ,,lonely girls press by situation and condition can became so make sense to love another creature that same condition like her ,,just like that they both just love each other,,but i wanna red line this film message is love is not perfect at all ,,what perfect is to love each other lack ness ,,so that simple ,,waiting for chapter 2 from this fil ,,goodjob guilermo",8,0,6,27 May 2020
