movie_title,title,review,rating,helpful,total,date
50 First Dates," Adam's top one
","I love it man
She's beautiful man
I just started Adam collection
And this is great one",8,1,1,14 August 2018
Darkest Hour," oldman's old act
","One best movie in 2k17 
great acting like colin in (kings speech)
just download and watch now",9,0,3,21 February 2018
Interstellar," guyz ignore haterz just watch Nolan masterpiece
","I just wanna say thank to god for give us men like a nolan sir really
what a great movie dude..after half n hour you just forget who we are man??
salute to nolan brothers really... _/\_ ignore spoilers reviews 
just watch it now",10,0,1,30 January 2018
A Quiet Place," ignore haterzz i love it
","For me its great idea.
I mean they(hollywood) always come with different ideaJust imagin if in the future creatures comes like this then what do you do??Come on dude give respect them",8,1,4,26 July 2018
Wonder Woman," its good to see pine and gal in one movie
","Acting was good but story nd direction awful
And Chris pine was awesome plying the role",4,1,5,29 January 2018
