movie_title,title,review,rating,helpful,total,date
The Devil's Advocate," The Devil's Advocate Review
","What is this movie bad from the worst movies Keanu Reeves and Al Pacino After one hour of the movie, the movie became bored bad to normal, there was nothing that pulled me in the movie. The acting was normal. The story was very, very ordinary.
The movie I didn't like until the last hour of the movie, I couldn't see it. It is one of the worst films of Keanu Reeves and Al Pacino.",5,0,4,20 June 2020
First Man," First man
","First Man review directed and written by Damien Chazelle, starring Damien Chazelle and Jason Clarke, the story talks about Matthew Villella.
A Biopic on the life of the legendary American Astronaut Neil Armstrong from 1961-1969, on his journey to becoming the first human to walk the moon. Exploring the sacrifices and costs on the Nation and Neil himself, during one of the most dangerous missions in the history of space travel
1- The story: The movie was acceptable. The story was normal. There is something missing in the story. The film is considered less, so I did not rate it from the director. There are films that talk about space. My best evaluation is Story 6 of 10.
2- Acting: Acting was great in the films of all the actors who were well represented 8/10
3- Production: The director was good, moving the camera. The lighting was good. The CGI was good. Clothes and colors. The movie made me feel like the 60's. 8 of 10
The film is considered good, but the problem with the story was not.",7,0,0,19 June 2020
Singin' in the Rain," Review
","The story of the film is very, very beautiful. I enjoyed the length of the film. The events were wonderful. I enjoyed the movie. The acting was very wonderful. I enjoyed the acting. The director was very good. The music and colors were the best. The film was similar to me. La la land.",10,0,0,5 July 2020
Mystic River," Mystic river
","The film is good to average, the film is great, the acting is wonderful, the production is normal, and it is not one of the best films, Tim Robbins.",7,0,0,21 June 2020
