movie_title,title,review,rating,helpful,total,date
The Perks of Being a Wallflower," Amazing movie.
","This movie is pretty much entertaining anda amazing, fantastic movie.",10,0,1,10 December 2018
Watchmen," Fantastic movie.
","The movie was incredibly and fantastic, was very original.",10,0,2,10 December 2018
X-Men: Days of Future Past," Fantastic movie.
","This movie was really entertaining anda unique, was totally original and fantastic.",10,1,1,10 December 2018
Logan," Fantastic movie.
","This movie is very movie and magnificent, is really original and fantastic.",10,2,3,10 December 2018
