movie_title,title,review,rating,helpful,total,date
Star Wars: Episode I - The Phantom Menace," Best Film in the seiries
",This movie is really good becuase it is. It is the best Star Wans movi it is way better then the other ones so yah,10,7,9,12 April 2018
It," Not Spoopy At All......,. :(
",This molie did not scare me it was to not scary to be scary Blippi was more scary the Pennywinkle the Pooping CLown but it was a very LIT movie,3,0,2,12 April 2018
Shrek," Shrek Is Love Shrek Is Life
",Shrek made me understand why I'm human. It gave me the answers I have been searching for my entire life and I am now able to descend to the greater swamp.,10,1,1,11 April 2018
Jurassic Park," Movie Makes No Sence
",This movlie makes no sence dinosuars dont real and people coud bet the dinus up it is bad and i dont get it,2,3,25,12 April 2018
