movie_title,title,review,rating,helpful,total,date
Hereditary," so cary and so good
",I was very impressed with this film. I did not know it was this scary and this great. I highly recommend to watch it. The main lady should have gotten at least nominated for her performance. Brilliant work.,10,0,3,30 October 2019
The Shape of Water," Not a fan
",I am not a fan of these type of stories but this one kid of touch me. The acting is impeccable and I loved the directing too. Very well done film.,7,2,4,30 October 2019
The Godfather," the most well done movie ever
",I think you prolly get it from my title that i love this movie. it is by far my favorite movie ever. i have seen this movie at least 50 times and i will watch it so many more.,10,0,0,28 October 2019
