movie_title,title,review,rating,helpful,total,date
The Hunger Games: Mockingjay - Part 1," Transition Episode
","This episode serves to move the story along - and does it well. It is served by a great cast : we're happy to see the now familiar faces and some new characters are introduced with good casting. The high point of the movie is the usage of propaganda from both sides of the conflict - this will what one will remember from this installment of the series While it is a good episode for the Hunger Games saga, it is not as exciting as the first two - the action that gripped us is simply not there. Also, definitely do not start Hunger Games with this movie; I imagine it would be virtually impossible to enjoy if you don't know the characters and context. Not a disappointment but definitely can't wait to have a stronger episode next!",7,8,23,23 November 2014
Mission: Impossible III," Good but fairly standard
","Perhaps the race to more incredible stunts, more world threatening menaces is influencing our opinion of this movie in 2015 ; 9 years after its release, but the movie lacks a certain punch and weight. It's perfectly enjoyable, well put together and a couple of cool scenes are sure to be found but overall, it feels very forgettable. Another gripe with the movie: outside of Tom Cruise and Ving Rhames, the cast is very 'faceless' and also highly forgettable. Even Hoffman, who could have been the greatest villain ever, was not very convincing. What is good about the movie is the classic Impossible Mission stuff : the masks, the music, the 'Tom Cruise running' scene is almost ludicrous but still highly enjoyable. Watch it if you like the series, you won't be disappointed but don't go out of your way to find it.",6,0,0,10 August 2015
Star Wars: Episode I - The Phantom Menace," Let's try to be positive
","It's fashionable to bash this movie... and it does give you a lot of things to do so. However; let's try to be positive: - It's actually cool to meet the Jedi Council and the characters are mostly very strong. Qi Gong Jin / Liam Neeson is a very good Jedi indeed. - Darth Maul; the last lightsaber battle and some part of the last fight scene are very enjoyable indeed. - George Lucas going very far in his imagination, adding lots of new settings, races, designs etc etc. The excitement is presentBUT BUT BUT - Jar Jar is really the most annoying character ever. Anakin a close second - The humor just falls flat. Flat out sucks actually. - 'Too digital'. Some parts look like a video game. - Very convoluted: too much politics, too complicated. So yeah, overall, it's an annoying sci if movie with some good stuff. Still is below average. As a Star Wars movie... it doesn't deliver.",4,2,6,19 December 2015
Skyfall," Simply excellent
","Sam Mendes takes the Daniel Craig reboot up another level by embracing some of the James Bond's roots while keeping the fresh, modern take of the character established in Casino Royale & Quantum of Solace. Like all good Bond movies, the audience travel throughout the world, through some great set pieces. There were also some truly epic scenes: the opening scene and the London Tube in particular come to mind. The villain was incredible: creepy and modern but at the same way a little over the top ridiculous at heart. One could only regret a few longish moments and the lack of a strong female lead but minor qualms for what is probably the best Bond flick.",9,3,8,14 November 2015
Akira," Awesome. Hasn't aged a bit
","Hadn't watched Akira for years and years. Managed to catch a 'clean' version - very well restored, hi def and all the works and honestly it hasn't aged at all. On the contrary, with the exception of one scene where a girl talks a public phone, the whole thing has aged gracefully and is still as relevant as it was in the late 1980's: the animation is flawless, the designs as cool and modern as ever and the action flat out awesome. The story is still what one could have qualms about - the debate is the same as 25 years ago. It does have slow & confusing moments but overall it's well worth a watch. Now I'll go ahead and reread everything! Katsushiro Otomo : I wish you were doing more!",8,1,4,4 October 2015
Inglourious Basterds," Interesting change of tone yet remains so Tarantino
","Couple things up front:<ul><li>This is not the movie that will make you like Tarantino if you are cold to his style - this is not a movie for the historically accurate aficionados</li></ul>But it's good. Came in with low expectations: not my favorite cast for a Tarantino joint; the WWII setting is a tricky one; etc. but the Tarantino magic brings it together with his typical strengths: strong scenes & pacings, impeccable use of music and some fascinating characters. Some of them are a bit on the corny side but the Tarantino humour makes it work. Recommended.",9,0,4,14 May 2016
Rogue One: A Star Wars Story," As good as candy...
","Rogue one is a fun movie. It has fantastic action scenes, a great cast of secondary characters (Donnie!!!) and plays on the nostalgia of all the vehicles & sets of the original trilogy beautifully. It is so cool to see the original stormtroopers, AT-AT and other AT-ST. It also features probably the grimmest war scene of any Star Wars movie. Almost reminiscent of Private Ryan in certain aspects; it is violent -definitely not for kids- and very well made. This scene makes the movie.It's hard to point out what's wrong with the movie. It is like candy because, even though it is good, it lacks a point or purpose? Yes, it is a spin off and about the extended universe. But would one enjoy Rogue one without being familiar with anything from the franchise? It does lack some elements that make Star Wars great: - the characters don't really fit in the bigger picture... so why do you really care? - the music is clearly not John Williams, that's a pretty big letdown. - the main characters are ... not as good as the ones from Episode 7So yes, good movie, great visuals, fun times... but 'Empire Strikes Back' it is not!",7,1,5,19 December 2016
The Hunger Games," Fun movie, good set up of the characters
","Watched this movie a couple of times over a few years. The first time was a delightful surprise. I had discounted Hunger Games as adolescent but ended being very much captivated by the Games and growing fond of the Catniss in particular.Subsequent viewings make the games less enthralling - at the end of the day Battle Royale does it better - but the movie absolutely works as a set up piece for what is to come in subsequent movies. The world is clearly defined, the politics and intrigues well positioned and the characters are introduced strongly in a way you understand and want to root for them. This + a good cliffhanger ending make it a solid movie.",8,1,4,20 November 2015
Zootopia," Nice surprise
","Used to be Pixar was the far better animation studio at Disney but recently they've been knocking them out of the park with their own Disney Studio Productions! Zootopia is a great illustration: it's fun, witty, has the several layers of interpretation and looks really good.In a nutshell, it's a great animation for the entire family. The only thing one could poke is the cast: it's fairly unknown and not really inspired. Jason Bateman is the only stand out, Nate Lawrence is good in a role that almost sounds like Jonah Hill. The rest, including the title character and an underwhelmed Idris Elba is a little -meh-.But it's probably the only point that one could expect better from. The rest is good fun.",7,1,8,22 May 2016
Creed," The other great reboot of 2015!
","Unexpected and almost as pleasing as Star Wars: Rocky was also back in 2015!It was good to go back into this universe: setting up a new generation is done smartly: using Creed as a main character allowed for a richer playground, a richer set of elements to toy with and a way to build relationships in a deeper manner that would have been the case with using 'simply' Rocky's son. Michael B Jordan is good, still some progress to do (some scenes are a little cliché due to his acting perhaps?) but Stallone is a real nice surprise. He's quiet, wise and yet inspirational and true to the modest roots of the character. A familiar plot actually works. You go along the training and fight scenes with a similar smile on your face as you did in the 80s watching Rocky fight Appolo, Mister T etc. Good stuff.",8,0,2,18 March 2016
Thor: Ragnarok," is it a comedy or a superhero movie?
","On the positive side, Thor Ragnarok looks fantastic. One also can't say it's a boring movie: lots of things happen, lots of jokes are cracked, lots of action scenes etc etc. Also, it's obvious the Director and the Team are having fun with it. So, yes, it's not a bad movie by any stretch of the imaginationBUT... I left feeling like the movie was treating Thor like the butt of a joke? The Director has so much fun with the material he forgot to take it seriously, and, by the same token to give it any kind of weight. Loki was a major threat in many Marvel movies and now is either a C Grade villain or B Grade sidekick; worlds explode and this basically only the source of a joke, etc. Nothing is taken seriously so it's almost too light. At best you feel like you're watching a children's movie, at worst you feel like you're watching a comedy that disguised itself as a superhero movie?",7,3,12,1 November 2017
Cloverfield," Cool Rewrite of Godzilla
","When you see this in 2016, the first thing that jumps at you is the found film footage: this concept has simply aged badly. The camera work is voluntary choppy etc. but we've seen it so many times by now that it's old and stale. By 2008 it wasn't exactly revolutionary either - that's really the main issue with Cloverfield. It's a shame because it is a cool rewrite of the classic Godzilla concept: the monster is cool, the FX are cool, the cast is cool... lots of things to like really. It does follow the tropes: idiot characters going upstream to find a girlfriend, lots of carnage... but it works. To be honest, I think I prefer the sequel: it's cleverer but this is still a cool way to spend a Sunday afternoon.",6,0,0,10 July 2016
Suicide Squad," This movie is such a mess...
","Where to start... Suicide Squad is a mess; you can feel the multiple rewrites, the three re-edits ('oh, Deadpool did well, we need more jokes.' 'Oh Batman vs Superman was panned by critics, we need to be like that' etc etc.) leaving this movie completely disjointed; all over the place. The multiple edits and re-shoots are physically visible in the movie - it takes you out of the film completely.I won't even mention the story - it's pointless. But story is never really what Suicide Squad is supposed to be about: The characters are. And this is one of the first major flaws of this movie: the characters are clearly separated into A grade - basically Will Smith, B Grade - Harley Quinn and then Z Grade: the rest of them. The Z Grades fight for 5% screen time and therefore become meaningless cannon fodder: they don't stand for anything, are completely undeveloped and thoroughly uninteresting. In certain cases they look bad (Killcroc) and are stupid clichés (Katana speaks Japanese and has a sword... ugh)Even Will Smith & Harley Quinn don't really work. They're supposed to be villains... they're not. There isn't a single thing bad Deadshot Will has done in this movie. This means that the entire premise of Suicide Squad doesn't stand: they're not bad guys! They don't do anything bad! And don't get me started on the villain: idiotic and over-powerful yet super easy to defeat...!Visually the movie is in the same vain as the recent DC offerings but...somewhat less impressive? The characters look off, the effects are super dark and underwhelming...the super hero abilities fall flat...Suicide Squad does have some redeeming qualities... but they are very few and far between and contingent on you liking the source material and the characters. Pass.",3,3,6,11 August 2016
American Sniper," A masterpiece
","This movie is a must see. Bradley Cooper's performance was definitely worth the Oscar - he delivers such intensity in his performance that manages to transport you and fascinate you at the same time. This intensity is one of the key factors this movie is successful. On top of this he is literally transformed - to the point it's hard to think you're watching the same actor you're familiar with. A truly unique performance. American Sniper is a war movie at its best: it is gut wrenching, hard to watch at some points an beautiful in its mise en scène and reconstruction of war torn landscapes and sets of conflict. Eastwood is a proved strong director and this another great movie - a high point in my opinion.",9,24,44,1 March 2015
Star Wars: Episode II - Attack of the Clones," Better than Episode I but ...
","The fundamental issue with this movie is its main character and main actor. Very honestly, H.Christensen is a bad choice for the lead of this movie -he doesn't have the range (at least in this movie) necessary to pull of a character as complex and conflicted as Anakin Skywalker.So the confusion and internal struggle the character is supposed to go through falls flat and you are left with someone who appears arrogant and quite honestly just an overconfident brat. A long way from a Jedi master (which is wanted I guess...?) but also a long way from the noble villain he's supposed to become. When this fails, it's hard to enjoy the movie. It has some flaws similar to the Episode I (too digital being the main one) but does improve on many things: Fan Service is full speed and you get to see Yoda, Bobba Fett etc. in their peak. But a slow pace, a hard to swallow romance and the afore mentioned problems don't save it from being average at best... +1 point because it's Star Wars!",6,0,6,20 December 2015
Ant-Man," Too cute for its own good...
","Unfortunately, this felt too much like a kids' movie. A lot of the special effects are strong reminders of 'Honey I shrunk the Kids' and the humor dial is turned way up to the point of it feels like the movie makes fun of itself? Though this could have been good, it minimizes the impact of the action scenes and the overall weight of the threats etc. What was good was the cast : Michael Douglas is great as Hank Pym and does overshadow Paul Rudd who, when taken by himself, works as Scott Lang. A fantastic 'surprise' at mid movie (the part the Marvel Zombies will prefer I think) and some cool moments help make this not a complete waste but, honestly, I was hoping for more. A note on the soundtrack: it wasn't very good + I don't understand why ants sound like Jurassic World's dinosaurs?",5,14,35,26 July 2015
Mission: Impossible - Rogue Nation," More Spy Movie than Action Movie this time around
","Despite what the trailer sells, this movie is less action oriented than the two previous installments. Now, the few action scenes are absolutely fantastic and continue the over the top signature that Tom cruise and the Mission Impossible franchise have established but there are a lot more 'spy scenes' this time around: Rebecca Ferguson plays a very ambiguous / mysterious character, there is some political intrigue. Overall, though I understand the disappointment of some action lovers the story is not bad or simplistic. It's of course not an philosophical study of human nature but it's actually well done and well told. My only gripe with the movie is the lack of the obligatory Mission Impossible tropes: where is the scene where Tom falls from high above to a few millimeters from the ground? Where is the scene where he runs for miles and miles? Over than that, a good summer movie - not quite to the level of Ghost Protocol but enjoyable nonetheless.",7,1,3,13 August 2015
Captain America: Civil War," A great movie, definitely better than Age of Ultron
","Captain America : Civil War was much better than anyone expected to be. After the semi disappointment of Age of Ultron which didn't have much of a point and a fairly underwhelming cast of new characters, Civil War actually delivers a strong Avengers movie: there have never been that many superheroes on screen and the Civil War plot - though quite different to the comic book version - provides a good premise for the conflict.The brothers Russo deliver a similar joy to the first Avengers with the superhero fighting each other scenes. Actually the action scenes in general are great (like they were in Winter Soldier), action packed and fast paced. Great stuff for the fan-boys that wanted that.The new characters, namely Black Panther and Spider-Man are absolutely fantastic. Of course Spider-Man is more exciting - great costume! great quips! he's so young he feels like the 1960s' version! - but Black Panther shouldn't be short changed: he's elegant and charismatic - not unlike Captain America.But two things bring the movie down a little: the pacing. The plot is complex (too complex for a superhero flick?) so you get a lot of exposition and 'talking head scenes'... your mileage may vary but don't expect non stop action for 2hours; this is not it. And then there is the end... no spoilers, but it's quick and a little 'under the rug'.Oh and yes, one thing: it's not technically a Civil War, it's a 2 hour battle! Other than that, fun fun movie with a clear focus on Captain America, and a lot of cool shots for the fan-boys in the audience.",8,4,9,30 April 2016
Quantum of Solace," Critics were too harsh with this movie?
","Perhaps due to the strong wake up call / reboot generated by Casinio Royale, the stakes were too high for Quantum of Solace. Perhaps it also came too soon after-wards. It is however not a bad Bond movie or bad action flick at all. Lots of good points to consider: a strong cast. The Bond girl and the villain were in my humble opinion better than their Casino counterparts (evil french always work!). The cinematography was interesting too: there was a grain and a color palette that almost gave a retro/vintage look to this movie which worked particularly well. Also, strong pacing - also better than Casino Royale where you had a few looong moments.Overall not a bad flick - it maybe doesn't leave you with a long lasting memory but, re-watch it, it's not bad at all.",7,3,6,12 November 2015
Mission: Impossible - Ghost Protocol," Mission Impossible at its best!
","The first half of the movie is probably the best action movie of the last 20 years. It is intense, well shot, engaging and absolutely stunning visually. The stunts and action set in Budapest, Moscow and Dubai and are absolutely fantastic and make the movie. Unfortunately the movie slows down greatly in the second half of the movie (or is it two thirds/one third?) in Mumbai and loses itself in some common genre traps: too much explaining stuff that doesn't make sense and some fairly 'average' action. It's a small gripe, probably half explained by the fantastic beginning of the movie. The cast is the best of the series: Jeremy Renner is a good addition, Lea Seydoux is a pretty cool villain and the female lead whose name escapes me is somebody I wish I would have seen in another movie? And Cruise is Cruise, he's the man in this saga. A great movie overall, well done Brad Bird!",8,22,25,11 August 2015
22 Jump Street," Good fun
","Less inspired than the first 21 Jump Street for a good chunk of the movie; 22 Jump Street is a a tad bit too long for what it is. This movie begins to shine in the third tier and the final couple of scenes where the action picks up, the jokes are more fun. There it catches again the funny irreverent cliché tone of the first movie and becomes truly enjoyable. The high school setting was better exploited than the college setting of this movie; which is why it's slower to start. Also, while fully assumed by the movie, the repetition from the first movie reinforce the slow start. Overall still OK and a perfect movie to lazy out in front of. Wait to have forgotten the first one before you watch.",7,0,1,18 January 2015
X-Men: Apocalypse," Underwhelming ... but has some moments for the fans
","X-Men: Apocalypse is not a bad movie... However it's going to be difficult to write a review that doesn't dwell on the negatives.First things first: the plot is way too simplistic. Introduce bad guy, gather protagonists, gather antagonists, fight. That's literally it. One could say it's a good change of pace from the way- too-complicated-for-their-own-good other superhero offerings seen recently but in this case it feels flat and linear.The cast is basically the same as X-Men: First Class. Magneto / Fassbender and Xavier / McAvoy are still good but it feels like Jennifer Lawrence doesn't want to be here? She's supposed to be jaded in this movie but plays the jaded Mystique maybe a little too well...? In terms of characters: Quicksilver is still the greatest speedster ever on the small or big screen; Bravo to Synger on his interpretation of ultimate speed and how that could basically make you almighty. Well done.The rest of the characters are somewhat disappointing: the X-Men offer so many possibilities but it looks like we are limited to that leather look introduced by Synger 15 years ago. He invented the modem super hero movie look but now he is limited to the style he invented? The costumes are a bit ridiculous and Apocalypse is the best illustration of that: Oscar Isaac looks a bit odd...kind of off. And you get that across Psylocke and her way too small panties look, angel's techno wings etc etc. Today, the X-Men could look better. And don't get me started on the blue gang (Beast and Diablo don't feel real; they really never did...)For the good: a lot of Easter eggs and fan service. The Wolverine scene is fantastic for those who know the source material. The end fight is satisfactory... but it's difficult not to be underwhelmed.The X-Men need to be reinvented on the silver screen. Fox needs to go back to that glimpse that First Class offered and that was forgotten too soon after. We need something new; no more 'Magneto is not a bad guy really!' ' But he kills' that we've been served for 15 years. Time for a reboot. The source material is great and deserves it.",6,16,32,22 May 2016
Logan," A little underwhelmed...
","Maybe it's a case of high expectations, but I was underwhelmed overall with this movie. It has ramp-ed up the violence to the max and the end is quite good but too many problems mar this movie to make it a hit: - the setting never quite clicks: 12 years in the future they have the same phones and the same TVs? Mutantkind was eradicated? Not a big deal but it never seems right - the movie is a road movie? An action movie? A mix of the both with a lot of dead times and fairly filler moments - What it is not is a super hero movie. It has some of its tropes but lacks the overall sense of wonderment a superhero flick needs - The bad guys and main threat are really **meh** So yeah Hugh Jackman is OK, Patrick Stewart is OK, seeing a Wolverine unleashed on the screen has its moments but overall somewhat disappointed.",6,4,11,4 March 2017
Avengers: Age of Ultron," Disappointing but saved by the last act
","Halfway through the movie, yes, I was disappointed. Avengers 2 falls into the common super hero movie trap of spending too much time explaining technology / fantasy (a McGuffin basically) that will never make sense. And it is frustrating and slow at times because of that. If you add to this some disappointments vs. what was promised in the trailer and some not so exciting new characters (first time for me in a marvel movie...) Avengers 2 does fail to deliver. BUT BUT a great third act and final fight scene save the movie for Marvel zombies such as myself. Truly epic, great Whedon-esque character dynamic and team ups. The movie does offer a lot to like: a fantastic James Spader as Ultron, Hawkeye! (How can Whedon make Hawkeye actually rule!)... However this is the not the best marvel movie. Will still go see it again in Paris next week. PS: Bryan Singer did Quicksilver better than Whedon....",7,3,8,3 May 2015
Sicario," Strong & Smart
","As is often the case with Denis Villeneuve movies, Sicario grabs you almost violently into its universe, captivates you and stays with you for a while after you have watched it. And it's really the mark of a great movie isn't it? It has a great and fantastic score that creates the mood, fantastic color (some saturation à la breaking bad in the Arizona desert etc.) and such a great cast. Sicario is a great 'cartel' movie, a great police piece and will make you think. I'm not making it full points because there are a couple of details that didn't make sense... perhaps I should watch it again very soon!",8,1,2,29 February 2016
Departures," A beautiful & poetic movie ... but has some issues
","Okuribo has many qualities of classic, beautiful Japanese movies: a quiet rhythm that brings you along gently, a poetic setting re- enforced by the Japanese countryside so typical and so beautiful to look at.Seasons and the passing time, as is sometimes the case, play a great role in the movie. The topic of death is treated gently and beautifully, full of emotions and, again, poetry. What doesn't work is once in a while the jarring change of tones. One can argue this is Japanese as well, but it can be done better. The characters can sometimes be overdone, contributing to these moments where the poesy is broken.But it's still a great movie - you will cry! - well worth watching.",7,0,1,18 March 2016
