movie_title,title,review,rating,helpful,total,date
Sausage Party," This is NOT a kid's movie
","I went into the movie cold, with no idea what to expect and... wow. Sausage party is offensive, it's lewd and... it's also very very funny.Most people expect a certain level of decorum when watching a cartoon and this movie just goes completely against that. It's shocking more in what the movie chooses to show rather than what it says and it is shocking because, yeah, it's a cartoon.It's a rare thing to laugh so much. You will need to switch on your teenager stoner sense of humor but, it is funny. Honestly, it just is! It is incredibly immature and yes it is somewhat offensive and hardcore but it's funny. When was the last time a movie made you laugh and go 'WOW I can't believe they went that far' straight for 90mn?Super star cast, Salma Hayek as the lesbian taco is the best - just keep the kids away.",8,4,8,13 November 2016
The Hobbit: The Battle of the Five Armies," A little anticlimactic
","This movie didn't really work as a stand alone movie: it's just the final act in a saga that was obviously stretched out too much. As a third of a two movie Hobbit saga it would have been a much different thing. As a movie in and of itself, it's just too drawn out. Add to that the fact that we have now seen 12+ hours of elves, orcs & trolls fighting each other, it was unsurprising. Though beautifully shot, with great effects, and the cast & characters arguably more likable than the Lord of the Rings saga, it has good things going for it, but ultimately this third Hobbit movie is probably the weakest of both JRR Tolkien / Peter Jackson sagas.",6,1,2,7 January 2015
Arrival," Smart Sci Fi
","Dennis Villeneuve delivers - the kid is good!This is the intellectual kind of sci-fi, the kind that takes its time, that makes you think, that tries to bring the genre and thinking forward. The language angle is fascinating and fun to explore. Amy Adams plays the linguist fantastically well and Villeneuve's decision to stick the camera 95% on her is incredibly strong at building tension and a connection with the character. The opening scene where you actually don't see the aliens arriving but simply Adams' interaction with the world reacting to the arrival is simply fantastic.There is only one issue with the movie: purpose of the aliens. Without spoiling it's hard to get into but the conclusion is a little light for the aliens let's say to remain vagueOther than that, fantastic movie, worth a couple of screenings!",8,1,6,11 December 2016
Wonder Woman," Some major major flaws in this movie
","Surprised by the early positive vibe around this movie. I want to like it more, share the enthusiasm but... Wonder Woman has incredibly severe flaws that can't make it a *good* movie by any stretch of the imagination. Probably the biggest issue is the acting. Both leads have very limited acting skills... It takes you out of the movie more often than once. Some scenes are forced, some dialogue overdone like an SNL skit... simply not possible. The ultimate bad guy is a joke. Straight out of GOD OF WAR PlayStation game (really). Not credible for a second.And, also, on a more personal note, this is the moment where I realized the Zack Snyder school of filming action movies needs to be abandoned. Over abundant jumping, too heavy slo-mo... after three? four? movies of that; it's time to retire it. It's a shame really because the movie started well enough: having a female lead was great; the Greek mythology clicked for the most part and the World War I setting was nice. The character is also fantastic. Which is why it deserved better It's only average unfortunately. **cue in the annoying guitar rift**",5,2,10,10 June 2017
Batman v Superman: Dawn of Justice," Lots of things to like... but far from perfect
","Haters will hate and this movie is being a little too harshly criticized. It is severely flawed:<ul><li>It is long; too long; mainly because it does have a lot of disposable scenes that do not contribute to the movie. Batman v. Superman doesn't deserve an extended version; it actually needs a better, more coherent compact version </li></ul><ul><li>Somewhat linked but Z.Snyder has thrown in too much stuff in this movie. It lacks structure and plot coherence.</li></ul><ul><li>Some pieces just don't work: the bat-mobile chase scene looks way too digital. The car lacks weight and the scene lacks realism.</li></ul>But but it does have a lot to like too!<ul><li>For the geeks &amp; fans: it is so cool to see some scenes that are too the exact replica of shots in the comics. Whether it's Alex Ross' Superman coming from the sky to the end (no spoiler) it's something that is just cool to see when you are familiar with the source material. </li></ul><ul><li>It builds on the Superman movie and creates the Justice League in a way that is actually satisfying! When was the last time anybody was excited about the DC Movie universe? - I actually do like Batfleck and the cast in this movie. Ben Affleck grits his teeth a little too much but is credible as a battle worn Batman... and Gail Gadot is just perfect as Wonder Woman - No spoiler but the end was good and poignant.</li></ul><ul><li>the fight scenes are cool. Snyder knows how to do those. </li></ul>Overall, comic book fans have to see it... for the rest, if you're willing to sit through a (too) long superhero movie; there is still some fun to be had.",6,1,2,29 March 2016
Casino Royale," Great reboot but no the greatest movie
","This is the perfect example of how to reboot a franchise: Casino Royale has brought Bond to the twenty first century: made it modern and relevant to a new generation of movie goers; in sync with its time and without some of the corny gadgets etc. that old school fans love but just show their age.The first third of the movie goes back to the beginnings of the characters, effectively reintroduces him, makes him fresh and young while serving great action scenes, cool settings and overall very good pacing.The second act somewhat loses its way: the at-first-entertaining poker scenes become unnecessarily convoluted -one could even forget why they are playing in the first place- and the love interest is a little forced.It does get better in the final act: back to the cool action and dramatic pacing. Overall a great Bond film - but not without its flaws ; like the title character?",7,1,5,11 November 2015
Star Wars: Episode VII - The Force Awakens," A good way to relaunch the saga
","JJ Abrams is smart about how he plays with the toys he was given. If I had one criticism about this movie; it's to be too classic in its structure - no spoiler but the movie will feel very familiar. On the other hand, what is the right balance to strike between old & new? There is new in this movie - lots of it. The new characters are strong and different from their elders. The settings are cool, the Star Wars technology and designs amazing (there will be so many new toys from this movie!)But Abrams manages to weave the old in ways that please and bring a smile to the hardcore fans. That was very well done. And the end scene is amazing and poignant. I need to probably re-watch it but day 1, first screening I left happy to have spent two new hours in the much beloved Star Wars Universe - I guess this is what matters.",8,13,47,16 December 2015
The Hunger Games: Catching Fire," A very ambitious movie & quite enjoyable
","They tried to fit in a lot in this movie. As such, the main issue with Hunger Games: Catching Fire is its length. Your mileage may vary but it does feel long at times.Not that it's boring at all: what it does it does quite well : set up the rebellion, introduce us to new key characters and another round of fighting!Without spoiling: though this second edition of the Games is less exciting than the first one (mostly because we've been through this recently), it is a key episode and kicks off the 'true' hunger games story very aptly.One can understand why they decided to split the third tome into two movies when watching the second movie: it does a lot but it is still quite successful.",7,1,6,24 November 2015
Life," It's fun and not pretentious... but lacks ambition
","In 2017, there is a case to be made about movies that are fairly short, fun and easy to watch. In a world in which every action or sci-fi is 2 and a half hour long, a short 1h30 romp is refreshing. It's intense for most of its run, with a 'life' that is a fairly good antagonist and a cast that is surprisingly 'quality' for a B level movie like this one. The main issue is that you've already seen this movie... It's Aliens in a Gravity setting. It's a gentle horror sci fi flick that never really surprises...to the end. But it's good fun, so why not?",6,2,5,9 June 2017
Deadpool," Not for everyone
","The first reaction watching this movie, from quite early on, is 'where did they get the movie to make it?!'. Deadpool is a niche movie: it is for aging super hero fans, who like their violence and their geekie references. It can't by definition for everyone. If you are a in the targeted audience, then it's really fun: the jokes work, the violence is enjoyable and Ryan Reynolds delivers. You can tell he's passionate.It is not a GREAT movie either: you can feel some budget constraints + honestly the villains aren't that bad. I was however giggling the whole way and liked this fresh (at least on the silver screen) take on Marvel. Recommended",8,8,22,14 February 2016
Kingsman: The Secret Service," Over the top and so much fun
","This is a crazy movie and is definitely too much - but in a very good way. If you don't like violence, over the top characters and plots, pass your way. If you do enjoy fun, old school, aesthetically gorgeous sets and direction and superbly choreographed fight scenes, this is for you. Though some of these moments were not always too my liking, it's hard to deny the pleasure you have watching this movie. The makers of the movie were all in great form: Millar's script is craziness at its best, and it is paired with Vaughn's superb eye and perfect pacing. Colin Firth was a great choice for the main character and Samuel L Jackson is obviously having fun. A winning spy movie, action movie, superhero movie, all rolled into one.",8,5,13,1 March 2015
Minions," Not as funny as the trailer let it to be
","The movie is good for a few chuckles and does have some very entertaining moments. What is actually by far the funniest is the 'minion speak'; especially if you understand some french, it does have some layers in it (Papaouté; c'estparlà etc.) and is definitely funny. It also is a very beautiful CG movie. Though it is customary to say that with every new CG movie, this one is absolutely gorgeous, with some great character designs and some cool visuals. But, honestly, didn't laugh all that often. The trailer lets you believe it will be a very very funny movie and was not, it was a cool adventure with some funny characters - left me wanting more. The voice acting was also, with the exception of the minions, nothing incredible.",6,2,2,29 August 2015
Spectre," Another great installment in the 007 franchise by Sam Mendes
","I entered the theater worried; thinking it would be difficult to top Skyfall (or even to do as good) and I must admit after the first viewing: Spectre delivers.Spectre builds on the first three Daniel Craig installments of the 007 reboot, tying everything together in a nice way - immediately giving the movie weight and a sense of purpose. For longer term fans, it is also a nice way to give a nod to the past, with a villain everyone will recognize quickly.The movie also features everything one likes about the reboot - the gritty action, the world traveling etc. but builds on it: the best Bond Girl in a long while, C.Waltz delivers as the crazy villain and few but cool gadgets. Overall very cool. It had two or three 'down' moments but overall, whatever, I came out with a smile on my face and happy about James Bond!",9,49,99,15 November 2015
Mad Max: Fury Road," Beautiful and crazy in all the right ways!
","Mad Max is not supposed to be about convoluted plot lines, talking heads scenes and a world that makes sense. What it is supposed to be: over the top post apocalyptic world, punk / heavy metal imagery , cars, trucks and bikes and all that good stuff. And this movie delivers: the plot line is super thin but gives you what you want: a 2 hour car chase through the desert with absolutely stunning stunts, beautiful shots and crazy crazy CRAZY characters, designs and action. Furiosa / Charlize Theron was a surprising choice but works quite well and is the main character of the movie. This is my only beef with the movie: Tom Hardy could have had more impact / be more present as Max. Other than that, 2 hours of pure fun.",9,6,14,23 May 2015
Sully," The Content is better than the movie
","Not sure I understand the positive reviews this movie gets. Or maybe I do: it rides on Eastwood's talent as a director and Hanks' talent as an actor. Yes 'Sully' does offer some nice visuals, good directing - there is no denying Clint Eastwood is a great director. Similarly, Hanks' portrayal as Sully is good - no denying this.But this movie is far from being the best from both of them. The story ends abruptly and easily - making the whole plot seem a little shaky to begin with. And Hanks is a cool composed pilot. And that's basically it.The landing scenes are impressive and there's no denying the story of the miracle on the Hudson is worth telling...but it feels like this could have been a 30 minute documentary. Not sure the movie actually builds anything worth rewatching several times.",6,1,2,10 December 2016
The Martian," Yes but ...
","Maybe it's the 'too high expectations' syndrome but as the end credits rolled, all I could think of what I disliked about the Martian. In no particular order & without spoilers: <ul><li>strange pacing. You spend huge parts of the movie on relatively short episodes and then suddenly skip 7 months on the space station, 1 month in the rover etc. It gives you a little bit of 'huh?!' feeling</li></ul><ul><li>the end was ludicrous. just impossible - i will believe Aliens exist before I believe that all these coincidences and risky situations can be successful in a row and in these conditions.</li></ul><ul><li>the movie is less visually stunning than Gravity. Or Interstellar for that matter.</li></ul>Now what was good!<ul><li>The cast, the cast, the cast. Of course Matt Damon. But also Pena and Kirsten Wiig in particular were good and underrated in the performance</li></ul><ul><li>The basic premise of the movie is fascinating. The whole 'sciencing the sh*t out of this' was wonderful and very original. </li></ul><ul><li>Cool characters and good evolution throughout time for the main protagonist.</li></ul>Overall a good movie, not my movie of the year though.",7,3,6,25 October 2015
