movie_title,title,review,rating,helpful,total,date
The Equalizer," BEST STORY AND BEST ACTING AND HUGE FAN OF DENZEL WASHINGTON
","THIS MOVIE'S STORY IS BEST , ACTING IS BEST AND I'M HUGE FAN OF DENZEL WASHINGTON'S SUPERB ACTING 😍😍❤❤⚡⚡👌👌🔥🔥",10,0,0,1 June 2020
Rise of the Planet of the Apes," Awesome superb best movie 🔥🔥👌👌❤❤
",IT'S IN THE LIST OF BEST MOVIES AND ACTING DIRECTION ALSO BEST ❤❤🔥🔥😍😍,10,0,0,1 June 2020
300," UNIVERSE BEST WAR MOVIE
","MY MOST FAVOURITE AND BEST WAR MOVIE. BEST STORY , BEST ACTING , BEST DIRECTION ❤❤😍😍👌👌",10,0,0,1 June 2020
