movie_title,title,review,rating,helpful,total,date
It," A good movie
","It is a good movie but the idea don't impress me
Bill Skarsg책rd plays well in Pennywise roll",8,0,1,3 September 2019
A Clockwork Orange," It is the best movie I've ever seen
","It is the first 10 that i gave to a movie!
The actors are well qualified
The sound track is one of the best
The originality makes me feel good when I watching that movie
And when i see that movie i was just IMPRESSED",9,2,4,3 September 2019
Pulp Fiction," Classic and original
","It is a masterpiece but the movie is getting boring at some times.
The actors are the best and the idea is just original",7,0,1,3 September 2019
