movie_title,title,review,rating,helpful,total,date
Child 44," Nothing extraordinary about it
",Citizen X was way better than this strange lookalike ripoff. Even if it had famous actors both swedish and americans it didn't live up to the repetation it has.,5,0,0,9 February 2020
Dunkirk," Yearn...
","I love warmovies, but this was the most boring and dull one in that category. Not Recommended.",5,7,11,1 December 2019
Once Upon a Time... in Hollywood," I was looking forward for this one
","It was good and bad in some way, strange movie. Good acting but very slow the first 2 hours. The last 40 minutes it finally awakes, finally some action. I was thinking of buying this one on 4k, but it were to slow to see it again. Seeing it ones is enough. Q.T. have done way better movies.",6,0,0,23 December 2019
