movie_title,title,review,rating,helpful,total,date
Ant-Man," A solid, enjoyable and entertaining film
","I have to say that I enjoyed the film.Maybe my expectations were a little lower going in than they had been for Ultron and hence I wasn't therefore disappointed. It felt like a perfect counterpoint to Ultron's over crammed roster and bombastic filled to the gunnels approach.It was smaller, it was more intimate and it was more fun. Rudd, Douglas and Pena were great to see and I enjoyed their interactions. The scenes with Falcon were good and I like the angle of Ant man potentially being the fly in the ointment and being slightly off the grid of the Avengers.It sat nicely in the MCU and I liked the fact that Pym was a little dismissive of the Avengers. I think a bit of rivalry or ego between inventors has a useful place.I agree that the bad guy felt a little underdeveloped though I respected the makers showing him turning people and animals into gloop before he perfected his technique. The romance angle felt a bit tenuous and I think I would have preferred if they hadn't gone down that angle.There were less action scenes than a normal Marvel film but this then gave them more weight when they did happen and I really enjoyed the going big and going small transitions. I really liked the fight in a briefcase and the one in Cassie's room.Even though the going sub atomic scene had been telegraphed, I still enjoyed how he was punching his way through the layers of the Hornets suit as he shrank giving him a particularly unpleasant death. Him getting out of the sub atomic zone was also nicely handled with using the previously established 'make big' discs.I concede that the film wasn't the greatest but it was more satisfying than Ultron and better than Thor 2. The character is intriguing and as playing a real every man (Falcon does have military training) I'm really interested in seeing how he interacts with other members of the Avengers and future Marvel films.A solid effort 7.5 out of 10.",7,3,12,22 July 2015
Justice League," An embarrassing and lazy mess of a film
","Wow, I went in with very low expectations but this really was shockingly bad. Everything from blatant exposition from random characters at the beginning, through to ridiculous poster style shots whenever they get the chance - it was just bad.The CGI on Steppenwolf was cringe worthy and genuinely felt like he wasn't there, the opening action scenes to re-establish the characters were ridiculous, the script had no spark or energy in it and everyone (including the director and writer) just seemed to be sleep walking through the whole production.Their lazy arrogance that having a number of characters on the screen is all that you need is just amazing. Have these people learnt nothing from MoS, BvS or SS? I wasn't expecting great things but I thought it might have some good set pieces but I was genuinely stumbling around trying to see or hear something that was genuinely cool or entertaining.Cavill still can't act for **** - apart from the one scene as Superman where he was asked what he likes about Earth. Unfortunately you never find out in what was probably the most memorable scene of the film. Affleck looks bored and unengaged, Miller tries too hard, Mamoa isn't given any decent material and Gadot is reduced to a series of embarrassing bottom or cleavage shots.And really, the mother boxes. What kind of dumb ass name is that? And as for the Lois Lane monologue at end, I couldn't stop laughing at how overly dramatic and self important it was.You really do have to laugh at DC and Warner, their execs seem like the most moronic fools around. They make an okay film in WW and don't study that to try to understand what was right with it. No, just barrel on with pretty pictures and literally nothing else.Their contempt for their audience and their lack of effort or creativity is staggering. I'm astonished to say that I think this is even worse than BvS. What a real stinker.",3,4,9,20 November 2017
The Lord of the Rings: The Fellowship of the Ring," This really is something special
","Let me start by saying that I've never read the books. During my childhood I belonged to the legion that read the works of Tolkien's friend and rival, C S Lewis and the Narnia Chronicles.  They got my imaginative juices flowing and I stepped over Tolkien's work.  The films came out and I had been aware of Peter Jackson's work but with all the furore and lack of money at the time I held back from seeing it for at least two months. Eventually I watched it, enjoyed it but it didn't set me on fire.  My favourite scene, Boromir's last stand, lingered in my mind and over time the desire to see it again grew.  The DVD came out and I looked forward to sitting down with my to brother (who had not seen it) to watch again. Wow ! 2nd time around this thing blew my mind.  Whether it was because I then knew the story and could enjoy the characters and appreciate everything else I don't know but it just rocked my world.  I was like a love sick pup with a constant smile on my face enjoying every scene.  I tell you this tale to qualify my praise and make clear that I wasn't a tolkien fan from the start.Peter Jackson has opened my eyes to this world.  I don't know how faithful he's been (and I don't really care) but you can tell from the passion involved and the love heaped on this film that he takes it seriously and is not out to make a fast hollywood buck.  I purchased the normal DVD and recently got the extended version which is even more fantastic. I don't feel cheated and owning both is worth every penny.  The film itself is great.  The characters are rich and full, well written and well acted.  I can't really say I have a favourite but Gimli definetly comes out better in the extended version and I am looking forward to seeing his developing friendship with the others and his painfully sweet adoration of Galadriel.  The relationship between Boromir and Aragorn is very well played, again displaying real depth and makes Boromir's sacrifice and Aragorn's renewed faith in man all the more powerful.  In fact the film deals with the whole range of human emotions and knowing that they will be developed even more over the course of the next two films just warms your heart. The action scenes are great and with real time invested in the characters you feel all the more tense and involved.  The world Jackson has created is lush and wonderful with special effects serving and enhancing but NOT dominating the story.  The musical score is perfection, complimenting the film at every turn.  Indeed my favourite scene with Boromir owes much of it's brilliance to the beautiful music that accompanies it.  I am wrapped up in this world and although desperate to see the next two am also slowly savouring the whole heady experience.  For those that haven't got it I cannot recommend the extended version enough, it takes what you love and just adds more.In summary this film is a joy to watch and Peter Jackson's direction and story telling is assured and confident.  For the first time ever I'm preparing myself to enter a theatre and observe two films without any thoughts of whether I could have done it better.  I have total confidence in Peter to deliver what I need to see and knowing his cast & crew's passion for the project I know they will deliver.  It took me time to appreciate this beauty and elevate it to my favourite all time film but sometimes you have to step back and look again to observe real genius.",9,2,2,21 November 2002
Man of Steel," Such a disappointment given the promising trailer
","I was so jacked up for Man of Steel before it came out.The trailer created this intriguing vision of a film exploring how Superman would cope in a world of short sound bites, Twitter and low attention span.How would the public deal with him when he made the 'right' decisions rather than the 'popular' ones and whether there would be an endless crusade to get him to have a Facebook page.How would he find his place and bother to actually care for a race that on the surface can seem pretty damn selfish.How would he deal with a surrogate family who were desperate to keep him secret and protected, especially following the accusatory tone from the woman in the trailer 'my son was on that bus'.Unfortunately, we didn't get that film. Just a mess of bits from the trailer (practically all of Costner's comments in the film where in the trailer), characters you didn't really care about despite how much you wanted to, hollow writing, a horribly forced and unconvincing romance, characters that are supposed to die but end up hanging around so much you don't feel they have passed away and a tiresome, bombastic and consequence free action scenes.The action just had no meaning as in the fights neither character seemed to get an advantage from all the wanton destruction. It was like you hit me with a train, I'll smack you with a building but there was no feeling that you were wearing the other person down or gaining the upper hand.I like action as much as the next person but there has to be a reason behind it other than it looking cool or because special effects now mean it can be done.The buildings falling down had as much resonance as the destruction in the latter Transformers films and that's why people criticised the film. It's not because they don't understand it, it's not because they can't see the bigger picture which some arrogantly claim to do, it's simply because they didn't feel anything.The World Engine was a classic example of the 'excess' of the film? There was no tension, there was no high stakes. He might have dodged some swirling tentacles but it was shot by the numbers and we all knew that nothing would happen, hence it was just pointless, expensive noise that further anaesthetised you to the action that would come.I like Snyder. Dawn of the Dead and Watchmen are cracking films but this was just a very poor film.",3,1,3,15 July 2015
Trouble with the Curve," Cliched, tedious and boring
","What a snooze fest this is. It has so many tiresomely predictable cliches that it holds no surprises.Clint is gruff and Amy is 'misunderstood'. She has to contend with a partner convincing her of the need to go exclusive but doesn't know that she likes baseball (not much of a relationship there), a male rival who naturally has to be shown to be a fool.The negative male stereotypes continue when this headstrong woman hustles a guy at the pool table and naturally he tries to force himself on her because that's how all men respond to confident women.By this point, we've gone through all of the tired ABC's of hard working misunderstood woman and you realise that Clint, Amy and Justin are so cardboard cutout in nature that you don't need to see any more to work out where they will end up and that you don't like them or care about what happens.A lazy, boring waste of 60 minutes that I spent watching this.",3,0,1,11 September 2019
Spider-Man: Into the Spider-Verse," For once, the critics and the positive reviews were correct
","I'd been intrigued by this film and my interest encouraged by all of the positive reviews and word of mouth but I've disappointed a lot recently (Endgame being the biggest disappointment) and I feared that this would go the same way.I guess I was sceptical of the glowing reviews that maybe it was because it was a newer, more diverse Spiderman and hence, like Capt Marvel, people weren't saying that it was good because it was well made but rather that you had to like the film because of the agenda behind it.And so, with some trepidation and expectation of disappointment, I bought the Blu ray. What a relief for my fears to be unfounded. It's a brilliant animated Spiderman film.The animation is out of this world impressive. It's new, it's inventive and it feels fresh. Miles is a genuinely likeable character and hence that is all you see rather than some kind of 'tap you on the head' agenda promotion. His interactions with his family are deep and well written and I certainly was made to care about them.The invention also extends to the other characters and whilst there is plenty of humour from them, you don't feel the makers are trying to deliberately ridicule them to state a message.Overall, it was a thoroughly enjoyable experience to watch and I am certainly looking forward to watching it again and checking out the special features.",7,0,0,18 August 2019
Inside Out," Lots of invention, lots of ideas but not enough direction
","I like Pixar films and sat down to this not knowing a huge amount about it.I had an inkling of the basics having seen one of the very early trailers but I hadn't fully immersed myself in all the footage. This meant that I went in reasonably fresh and waiting to be entertained.Granted the concept was fresh, granted there was plenty of invention but it was like they threw them in a tombola and spilled them out into the film without any judicious selectivity.I remember watching the making of featurette for Big Hero 6 and they were discussing how Pixar don't really storyboard a film preferring it to have an organic growth. Now sometimes that can work but for Inside Out it certainly didn't.It just felt like it was made by a large group of people throwing great ideas into the pot but no one then sifting through them to see how they worked in the film. It lacked a firm director to weed out and discard some of these ideas and concentrate on the forward drive of the film.It needed someone to temper the proceedings so Joy didn't dominate the film so much. It needed someone to keep the film bouncing along without slowing down for the next great idea.I was genuinely surprised to find myself bored halfway through and having to give contemplation to leaving when my GF suggested it. As it was I carried on but my attention wasn't held and my wonder wasn't awed.So yes, plenty of clever ideas but not enough focus or momentum.",4,19,54,27 July 2015
Avengers: Endgame," The writers got carried away, the directors over reached and the studio sacrificed the integrity of their product.
","I've just come from watching Endgame and I must say that I am disappointed.I loved Civil War and I loved Infinity War. When I came out of those films, I knew immediately that they were great and that I wanted to see them again. With Endgame, I'm not sure.I respect how they were prepared to show the consequences of what Thanos had done but by killing him off so quickly and then them having to do their own stone quest (hadn't we already seen Thanos doing this in IW) it felt slow and lazy. Worse still was that it felt very self-indulgent and attempting to be clever for clever sake.Like how Back to the Future II considered itself clever for showing the events of the first film but with Marty flitting around behind the scenes to ensure that it all still happened. I know it's meant to be fan pleasing but it really felt like a gimmick and lacking in confidence. Almost like it was saying 'Hey guys, this will make you smile'. If you want to make me smile, concentrate on maintaining the quality of your product rather than directly trying to make me like you.But the trouble with messing around with timelines and bouncing around is that it makes the audience start asking questions during the film. The linearity that we'd seen in IW and the imminent fast approaching threat is replaced in Endgame with a lack of direction and characters that are earlier versions of who the audience have seen.In IW we were shown Thanos. He was written to be sympathetic or at least a character that we the audience could understand. He believed in what he was doing and this made him more rounded. But in Endgame, that version is dispatched quickly and we are supplied with a 2014 (?) Thanos who isn't the character we know but is just a token bad guy.This Thanos hasn't made the sacrifice at Vormire, he isn't the guy that would empathise with Scarlet Witch for what she did to Vision. He has suddenly become a token cut out evil bad guy that needs to be defeated. Hell, the writers even manage to forget their own time loop by saying that this Thanos has learnt that he doesn't want to wipe out 50% anymore because they are too ungrateful. How does he know this when the 2014 Thanos has only just literally arrived in the post wipeout Universe? How has he had time to form the opinion that his previous quest for a 50% cull isn't worthy?Is this a case of the writers being terrified that they had created a bad guy that people related to or was it a fear that they'd written themselves into a hole? Why go to the effort of creating that character in IW to suddenly kill him off at the beginning of Endgame just for a dramatic punch?For me, the time travelling and stone gathering wasted time to create unimportant scenes that fundamentally undermine the films that came before.
In my opinion it would have been better if they had shown the remaining Avengers preparing to do some Avenging and maintained the single minded linearity of IW of battling towards and reaching a post click Thanos and somehow reversing his work.The more I think of the film, the more plot holes and frustrations manifest themselves. Thor's drinking and man child antics might have been initially funny but one begins to realise that they are deliberately doing this to clip his wings. Likewise with Hulk, his primordial desire to smash and destroy has been removed to think it out and he has become an embarrassing shadow of his former self.The thing that is meant to be amazing about the MCU is the world building but inconsistencies have been appearing and there are so many in Endgame that it makes you question whether these two films are written by the same people.In IW, Thanos is a dangerous and credible threat because he has the infinity stones. He takes on half of the Avengers, Strange and some of the Guardians on Titan and smashes them and then takes on the other half on Wakanda and smashes them. Yet it is Stormbreaker (whose creation we have seen been hard earned by a motivated Thor) that has the power to take down Thanos even when he has a full complement of Infinity Stones.Yet we roll forward to Endgame and we have literally all the good guys together in one place, Cap with his shield, Tony fully powered up, Scarlet Witch p*ssed and vengeful, Capt Marvel who can seemingly do anything and Thor wielding both Mjolnir AND Stormbreaker and Thanos NOT in possession of the gauntlet, yet they can't defeat him.It's like the fights in IW were so amazing because the good guys were taking on an unbeatable foe yet here he is now seemingly defeatable by the 'rules' that the writers established . A good example of this would be in IW when Cap is the last man standing before Scarlet Witch and he grabs the gauntlet. You see the look of admiration/respect on Thanos' face that Cap is holding open the gauntlet before he punches him to the ground yet now that scene seems pointless.The writers for Endgame seem to have been driven to undo everything they did in IW. All the tension, all the sacrifice, all the development of Thanos discarded for well, I don't know what. It makes no sense.IW had two incredible scenes that used to choke me up. When Cap appears in the train station, the Avengers theme kicks in and Falcon and Widow take down the henchman in a wonderfully choreographed scene. In just that one scene it shows them coming to the rescue, it shows how intuitively they work together and it showcases their heroism.Likewise when Thor creates Stormbreaker and makes his entrance on Wakanda, I felt it for the journey that Thor has been on. He's had to contend with loss and defeat and humiliation and this is his redemption. Here is a character that has earned his game changing weapon and when he arrives and demands to face a character that everyone else is running away from, I want to punch the air.But in Endgame, that feels like it has to be corrupted. We can't have Thor being dominant, let's break him and make him a fool. We can't have Thanos being complicated and relatable, let's make him a cut out bad guy. We can't have Hulk being rage fuelled and smashing stuff up, let's make him more sensitive and talking stuff out. We can't have Cap being stoic and heroic, let's have him ridiculing one of his own iconic lines in a silly gimmicky fight with himself and commenting on his butt. We can't have a powerful female character that we're invested in look sexy AND be able to take down Thanos, let's give Scarlet Witch a small part but focus our attention on a female character that hasn't earnt our admiration or desire for revenge.To be honest, the 'rules of engagement' had been set so well in IW that when in Endgame Thanos massed his ranks against the Avengers and then ALL of the good guys showed up, I was almost expecting the camera to pull away and not show the fight given that it was so obviously going to be an easy win for the good guys.And as for the big fight scene, it did reek of what DC always manage to do which is just throw everything into an end battle and bludgeon you with CGI and pyrotechnics so that you aren't really sure what is going on.In the many fights in IW, you knew what was going on, you recognised the combatants, you understood the stakes and you identified the geography of the scene. In Endgame we got one big massive fight where everything was thrown in the pot and it was just assumed by the directors that we would be happy with all the flashing lights.
And I have to say that considering that Steve and Tony fell out so hard, and that Tony's criticism of Steve was so unfair, that I really had hoped for more than just a handshake, a muttering of 'no worries' and 'here's your shield'. These guys wrote and directed Civil War, they created the line 'we fell out hard' and hence I had hoped for something deeper and more touching than a handshake.Steve wrote Tony a letter telling him that when he needed him he'd be there but once again the Iron Man bias had to creep in and once again Tony was the victim and the ultimate hero.But I think my biggest problem is how the convenient time travelling undermines everything. When a franchise starts retrofitting stuff (like Fury's eye being from a space cat), it's then hard to consider the previous stories.Having 2014 Gamorra means that all the evolution that we saw her go through in GOTG 1 and 2 is wasted. Having Cap marry Peggy means the pain of his sacrifice, him seeing her in Winter Soldier when she is suffering from Alzheimer's, hell even his blossoming relationship with Sharon Carter is kinda irrelevant. Having seen Thor at last step away from his two weaker origin films into the entertainment of Ragnarok and the redemption in IW leaves us now with a bumbling buffoon.We know that what makes Captain America what he is, is the serum that makes him a super soldier. That he was transformed from a weakling to a superhuman. Sam Wilson is not a super soldier and he didn't take the serum. He is Falcon. Now maybe in the comics he becomes Cap but Bucky is a super soldier. Is the new Cap going to foil an evil plot and be defeated with a tazer or a knife to the chest? Consider the beatings that Steve has taken and the physical strength that he has shown we can recognise that Sam Wilson does not have that.I'm sorry to say but the Russo's have dropped the ball. Themselves and their writers have succumbed to their success and their desire to be engineers of political correctness and social change. I thought Endgame would be the high soaring end to this 10 year run of impressive movie entertainment but in the end the writers got carried away, the directors over reached and the studio sacrificed the integrity of their product for a chance to 'educate' us all. A real shame and a wasted opportunity.Infinity War is clearly the highlight of the last 10 years but even now I fear that repeated viewings will render it pointless considering how the makers decided to fundamentally damage it.",4,1250,2282,4 May 2019
Batman Begins," Starts well with intelligence and invention but then descends
","It had some original stuff that displayed intelligence and thought with regards to his suit, car and weaponry. It did try to dwell on Bruce a lot more and convey some of his darkness but I found towards the end it became very Hollywood-ised. Sometimes filmmakers try to over complicate things and this was a good example.I don't know why they can't have a simple bad guy with a simple plan, why do they have to be so elaborate a plot leaving a growing feeling of inevitability that by the end there will be some big explosions, building destruction, lots of flashing lights and Batman will prevail.The inability of seeing the fighting was immensely frustrating. I don't think I saw him actually land a single punch. It seems a fight scene would be imminent and the makers would speed up the camera, ramp up the bass on the sound, scatter the scene with crunching thuds and smacks but then forget to actually choreograph a fight. Maybe believing that if we heard the thuds and saw some activity on the screen that the audience would imagine the rest and think 'wow, what a scene'. I'd much rather have two or three clearly thrown punches or kicks than 1-2 minutes of whirling cape, bangs and crashes and people falling to the ground.It's a shame that they re-launch the franchise in a blaze of 'this is going to be darker and different' which it certainly starts off doing before descending a little bit into Hollywood banality. Why not have the courage to really shake things up, have the bravery to maybe end it badly (taking T3's lead) or just not conform to the normal formula.Showed promise, had some clever stuff and made more of an effort than some in the franchise but still nothing to rival Batman:Mask of the Phantasm as the best batman ever made in my opinion.",6,46,81,21 June 2005
