movie_title,title,review,rating,helpful,total,date
The Mist," Remember the movie Jude?
","Frank Darabont + Stephen King is usually a good combination. Think The Shawshank redemption en The Green Mile. And yes, The Mist is a very well made movie. Unlike most horror stories it focuses on the horror within ourselves, causing paranoia and panic. What happens to the people that are trapped in the store, is understandable and completely human. I liked that part. There's more suspense than gore. The tentacles of the monsters looked fake, though. Those effects would have worked better in black and white I suppose.No, like everybody who's seen this movie it's the ending that puzzles me. Because no matter how dramatic it is, in the story there's no where a clue to be found that the main characters will do such a thing. Or maybe I missed it? Is there somewhere a conversation like: 'Please, don't let those monsters get me? I'd rather be dead...?' And isn't it strange that the group of survivors will head to the unknown, trying to get out of the fog and suddenly give up like that? Up till 'the moment of truth' The Mist is a well written scary ride in the name of entertainment. Nothing more. But the non-Hollywood ending suggests that there is more to this story. It pretentiously claims that 'this horror movie is more than just a horror movie.' But what makes The Mist so different? Was there an important statement to be made, that justifies the ending? Let's face it: it's a good film but really no Oscar material.The Jude-like conclusion reminds me of the alternative finale in I am Legend. In the original version Will Smith dies. But in this version he survives and leaves New York in search of other survivors. That ending was much more positive than the original one and actually worked much better. Let's hope a similar ending will also be found on the The Mist DVD.7/10",7,1,3,29 March 2008
Grudge Match," They blew it
","You gotta hand it to the producers of Grudge Match. They managed to get both Rocky Balboa and Jake La Motta into one movie. Unfortunately they were so glad with this achievement they forgot to take care of the most important thing in a film: a good script. The story of two old champions who battle it out to determine who's the best is okay at best, but most of the time you get bored by what happens on screen. The film can't choose between drama and comedy and therefor doesn't hit any target. The only reason you keep watching is the cast: DeNiro and Stallone are okay, but it's nice to see the still beautiful Kim Basinger (who turns 61 this year) and the always brilliant Alan Arkin at work. Kevin Hart as wannabe box promoter is pretty irritating though. On the bright side: at the final fight the movie delivers and as a viewer you can live with the end result. But if the leads weren't played by actors who had a famous movie boxing history like Stallone and DeNiro have, this movie would probably have been quite unwatchable.Oh yeah, there is a sort of after credits scene in Grudge Match and sadly this one is the funniest scene in the whole movie. I guess that says enough...6/10",6,1,2,30 March 2014
Transformers," Entertaining but flat
","To me the talented Michael Bay is a director who should dose his action scenes more. I actually got headaches from watching all the exploding things in Armageddon. Those scenes were very well done, but there's also something like overkill. Less action and more character development and his pictures will be more in balance. Enter Transformers. The trailers looked great, the first screenings were very well received and with Steven Spielberg as a producer this project just couldn't get wrong. It doesn't actually, but to say that Transformers is a flawless movie... I guess the best thing about Transformers is that Bay succeeded in making the audience believe that a toy franchise can actually be the basis of a believable and entertaining movie. The first hour of Transformers is great fun. The movie starts with a bang (the first Decepticon destroys an entire base in Qatar) and introduces the world of the Autobots through the eyes of the character of Shia LeBeauf. He plays a very likable geek who wants to buy a car in order to be more popular at school. That car of course turns out to be Bumblebee. LeBeauf is great. Shia plays his character with a lot of humour and he carries the movie without any problems. The second part of the movie is about the war between the Autobots and Decepticons. Here the usual Bay mistake enters. Although the action scenes and special effects are great, a lot of it should have been deleted. Once you've seen a truck turn into a Transformer, you've seen it all. You know the good guys will win, so why not speed it all up? In my opinion science fiction only works when it has a certain degree of logic and realism. In the first part a military captain (Josh Duhamel) who just turned into a father almost gets killed by a Decepticon. The whole world think his legion is dead. But once he's in the normal world again he doesn't call his wife that he's alive and kicking. In the last part of the movie the good guys lure the bad guys to the big city so they have more ways to hide an important item. That's dramatically a good choice, because there are a lot of potential human victims there. But is it realistic? When you know how much damage the Decepticons can do, a big city is the last place you wanna go. The role of Megan Fox is both a curse and a blessing to the story. First of all, she's so incredibly hot that sometimes you wish that the Transformers weren't there to spoil your view. Wow, she rocks! On the other side she starts out as this unreachable babe (like Kirsten Dunst in Spider-Man). But despite all that's happening to them the love story between Shia and Megan remains hard to believe. But then again, maybe I'm just jealous, hahaha! I would like to end this review with one remark. The Transformers toys aim at children between five and twelve years I guess. I know Hasbro has been hoping that the movie would be 9+ (or something along those lines). If you look at all the Aliens-like violence in the movie you can imagine that 9 year old kids (despite the official rating) might visit the movie if they're accompanied by a father. But why spoil this opportunity by putting the scene in in which they talk about masturbation? If you saw the movie you know what I mean. The scene was very funny, though. Transformers is a great action movie and will without any doubt be a huge success and the first installment of a movie series. The second movie will be the movie of truth. Okay, we know now that Transformers can disguise themselves and transform from a car into a robot. Now show us things they can do that can reach us at a dramatic level!7,5 out of 10",8,14,28,26 June 2007
Charlie and the Chocolate Factory," Can't believe all the praise!
","When I look at all the positive reviews I can't believe my eyes. I really liked the first part of the movie when the 5 winners are found and presented. But what happens in the chocolate factory itself is visually stunning but very low on a human level. You never have the feeling that the kids are in a real competition and the parents react so strangely unemotional when their children screw up and must leave the party in such a painful way. Too bad! The 2001 joke was very funny, though. Of course there are some great candy ideas presented in the factory. But when you've seen one, two or three, then you've seen them all. The Gene Wilder version was much warmer overall. So I prefer that one when you compare the two.",7,0,2,6 August 2005
Avengers: Age of Ultron," Even with high expectations it doesn't even disappoint!
","Tony Stark wants to invent something that benefits mankind but instead turns out to be the one responsible for the creation of this dangerous self thinking robot, Ultron. The Avengers must assemble once again to fight this menace that wants to kill all the humans on this planet. But Ultron is powerful and the way he is presented makes you wonder how our heroes can defeat him. Just you wait and see...What I liked best about Age of Ultron was the fact that all our favorite heroes get equal screen time to show of what they can do. Although the action scenes are great (Iron Man in the Hulkbuster versus Hulk!) the thing that really makes this movie work is the interaction between all the people involved. Stark and Banner, Banner and Black Widow, Hawkeye and Black Widow, Thor and Captain America... like in real life you can see with whom each of them get along best. It's also nice to see that Hawkeye gets a lot of screen time. He even gets the most interesting background story of the bunch. Quicksilver and Scarlet Witch make a great addition to the team (sort of) and there are a lot more cameos in the movie (although I don't think anybody spotted Lou Ferrigno!).The movie runs about two and a half hours and that's pretty long. It could have been a little bit shorter, but overall I didn't mind. With great action scenes (pay attention to the opening action sequence in which he introduces the Avengers in one mighty shot!), nice humor, a lot of cameos and a satisfying finale writer/director Joss Whedon has everything under control and that pays of.This year (2015) The Avengers Age of Ultron will shatter all box office records and that will be a fitting reward for giving most Marvel fans and 'normal' moviegoers this big treat. Even Pixar slipped (with Cars 2 and Brave) so everybody's waiting for Marvel to produce a real stinker. Although that day may come, The Avengers part 2 is not the movie that will be responsible for that!8,5 / 10",8,89,177,20 April 2015
Pride & Prejudice," Where are Colin and Hugh when you need them?
","In 1995 the 5 hours miniseries of Pride & Prejudice, with Colin Firth as Darcy and Jennifer Ehle as Elizabeth Bennet, was a big hit in England and the Netherlands. It even inspired Helen Fielding to write the Bridget Jones's novels. Therefor, whether you'll like the new 2005 movie mainly depends on the fact if you've seen the version that was done ten years ago. If you have, you'll probably be very disappointed with the Knightly movie. If you haven't, well, maybe this romantic flick may be 'amiable' enough for you.For those who aren't familiar with the story: Pride & Prejudice is a romantic costume drama that takes place in 19th century England and is based on the famous novel by Jane Austen. The story is about the Bennet family, a father, mother and five or six daughters. The only way to secure the future of the children is to marry a party that owns a lot of money. Jane, the oldest sister, is beautiful but a little icy. She hopes to marry young Bingley, a rich aristocrat who just moved to a castle nearby. Her younger sister Elizabeth, the main character of the movie, wants to help her conquer his heart, but finds out that Bingley's best friend, the rich but arrogant mister Darcy, sabotages her plans. Elizabeth and Darcy start out as enemies, but as the story progresses they both find out that their opinions of each other are based on wrong information, pride and prejudice.Let's bring the good news first. The new Pride & Prejudice is the big Keira Knightly show. Although she cannot top Jennifer Ehle's performance, Knightly proves that she has real star-power and that she is able to carry a movie. She looks lovely in this flick: she enchants you with her great smile and has the charms of a young Winona Ryder. Dame Judi Dench is excellent as Darcy's powerful aunt who is against a marriage and Donald Sutherland has a both moving and funny scene at the end of the movie when he gives permission to Darcy to marry Elizabeth. The end of the movie is actually better than the one in the miniseries. Okay, then the bad news. I guess the main flaw of this new version is Darcy himself, a role played by Matthew MacFadyen. In the story he is rather dull and generally uninterested in what's going on. It must be difficult to replace Colin Firth as leading man and the Darcy of the miniseries of course had more (screen)time to show his inner struggle. But the new Darcy is so dull that frankly you don't care if he ends up winning Elizabeth's heart or not. There is absolutely no spark between Knightly and MacFadyen. At the end of the movie they don't even kiss and as an audience you couldn't care less. But Darcy isn't the only one that seems miscast. The new mister Bingley is  despite his Jamie Oliver haircut  a real nerd, and mister Wickham, who falls in love with Elizabeth but elopes with her younger sister, lacks the depth to be an interesting villain. Because of the time-frame, the movie is less subtle than the miniseries. There's a lot to be told in two hours and because of that there is hardly any suspense. Problems rise but they are solved within minutes. But what I really missed were the great dialogs. In the miniseries heavy emotions were always masqueraded by politeness. Darcy doesn't say 'Wow, it's great to see you, Elizabeth' but instead asks if her parents are in good health. The things that are NOT said were more interesting than the things that were indeed spoken out. The encounters between Elizabeth and Darcy always turned out to be great fights in which words and sentences were used as swords and daggers. I really missed that in the new version. Come to think of it, I also missed the humor you did see in Ang Lee's Sense & Sensibility, also based on a Jane Austen novel. Where is Hugh Grant when you need him?A friend of mine  also a journalist  really liked this movie. But he hadn't seen the Colin Firth/Jennifer Ehle version from 1995. So perhaps I'm a little hard on what was presented to me last week, because the film does have its qualities.7 of out of 10",7,391,672,28 July 2005
Avatar," Avatar is not a movie. It's an event!
","Frankly, I didn't think James Cameron would pull it off, but he did. Avatar turned into a groundbreaking work of art... if you look at the visual side of the movie. If you watch this movie in IMAX 3D – as you should – it will be an unforgettable experience. You have the feeling that you've actually been to the planet of Pandora. You'll really think that an alien race like the Na'vi exist. James Cameron did a great job inventing their language, habits and rituals. He also put a lot of detail into the planet itself. The exotic animals do not all convince, but the trees, plants and insects are stunning. Especially the images of the floating mountains are unforgettable. But does Avatar also break ground on a story level? No, it doesn't. Like many visitors have concluded before, the movie heavily relies on a flick like Dances with wolves and borrows elements from a game like Assassin's Creed. This scifi tale is pretty predictable actually, but that doesn't hurt in any way. You know the good side will win eventually and you know the hero in the end gets the girl. In order to see that happen you'll be more than willing to sit through the whole 165 minutes of the movie.Oh, perhaps there's at least one thing that can be considered groundbreaking storywise. To me this was perhaps the first time that a director/writer succeeded in showing a believable love story between a human and an alien. The chemistry between our human hero and alien heroin didn't have Titanic proportions, but it worked.At this point (Dec 20th) it is clear that Avatar is a big hit worldwide. I don't know if it will cover its costs but the hype is there. I only wonder if the audience understands the fact that James Cameron used two major American tragedies to achieve the right sentiment for the story. The first one is obviously the tragedy of the Native American people. Like the Na'vi they were slaughtered by the (white) men in the name of greed. In the story of Avatar they win the fight, but as we all know in real life it was different. Is this a case of alternate history? The second tragedy used by Cameron is a powerful one: the collapsing of the World Trade Centre. In Avatar it translates into an impressive and moving scene, but one could wonder if tragedies like these aren't too sacred to be used in entertainment movies like these. Here they're only used for dramatic effect, not for a (political) statement. But maybe I'm just nitpicking here. Avatar is a impressive and unforgettable movie experience. James Cameron establishes himself as the great moviemaker he is and I cannot think of anyone who can resist his imagining of a this wondrous fantasy world. After 12 years of silence, the success of Titanic behind him and stories of an ever increasing budget, the pressure on James Cameron must have been inhumanly big. But still, the man delivers. Avatar is not a movie. It's an event!9/10",9,3,8,20 December 2009
Transformers: Revenge of the Fallen," 120% Explosions, 75% entertainment
","When will Michael Bay learn that sometimes less is more? In the Transformers sequel there are so many explosions, transformations and robot fights that you soon reach a point that you almost don't care anymore. I say 'almost', because as a big budget action movie Revenge of the Fallen surely delivers... for the fans.The first 20 minutes or so are plain bad. The story starts out in the past when we see Bionicle-like Decepticons inhabit our very earth. Jumping to the present the movie treats us with some childish humour (a crying Bumblebee? Come on!) before it really kicks off at the university. Our hero Sam Witwicky (Shia Labeouf) has a close encounter with an incredibly hot female student. Too good to be true, of course! But the lady turns out to be a lethal Decepticon and a few seconds later the big chase/escape/adventure begins.When the Decepticon invasion starts invading our planet and something terrible happens to Optimus Prime the movie gets interesting. The special effects are first rate (the sinking of a big marine ship, the Decepticons under water), Megan Fox looks incredible sexy, Shia Labeouf has some great funny moments and John Turturro... well, John Turturro is as neurotic as he's always been.Too bad that the movie is about 20 minutes too long and that there are so many fights and explosions that they cannot make a big impact anymore. The direct confrontations between the Autobots and Decepticons are so unclear that you never know which one is winning or gets damaged. Thank God Michael Bay sometimes uses slow motion.I guess something pretty drastic must happen in the inevitable Transformers part III to keep the franchise alive. Because although this sequel is a great spectacle it showed nothing new. Except maybe the fact that some Decepticons can disguise themselves as humans - like in Battlestar Galactica. If you enjoyed part 1 you will certainly enjoy this one too. But this sequel will not win the franchise new friends...7,5 out of 10",7,1,4,23 June 2009
WALL·E," Funny and engaging, but foggy in the second half
","The guys at Pixar are known not to take the easy road. A world filled with speaking cars? Monsters that scare kids in order to keep the electricity flowing? Their fantasies are not the easiest ones to be put on the screen. Wall-E is also a daring project. It's the story of a lonely robot who falls in love with another robot, follows her across the galaxy and in the end saves mankind. Sort of.The problem with Wall-E is also the challenge of the whole movie. How can you make the audience care for a creature that is a machine? How can you make a love story that revolves around robots? Pixar does it with lots of visual Buster Keaton-like humor. Wall-E is clumsy, strict, kind and... lonely. Although E.T. immediately comes to mind he also shares a lot of characteristics with Mr. Bean. The first part of the movie - in which we see Wall-E doing his thing in a deserted human world - is actually the best. Visually stunning we immediately believe in Wall-E's world. It's dark, stuffy but fascinating.His dull life changes when EVE lands on earth. EVE is a high-tech investigating robot who has to report to a group of surviving humans. The two fall in love but when EVE must go back, Wall-E can't let her go. He follows her to a big spaceship that has been entertaining the surviving humans for 700 years. The ship was supposed to do so until earth was safe again to go back. But are the spoilt humans up to the change?Somehow the second part of the movie doesn't entirely work. The idea of a ship traveling through space is not new. Classic SF writers like Robert Heinlein wrote books about it. Pixar does a nice job by showing a society in which humans don't have to do anything anymore and all become physically supersized. This sarcastic tone is well done. But from the moment Wall-E arrives at the spaceship the story becomes unclear. What is Wall-E's mission? What does he have to achieve in order to save the humans? And do they really want to be saved?The end - where the humans give up their luxury lives to return to earth - seems somewhat illogical. The deserted earth that is presented to us does not seem that inviting. And that's a pity. Because Wall-E remains great entertainment and deserves to be a great hit. But compared to Kung Fu Panda the Pixar movie is maybe a little bit to ambitious to reach its real goal. Wall-E is a great movie, but not Pixar's best.",8,8,20,22 June 2008
X-Men: First Class," The best prequel movie ever made... period
","Normally prequel movies are made because the main characters of the first movie died (or in the end achieved their goals) and the producers still want to make money out of the franchise. Think Butch Cassidy & The Sundance Kid, Psycho, the (still to be made?) I am legend and of course George Lucas's Star Wars saga. X-Men First Class also falls into that category, but I cannot imagine that anybody will be complaining about that. Director Matthew Vaughn created a great, thrilling and sometimes even moving picture that without any doubt will get raving reviews and be a huge commercial success. God knows both movie and director deserve it.What makes X-Men First Class really work is the great story. It tells us about the beginning of the mutants and especially the friendship between professor X (a charming James McAvoy) and Erik Lensherr/Magneto (an impressive Michael Fassbender). Although they will drift apart at some time, you know that they will always have respect for each other. In this stage they even become close friends. The movie opens during World War 2, when young boy Erik is taken to a concentration camp (like the opening of the first X-Men movie). There he meets Sebestian Shaw (a great Kevin Bacon), a scary Joseph Mengele-like scientist who likes to experiment on Jews and is especially interested in mutants. In order to force Erik into helping him he shoots his mother. Erik never forgives him for that and spends his whole life looking for revenge. Unfortunately he learns that Shaw is also a mutant. The scientist is even so powerful that it's almost impossible for Erik to kill him. Luckily he bumps into Charles Xavier...What I also like about First Class is that the movie takes place in the past (the sixties) and uses historical events (the Cuba crisis and the Cold War) to make its point. Erik claims that no matter how many times mutants save the world, normal people will always see them as enemies. Professor X still wants to believe in the good of the people. With that message the foundation is laid for X-Men 1-3.The performances in First Class are first rate. Kevin Bacon is a brilliant villain. His German is actually quite good and his opening scene can already be considered as a classic. He also speaks Russian in the movie by the way. Michael Fassbender (Magneto) represents the most exciting drama in the story. He's kinda like Darth Vader. You know he will turn to the Dark Side but you still hope that somehow he will stick with professor X.First Class will be the beginning of super stardom for actress Jennifer Lawrence. She plays Raven in the story, a girl Xavier adopts as a real sister/best friend. She later becomes Mystique. Jennifer won critical acclaim with her role in Winter Bone and will play the lead in the much anticipated The Hunger Games movie, to be released in 2012. She is a great, vulnerable Mystique who later on chooses Magneto over 'her brother' Professor X. So what's more to tell? January Jones as Emma Frost is sexy as hell, the special effects in the movie are great and there are not one but two cameos from actors from the first X-Men movie (and no, the second one is not Patrick Stewart). Unlike previous Marvel movies there is no extra scene after the end credits and Stan Lee does not have a small part in this one. Overall First Class makes you think of the Sean Connery Bond movies and the reboot of Star Trek (2009).So... are you convinced? Just go see this excellent movie. Can't wait for its sequel!9/10",8,95,149,27 May 2011
