movie_title,title,review,rating,helpful,total,date
The Green Mile," 'Walking My Very Own Green Mile'
","A true masterclass in movie-making. Faultless acting, a running time that speeds along and a cracking story. Well-paced with enough time to make the characters 5-dimensional. No worthless characters, Tom Hanks brilliant as Paul Edgecombe, with Brutus, Harry and Dean his back-up guards all well-thought-out and researched. Percy, the weak and cowardly guard,is well acted and very good in his role. Edward Delacroiex, a evil prisoner who gets redemption with the help of his pet mouse, Mr Jingles. The Boss, Hal, and his unfortunate wife struck with a tumour add a cold touch to it and helps the movie emotionally. Wild Bill, by the end of the movie you would wish you could kill him yourself, Sam Rockwell does so well. But running several green miles ahead with a absolutely wonderful turn as John Coffey, the black monster-man with a heart of gold and the Hands Of God, brilliant stuff. Don't miss.'Paul Edgecomb is a slightly cynical veteran prison guard on Death row in the 1930's. His faith, and sanity, deteriorated by watching men live and die, Edgecomb is about to have a complete turn around in attitude. Enter John Coffey, He's eight feet tall. He has hands the size of waffle irons. He's been accused of the murder of two children... and he's afraid to sleep in a cell without a night-light. And Edgecomb, as well as the other prison guards - Brutus, a sympathetic guard, and Percy, a stuck up, perverse, and violent person, are in for a strange experience that involves intelligent mice, brutal executions, and the revelation about Coffey's innocence and his true identity.'",10,0,2,31 July 2006
Lord of War," I Apologize To You Nicholas
","'In the 80s in Little Odessa, the Ukrainian immigrant Yuri Orlov (Nicolas Cage) decides to change his economical life and becomes an arm dealer with his brother Vitaly Orlov (Jared Leto). His business of gunrunner supplying illegal weapons in disturbed areas of the planet increases with the end of the Cold War, and Yuri bribes a Russian general to sell most of his arsenal. Meanwhile, he becomes a millionaire and uses his money to seduce the beautiful Ava Fontaine (Bridget Moynahan) and they get married, having a son. The detective Jack Valentine (Ethan Hawke) chases Yuri trying to put him in jail, but in the end he understands that Yuri is a necessary evil for the interest of his nation.'I have never been a big fan of Nicholas Cage, feeling that his performances usually hamper the movie. But for once, he makes the movie. He is the one the movie relies upon and makes it tick. His monotone voice suits it very well and the sudden energy he projects comforts the film well. The movie itself, is brilliant. It's very compelling, very addictive and very entertaining. The plot doesn't sound much but it actually works and with a good supporting cast, especially Ethan Hawke, it's a good movie for a Saturday. And the Bullet scene rocks!",8,4,7,25 July 2006
The Shawshank Redemption," PURE Brilliance
","A heartbreaking story fraught with Passion, Loss, A Dream, and Friendship. There's only so much i can say about a film that is loved by millions and yet misunderstood by more. It's the visual version of a musical ballad. A soft and thoughtful piece and yet created by a hard centre and churned by the brilliant hands of Frank Darabont and the great acting of both Tim Robbins and Morgan Freeman. A True Classic.'Andy Dufresne, is sent to Shawshank Prison for the murder of his wife and secret lover. He is very isolated and lonely at first, but realises there is something deep inside your body, that people can't touch and get to....'HOPE'. Andy becomes friends with prison 'fixer' Red (Morgan Freeman), and Andy epitomises why it is crucial to have dreams. His spirit and determination, leads us into a world full of imagination, filled with courage and desire. Will Andy ever realise his dreams...?'",10,0,1,31 July 2006
Casino Royale," Its dark, gritty and original, And Brilliant
","The latest James Bond movies, have been laden with technology, bad guys getting more and more ridiculous, plots more and more unbelievable. Lately, I have gone from being a fan of James Bond to being bored of it, too unbelievable, and many fans agreed. The Bourne Identity came out and was instantly loved, it was something you could believe in, no invisible cars or whatever. The producers took that on board and realised they needed a change. So what to do? You start again, get rid of your original Bond, get a younger one in, you lose the gadgets, you go back to basics, get a storyline in, and make it action packed with a dark and gritty style, you make the story about the beginning, and show the evolution of James Bond. What comes out of that? The best Bond movie in over a decade, if not in two.Now, the movie, i admit, could have been better, but this movie, is about Daniel Craig, and how does he handle the role?? Like a duck to water. His early arrogance and cockiness in his ability to do things, and the fact hes more a thug than a renowned killer. This movie, you gradually see Daniel Craig grow as a person and an agent in standing, his natural intelligence coerces him into using his abilities more wisely, and gradually morphs into the James Bond we love.This movie sticks closely to the book, there's many scenes lifted from the book, which makes it look good. Le Chiffre as a bad guy is an interesting one, he is more of an intellectual battle, which gives it a different look on things. The main climax is no explosions, no big fights, instead.....it's a game of poker. This is actually better as it shows its more brain over brawn, show the intelligent side to Bond. The love interest Vesper is more of a present day woman, very sure of herself, and doesn't instantly fall for the cold Bond, making their romance more believable. And I just want to give special mention to, THAT torture scene, which Bond comes through admirably, which truly shows the strength of mind and character of Bond.Brilliant movie, get it now.",9,0,3,19 April 2007
300," A new age has begun, an age of freedom. And all will know that 300 Spartans gave their last breath to defend it!!!300, *****
","One of the most exhilarating films I have seen in a long time. I saw it on trailers on you-tube in January and have wanted to see it. Yesterdy I watched it. Now, lets have a look at it.Story; Story is simple and yet brilliant, a tale of sacrifice and honour, a pure story of true greatness.Inspired, not based, on similar occurrences from an old age, this is war to the max, as overblown and cartoonish as possible, and yet brilliant.The Scenery; we all know they used CGI, pretty obvious, hard not to notice it. Everyone has a go at it. I say, who cares???? It just gives it an interesting realism look similar to that you expect in a art-piece, and to some degrees, this is art redefined, and looks brilliant, it looks like a Dreamesque world as the Golden and Red sands and creations blow over you, pure brilliance.Gerard Butler; Supposedly he just shouts a bit and walks around topless. The truth is, he has charisma in abundance that breaks through and has you believing in him as a KIng. He battles hard for his men, and treats them as equals, and due to this, makes him a King your willing to follow, he is the bets bit of the show.The Queen; beautiful, and yet a true feminist, she leads the Spartan army alongside her husband and is treated as an equal to her husband in a world of men. Women are just as tough as the men, and at times, more vicious, and she demonstrates her power over the men. Good actress.Characterisation; I wont lie, the characterisation isn't great, it ain't the main subject for the directors. But who is surprised? You learn these people as you go along, you bond with them on the battlefield and learn about them in the heat of battle, which is how this movie works. Characterisation is enough to pass-by, but your here for the battle-scenes.Graphic Violence; The women are naked, tits are shown, and blood is a necessity. Violent? yes. Worth it? Definitely!!!! The Battlescenes; What you came to see, and my god, ain't they worth it?? You have fights against wolves, against Rhinos and Elephants, against magicians, against Ninja types, and against monsters. Its like fighting against a real 7 Nation Army, you have different styles of mies you face on the battlefield, which makes it oh so much better. The blood flies, the dirt grains, the body parts slash and dice, this is a war, and looks f****** amazing, you have to see it to appreciate it.If I have missed out any bits, i will come back and redo this again, so don't worry. Basically, this is the SEX, when it comes to movies, a real roller-coaster of a ride, and you will love it. Watch it and love it.",10,4,10,6 April 2007
