movie_title,title,review,rating,helpful,total,date
Vanilla Sky," I want Cruise and Crowe Dead Yesterday!!! Spoilers Galore
","Please read my spoilers and say yourself the admission!The whole damn film is a Cryogenic Dream! It's a g-ddamn cryogenic dream!!! Who the Hell cares about someone else's cryogenic dream and why would they in the first place anyway?How bad is this 'daring experimental edgey' film? Do you care about Tom Cruise's personal nightmare? That he looses his face?  His nightmare, not mine. Believe it or not kiddies (and I do mean kiddies!) there are strong people out there who can and do cope with worse than that.  And they never had what Cruise at least got to have before he looses his face.If you loved this film, you must have worked for CBS years ago....remember how they tried to save Dallas? They just decided to make the whole season a DREAM and bring back the ratings draw Bobby character. Now they do it in movies.As slow as this awful film was, and even as useless an exercise in time wasting as watching Penelope and Tom fall for each other is, I had just that tinge of intrique.  How could someone be disfigured in a scorned lover's vengeful attempt at double suicide and then be indicted for murder? How? How? Cryogenic Dream, that's how! A g-ddamn stupid who gives a damn cryogenic dream!!!!! Experimental?  Daring? Inventive? ABRE LOS OJOS, IMBECILE !!!!!!!!!!!!Question.  Was the original Spanish version based on the same lame pretext?  I would have hoped for bettter from Europeans.  It pains me that this film is doing modestly well in the box office. I would like to think that the competition is equally poor right now.  I really liked Crowe's Almost Famous effort last time.  I hope to God he's not going to give us more of this stuff. Please.",Null,0,0,29 January 2002
Vicky Cristina Barcelona," The Woodman hits a home run, finally (some mild spoilers)
","Perhaps the oldest working director in films (at least that would seem to be so for a successful stand-up comic WHO STARTED IN THE FIFTIES!) has turned out a beaut. Woody Allen has penned an adult romantic comedy with ten times the laughs (at least for me) of Pineapple Express. Called 'Vicky And Christina Spend the Summer in Barcelona'.The star of the film is none other than the cold killer from No Country For Old Men, Oscar winner Javier Bardem proving his acting range goes way beyond scaring the s-word out of people. He plays a full of life, passionate Spanish painter-lover, and bless him for this. He nails a fine-wine getting hotter as she gets older Penelope Cruz, an equally desirable please-let-me-have-this Scarlett Johansen and a prissy uptight academic Rebecca Hall, who none of you ever heard of before (admit it). Sometimes more than one of them at the same time.The acting is flawless. That's why Penelope and Scarlett stand out from other cinema hotties....they can act, they both have their craft down perfectly. Sadly, none of them go nude in the flick, but guys, there is a scene between Penny and Scarlett that will make you want to stand up and cheer anyway. YAHOOOOOO !!!Woody's script shows two particular brilliancies, that seems to evade the rest of the hacks of Hollywood. He likes to insert his own film personnae into his films, and this time it's the Rebecca Hall character who does the Woodman's comedic pseudo-intellectual schtick. Really smart to switch himself to the woman, cause when he's used younger actors as himself, it becomes imitative parody and fails. And Woody himself it just too old for any make-up genius to make you think he is only 60, an age he passed a long long time ago. Rebecca is remarkable, holding her own against the two stellar screen beauties...and making her far less than super looks come out as still highly desirable.....in controlled passion coming out of it's containment at last.Secondly, Woody brilliantly uses a narrator to make his cinematic novel come alive. The dialogue you would read in a novel comes to life in the faces of this great crew of actors. And instead of adding 30+ minutes of extraneous films to set the scene, or making stupid dialogue just so the audience can be informed of the plot, a simple line or two or concise narration keeps the film moving at a perfect pace. And Woody uses a young actor, not his old self for the narrator, which would have detracted from the youth and exuberance of the film.Also, the musical score and the cinematography are great, simply great. Good job old guy. I loved the film. You made us old guys proud. And err, next time could you let us see Johannsen's goods. I KNOW she's shown you, you can't lie to M2b. So share.",10,7,17,19 August 2008
The Lord of the Rings: The Return of the King," Sauron and the Orks...all they ever do is lose! (spoilers)
","Sauron, the evil eye, looses. He gets stronger. They keep telling us how he gets stronger and stronger and he just keeps losing. Imagine if he had won something? In Fellowship, the Orcs kill one Prince of Gondor. he kills about 50 of them first, but hey, who's keeping score? In Towers, some ronin riders of Rohan come upon an Orc battalion and guess what? Ork Stew! They do pretty well with 10,000 orkies in the battle of Helmskeep or Helmsdeep or whatever, until the newly whitened gray wizard shows up with a few thousand riders (Rohan-ians or Gondor-ians? I cannot remember) and, once again, 10,000 orcs are soon fit for the pot. At the same time, the large Tree-things retake the other tower city with the other white (bad) wizard, wipe out that army, destroy that tower and eliminate the Evil Eye's most loyal bad-white-wizard ally. I'd say at that point, that Sauron is doing very badly. Maybe Bagdad Bob would say he's just getting stronger, because that's exactly what Good-white-wizard says even as her surveys two massive battle victories. Imagine if they had lost? Now, in Rings, the evil eye sends another 10,000 orks against the capital city of Gondor: Minas Gerais. Well, some Minas, if not Gerais. How do they do? Well, okay until Aragon shows up with a new phantom army pledged to fight for the True King. That's 20,000 orks gone in two big battles, and just how many orks did the tree-things kill? Oh, and a GIRL kills his top flying magical warrior. This is not good for Evil Eyes! If I was the evil eye, I'd be worried at this point, wouldn't you? Nope, he's fine. So long as the Ring isn't melting in Mordor, he's just getting stronger. Yessirree. So, we take what's left of the Gondor-Rohan merged cavalry and ride out to the Doors of Doom to 'distract' the last remaining 10,000 orks. I guess Evil felt a 30,000 man ork army was enough to bring back evil to Middle Earth. The schmuck! So's his only fear is a melting ring, he stations ONE killer giant spider to protect the Mordor furnace, and just sends out his last 10,000 orkies into a diversionary battle. Evil personified? Maybe. As dumb as they come? No doubt.",Null,0,0,2 January 2004
