movie_title,title,review,rating,helpful,total,date
The Lobster," Lobsters are for eating, not watching
","No it's not a screwball comedy. STIR Crazy is a screwball comedy.
It is quirky. But not in a good way.
The acters frequently recite their lines like in a school play with no emotion. Flat, dull and emotionless. ALL the acters. Clearly no one was getting paid much.
The premise is interesting but would be better suited for a short film. And oh you don't even get a resolution at the end just a chick waiting at a table for a loser to stab his eyes out.",2,3,7,19 August 2019
