movie_title,title,review,rating,helpful,total,date
Vertigo," For Me, VERTIGO Keeps Getting Better Over Time
","(No fooling -- SPOILERS galore here!) It's hard to believe now, but when I was younger, I used to have a love/hate relationship with Alfred Hitchcock's classic romantic psychological thriller VERTIGO. I loved its suspense, moving performances, haunting love story, dreamlike quality, and poignant yet powerful Bernard Herrmann score -- so why did it take me years to embrace VERTIGO as wholeheartedly as our beleaguered hero John 'Scottie' Ferguson embraces his beloved Madeleine Elster? James Stewart plays Scottie, a former police detective who finds out the hard way that he has acrophobia (fear of heights, to us laypeople) when he can't save a patrolman from falling to his death during a rooftop chase. Since VERTIGO is a Hitchcock movie, what better place for our hero to live and wrestle with his phobia than San Francisco? While working on a cantilever bra invented by an engineer (nice work if you can get it!), Scottie's gal pal, designer Midge Wood (wry scene-stealer Barbara Bel Geddes) tries to help him overcome his fear gradually with stepladders ('I look up, I look down...'). Too bad the ladders happen to be next to Midge's high-rise apartment's window. Poor guy, it's always something! Scottie's old college chum Gavin Elster (suave Tom Helmore) offers him a private investigator job tailing his lovely but troubled young wife, Madeleine (Kim Novak in her finest and most challenging performance). Seems that Madeleine -- one of the coolest and most elegant of the director's legendary 'Hitchcock blondes' -- thinks she's possessed by the spirit of her late great-grandmother Carlotta Valdes, and is behaving accordingly. Scottie tails Madeleine all over San Francisco to the places where the tragic Carlotta lived, loved, and went mad after her sugar daddy 'threw her away' and kept their love child. Our detective finally comes face to face with his quarry after saving her when she jumps into the bay in one of her fugue states.As the song says, the hunter is captured by the game. Soon Scottie and Madeleine are mad for each other -- but it seems poor troubled Madeleine is also mad in a less romantic way. When she confides in Scottie about her recurring morbid dreams about the Mission at San Juan Bautista, Scottie brings her there in hopes of curing her obsession. Bad move, Scottie -- Madeleine bolts to the bell tower. Scottie gives chase, but his vertigo paralyzes him halfway up the stairs (great spatial F/X here). He hears a woman screaming, sees a body fall past the window...and his beloved Madeleine is no more.Or is she? After he recovers from a grief-induced nervous breakdown, Scottie spies shopgirl Judy Barton (the versatile Novak again). Except for her red hair and somewhat tacky fashion sense, Judy's a dead ringer for Madeleine! As their relationship grows, so does audience apprehension as Scottie obsessively tries to give Judy the ultimate makeover, recreating his lost love. (Where's the WHAT NOT TO WEAR crew when you need them? :-)) Judy's a quick study -- because she's really Madeleine! See, Judy was Elster's mistress, and he coached her to look and act like the real Madeleine Elster as part of a murder plot. 'Twas the real Mrs. Elster who died at the mission that day, and Elster's real purpose for poor Scottie was to witness the 'suicide.' Since Judy truly loves Scottie, has all the self-esteem of a squashed grape, and doesn't want to spill the murder plot, she's willing to play Eliza Doolittle to Scottie's macabre Henry Higgins. But the jig is up when, post-makeover, Judy wears a necklace Scottie recognizes as part of Madeleine's Carlotta Valdes collection. Furious at being played for a sucker, he takes Judy to the mission tower and forces her to confess. A black shape looms. Guilt-ridden Judy is so spooked by what turns out to be a curious nun (Judy must've gone to one of those tough parochial schools) that she loses her balance and falls...and a shattered Scottie loses his Madeleine a second, final time, looking like he wants to join her.When I first saw VERTIGO in my college years during its 1980s re-release, I thought it was well worth seeing, but Scottie's necrophilic mania to recreate Judy as Madeleine really upset me. I found myself rooting for, angry at, and sorry for Scottie and Judy all at once. Stewart's portrayal of a man obsessed is tragic and unnerving; Hitchcock really knew how to tap into his leading man's dark side. As if the ghoulishness of Scottie's romantic obsession and the malleable Judy's heartbreaking lack of self-esteem weren't frustrating enough, even the department store salespeople and salon personnel in the film go along with Scottie's demands ('The gentleman certainly seems to know what he wants.') despite Judy's anguished protests. My husband Vinnie aptly noted that everyone on screen acted like Scottie was having a dog groomed.On my first time around, it seemed to me that Hitchcock gave away the mystery's solution too soon, making the rest of the film anticlimactic. But my appreciation for VERTIGO grew over the years as I matured and learned more about life, people, and emotions. By the time we saw the beautifully restored version of VERTIGO at NYC's Ziegfeld Theatre in 1996, Judy's revelatory letter touched my heart and added to the suspense of waiting for the other shoe to drop for Scottie. There's no question that VERTIGO has long since become one of my favorite Hitchcock films!",9,15,20,22 August 2010
In Bruges," Great Performances and Dialogue Make IN BRUGES a Modern Classic
","I first saw the dark comedy-thriller IN BRUGES (IB) in our local multiplex back in April 2008, and I loved it immediately. No wonder writer/director Martin McDonagh's screenplay went on to be nominated for an Oscar, and co-star Colin Farrell won a Golden Globe award for Best Actor in a Comedy/Musical! When McDonagh's short film SIX SHOOTER, starring Brendan Gleeson, won the 2005 Oscar for Best Live Action Short Film, I was already familiar with his plays (including the 2005 Broadway hit THE PILLOWMAN with our family's household fave Jeff Goldblum), so I looked forward to seeing Gleeson work with McDonagh again in IB. I wasn't disappointed. McDonagh's quirky, funny, soul-searching dialogue is a joy to hear. It's chock full of profanity, but the delivery renders it more comical than offensive. The filmmakers even spoof the 'adult language' in one of the DVD's bonus features, a montage of every time the word 'F***' is used in IB.Gleeson and Farrell make a great seriocomic team as Ken and Ray, two Irish hit men who have suspenseful and surreal adventures hiding out in Belgium in the magnificent city of Bruges after their latest job goes horribly, heartbreakingly wrong. They're the ultimate odd-couple tourists as they await further instructions from their boss, with Ken enjoying the sightseeing and the swans as Ray spews forth befuddled, unfavorable, hilariously un-PC opinions of just about everything and everyone he encounters, except a pretty Flemish production assistant (Clemence Poesy of 127 HOURS), who's as full of surprises as our undercover assassins. Farrell gives one of his very best performances, blending laugh-out-loud comedy and guilt-ridden heartache beautifully. My favorite running gag was Ray's childlike fascination with dwarfs, and his oafish but well-meant concern for cokehead dwarf actor Jimmy (Jordan Prentice), who's in the fairytale-like city to appear in a dream sequence in a local indie art-house flick. As Harry, the boys' crime boss, Ralph Fiennes does a terrific job channeling Sir Ben Kingsley as the terrifying Don in SEXY BEAST (I assure you, that's a compliment!). IB mixes suspense, melancholia, and hilarity very well indeed. Along with THE BANK JOB, IB was my favorite crime film of 2008. The DVD's featurettes and deleted scenes are fun, too, including interviews, a captioned boat tour of Bruges, and a deleted scene involving Matt Smith in his pre-DOCTOR WHO days -- and a machete! The many deleted scenes are all quite entertaining; I'm sure they were only cut so IB wouldn't be a 3-hour epic! :-)",10,21,29,20 April 2011
12 Monkeys," Mind-Bending and Heart-Breaking
","Terry Gilliam's stunning feature-length adaptation of Chris Marker's short film LA JETEE is full of mind-bending surprises, yet still touches your heart thanks to the superb cast.  Gilliam's flair for the phantasmagorical works with the script by David and Janet Peoples to play with your head as much as it does with poor James Cole (Willis at his most Steve McQueen-like -- better than McQueen, even!), a time-traveling convict from the future who literally doesn't know whether he's coming or going as a team of scientists keeps sending him back to the wrong eras while trying to prevent a 1995 plague that's deadly to humans but harmless to animals.  Willis, the justifiably Oscar-nominated Brad Pitt, and Madeline Stowe as a well-meaning psychiatrist give some of the best performances of their careers.  Even Paul Buckmaster's tango-style score is haunting.  This one's a don't-miss!",9,141,168,31 March 2002
Cloverfield," Freshest, Scariest Horror Film in Years, Critics Be Damned!
","Oh. MY. GOD!!! CLOVERFIELD has everything: terror, laughs, pathos, sympathetic characters, a kick-ass Giger-like giant monster covered with what turns out to be even more destructive parasites, and location filming in NYC (and L.A., I'm told) with jaw-dropping F/X and one of the most chillingly apocalyptic endings since Hitchcock's THE BIRDS. What's not to love, at least for us creature feature fans? CLOVERFIELD plays like GODZILLA MEETS THE BLAIR WITCH PROJECT sprinkled with a pinch of MIRACLE MILE, except that I found CLOVERFIELD's twentysomething protagonists far more sympathetic than THE BLAIR WITCH PROJECT's self-centered overgrown brats. (The whole cast is likable, but Lizzy Caplan stands out as Marlena, who had the bad luck to be at the wrong party at the wrong time, waiting for friends to meet up with her.) The film cleverly presents its harrowing story as found footage taken from a camcorder discovered by the military in 'the area formerly known as Central Park.' The camcorder in question is wielded mostly by affable dimbulb Hud (T.J. Miller) at a farewell party thrown for his pal Rob (Michael Stahl-David) before he leaves to take a job in Japan (oh, the irony! :-)). The first 20 minutes or so play like one of those indie comedies about young adults getting their bearings. It's all fun and games until the Statue of Liberty's head crashes into midtown Manhattan. :-) Soon, Hud finds himself documenting Manhattan's destruction ('People are gonna want to know how it went down!') as he, Rob and others make their way across what's left of the collapsing, chaotic city to try to rescue Beth (Odette Yustman), the girl Rob loves, after hearing her tearful cell phone message that she's trapped under debris in her family's posh Columbus Circle apartment building. I know, being trapped in a posh apartment doesn't sound so bad, but trust me, Beth's upscale address doesn't seem so inviting by the time our beleaguered heroes reach her.The found-footage gimmick is used especially well. Seeing the events through the eyes of Hud and his roving camcorder strips everything down to its barest, scariest essentials in the movie's fleet-footed 84-minute running time. No scientists step in to explain the origins of the vicious beasts; the closest we get to an explanation are a few terse words from military personnel and glimpses of TVs in stores (often while said stores are being looted) showing news updates, talking about tankers being capsized and such. Since Hud has accidentally been recording over a tape of Rob and Beth spending a day on Coney Island, the little bits we occasionally see of the couple in happier days sneak in some backstory, as well as providing CLOVERFIELD with one of the most ironic-in-context last lines since the late Ulrich Mühe's 'It's for me' at the end of THE LIVES OF OTHERS.I must say I don't understand all these movie critics who've blasted CLOVERFIELD for its film-making style (though Richard Roeper and the Chicago Tribune critic filling in for Roger Ebert loved it, and rightly so) and for its alleged insensitivity and exploitation due to the plot's parallels to the horrific events of September 11th, 2001. My family and I, born and raised in New York, still lived and worked in NYC on 9/11. While we were lucky enough not to have lost any friends or loved ones in the terrorist attacks, I can tell you the makers of CLOVERFIELD did a splendid job of capturing the feel of a disaster-stricken city and its terrified but determined citizens. People need to get a little perspective, if you ask me. For heaven's sake, Japanese filmmakers have spent decades responding to the destruction their country endured during World War II by making Godzilla movies and related creature features. With nearly 7 years having passed since 9/11, why shouldn't American filmmakers like CLOVERFIELD producer J.J. Abrams, writer Drew Goddard, and director Matt Reeves make a horror movie in which New York City is decimated by a giant monster who makes Godzilla look like a sweetheart, with nightmarish, surreal destruction and loss of life that outdoes even the horror of the World Trade Center attacks? I mean, at least in real life, the entire borough of Manhattan and its people weren't destroyed. In the meantime, those of you reading this who haven't seen CLOVERFIELD yet should drop everything and go see it now, now, NOW!!! ...Migraine and Motion-Sickness Sufferer Alert... It's been said that for some sensitive moviegoers, the deliberately shaky camera-work in certain scenes caused queasiness. To be fair, I can understand why. For me personally, the combination of the Shaky-Cam and the strobe-like effect of the malfunctioning lights in Beth's ruined hallway during the Columbus Circle rescue scene kept threatening to trigger my migraines. However, I don't consider that to be a flaw in the movie so much as a flaw in my brain. :-) Nevertheless, the Shaky-Cam cinematography is appropriate for the film's premise, so hey, caveat emptor! ...End Migraine and Motion-Sickness Sufferer Alert...",10,18,36,20 January 2008
Fargo," Frances & The Coens at Their Oscar-Winning Finest!
","Even people I know who can't stand the Coen Brothers' style *love* this slyly low-key comedy-thriller. Unlike so many 'offbeat' movies, the quirkiness of FARGO's Oscar-winning screenplay never cancels out its warmth or suspense as the Coens deftly balance clever plotting (*not* really based on a true story, as a poor disturbed Japanese woman found out when she came to the U.S. to dig up the hidden ransom money only to freeze to death trying), engaging characters, scares, poignancy, and the brothers' trademark loopy humor. Darkly hilarious as the kidnappers' bungling is, it renders the violence all the more chilling; one minute you're laughing, the next minute you're cringing over the shock of sympathetic characters meeting swift, bloody deaths. I found myself feeling terribly sorry for poor, sweet, unsuspecting Jean Lundegaard (Kristin Rudrud), her vulnerable adolescent son Scotty (Tony Denman), her wealthy father Wade (a delightfully bombastic Harve Presnell), and the other poor slobs unwittingly caught up in car salesman Jerry Lundegaard's plot to get money out of Wade by hiring two thugs to kidnap wife Jean and hold her for ransom, not factoring in the kidnappers' lack of both patience and anger management skills. Nobody plays losers like William H. Macy, and he sure deserved his Best Supporting Actor nomination for playing Jerry, who ought to have his picture in the dictionary next to the word 'inept.' Steve Buscemi and Peter Stormare are letter-perfect as the loose-cannon wife-snatchers; if Buscemi isn't our generation's Peter Lorre, I don't know who is. But the heart and soul of FARGO is Frances McDormand, who truly earned her Best Actress Oscar here. Looking a bit like a young brunette Carol Burnett, McDormand is beyond superb as Marge Gunderson, the pregnant sheriff (my husband always liked the fact that FARGO doesn't include the nigh-obligatory scene of The Pregnant Heroine Suddenly Going Into Labor At The Worst Possible Time) who runs circles around the bad guys *and* her own well-meaning police force. Courteous and smart, down-to-earth yet slick, her luminous blue-green eyes never missing a thing, McDormand's Marge comes off as a warm Minnesota (is that an oxymoron? :-) female hybrid of Joe Friday and Lt. Columbo (I mean Columbo's stealth smarts, not his sloppiness :-). If you love FARGO, you owe it to yourself to own the deluxe DVD, chock full of way-cool extras too nifty and numerous to go into here -- oh, yah! :-)",10,17,23,11 July 2005
Burn After Reading," Kooky Coens At It Again with Dark Screwball Paranoia Comedy
","Winning Oscars hasn't kept Joel and Ethan Coen from their tradition of switching back and forth between comedies and dramas. The brothers have followed up the brilliant Western noir NO COUNTRY FOR OLD MEN with the funnier, less bloody but no less wickedly anarchic BURN AFTER READING (BAR), reuniting actors who've worked together in and out of previous Coen Brothers movies. Set in Washington, DC and environs (portrayed brilliantly by New York and New Jersey :-)), BAR is a screwball paranoia comedy about people who work in intelligence, pitted against people who lack intelligence. :-) When Osborne Cox (John Malkovich, proving he fits right in with the Coens' loopy repertory company) loses his CIA job, he decides to write his memoirs. A disk found at the Hardbodies Gym with what ditsy trainer Chad Feldheimer (Brad Pitt) suspects is 'sensitive s**t' belonging to Cox builds a chain of nutzoid misunderstandings, violence, and other paranoia-fueled shenanigans. Those drawn into the insanity include Chad's co-worker Linda Litzke (the ever-wonderful Frances McDormand, her blue-green eyes communicating as much as her dithery yet determined voice. She's also wearing Javier Bardem's Anton Chigurh hairdo, but it looks better on McDormand :-)), hoping to finance her extreme plastic surgery makeover by getting money from Cox; reward or blackmail, it's all the same to Linda and Chad. (Without giving away too much, love-starved Linda ends up an unwitting femme fatale, in every sense of the term.) Then there's womanizing Treasury agent Harry Pfarrar (George Clooney, doing a frantic comic version of his Oscar-winning SYRIANA role right down to the beard), a man who needs to run after sex (literally and figuratively) to stay in a good mood and is never without an oddball choice of words: 'I have lactose refluxDoes that contain shell food?'; Tilda Swinton as Katie, Cox's tightly-wound pediatrician wife; Richard Jenkins as Ted Treffon, Hardbodies' manager, who's secretly in love with the clueless, self-absorbed Linda; and J.K. Simmons and David Rasche as CIA men who have to sort out the increasingly crazy mess. The whole cast is terrific, but if anybody steals the show, it's Brad Pitt with his two-tone hair and smilingly bumbling attempts at extortion. Like our household faves Max von Sydow and Anjelica Huston, Pitt knows when to have fun with a role, and his delight in playing Chad is infectious. Even BAR's little details are a hoot, like Cox hiding out on his houseboat and keeping in shape by exercising to FitTV's GILAD'S BODIES IN MOTION (I've used the show to further my own fitness efforts :-)); Harry singing 'My Eyes Adored You' and 'Born Free' in the shower (alas, we only see this from the viewpoint of Chad, who's hiding in the closet :-)); and Linda using the (fictional) romantic comedy COMING UP DAISY, starring Dermot Mulroney and Claire Danes, as a litmus test for the dates she meets online. (There's even footage of Mulroney urging the unseen Daisy to get down from a tree. Maybe Mulroney did it as a favor to his buddy Pitt.) Between his affairs and 5-mile runs, Harry finds time to be a hobbyist; without spoiling anything, I can only say the contraption he builds gets my vote for Best Performance by an Inanimate Object. I'll admit BAR may not be for all tastes, but to quote James Thurber, if you like this sort of thing (and obviously I do), it's the sort of thing you'll like!",9,9,20,25 September 2008
