movie_title,title,review,rating,helpful,total,date
Eternal Sunshine of the Spotless Mind," A Love Story As Only Charlie Kaufman in a Phildickian Mood Could Tell It
","Yes, I realize that any review that isn't an unabashed love letter to this film is likely to get a 'No' vote! :-) I hope you'll note that although I didn't love this film, I didn't hate it, either. Charlie Kaufman's script deserved its Oscar, the acting is top-notch, the emotions rang true, and the DVD's got loads of goodies -- it was the direction that I felt dragged the film down.If Philip K. Dick had written a romantic comedy, the result might have turned out like ETERNAL SUNSHINE OF THE SPOTLESS MIND. In this seriocomic SF love story, Jim Carrey proves again that he's not just another mugging face, and Charlie Kaufman proves that he's the master of surreal dramedy. Director Michel Gondry, however, proves that Spike Jonze is really the most suitable director for Kaufman's particular brand of daffiness.Jim Carrey and Kate Winslet are stunningly believable as dysfunctional couple Joel Barish and Clementine Kruczynski. Clem initially seems like a sexy free spirit with a roguish streak, but as their romance continues, Joel sees the dark side of Clem's impulsive nature: on her bad days, hard-drinking Clem is needy and temperamental. What's worse, she sees Joel's relentlessly low-key, emotionally walled-off nature as a rebuke to her recklessness. Mutual misery ensues.No wonder Clem finally consults Lacuna, a Manhattan company run by avuncular Dr. Howard Mierzwiak (Tom Wilkinson) that erases your memories of a bad relationship. Lacuna even sends postcards to clients' intimates telling them not to mention the erased ex again, as Joel discovers when he sees one in their mutual friend's mail. Heartbroken, he also opts for the Lacuna treatment. While the erasing process takes him through memories of life with Clem, we discover that, when Joel wasn't being passive and Clem wasn't drunkenly cracking up Joel's car at 3 AM, the couple also enjoyed many good times together. Joel's reluctant to forget these happy moments, and that's where the film gets phantasmagorical as reality, fantasy, and memory collide. Within the maze of Joel's mind, he and Clem (who's been panicking and feeling like she's 'disappearing' as she's slowly wiped from Joel's brain, despite having already forgotten him) team up and try to hide in all kinds of memories she has no part of. The funniest of these is the scene in Joel's childhood home, as a shrunken-to-child-size Joel faces Clem as his mom's miniskirt-clad, go-go-booted neighbor.The details of Lacuna's workings are ...SUNSHINE's most consistently witty, entertaining bits. Lacuna looks like a typical busy doctor's office, with receptionist Mary (Kirsten Dunst at her most winsome and dimply) constantly scheduling appointments: 'Valentine's Day is our busiest time.' Funny yet poignant details abound, such as the teary-eyed client loaded down with her dog's belongings, a crucial part of wiping away memories of a loved one. The actual procedure is performed by young computer techies Stan (Mark Ruffalo) and Patrick (Elijah Wood, leaving Frodo Baggins far behind) who erase the subjects' memories in their homes while they sleep. The techs act like a bunch of fun-loving but irresponsible babysitters, swilling the unsuspecting Joel's whiskey, smoking pot and having sex (with Mary, not each other :-) as he sleeps. But Patrick goes beyond mischievousness into unethicality: usually a strikeout with women, he's begun dating Clementine, having fallen in love with her while erasing her Joel memories. Patrick tries to take the expressway to her heart by wooing her with her discarded Joel mementos. Of course, he doesn't consider that since Joel's relationship with Clem went sour despite all those nice gifties, history just might repeat itself. I was disappointed that there wasn't a bigger payoff to the Patrick subplot; he just kind of disappears from the film as if *he* were erased. Of course, that may well be the point! :-) Director Gondry, who also directed Kaufman's HUMAN NATURE (2001), spends so much time cross-cutting, juggling the movie's timeline, and inexplicably staging certain scenes in darkness with only a flashlight rendering the characters' faces visible that instead of enhancing the storytelling, it's merely distracting. I kept getting the feeling Gondry didn't trust the story itself to keep moviegoers' attention -- ironic, since he shares story credit with Kaufman and artist Pierre Bismuth. Having said that, when the visuals work, they work wonderfully, like when our hero and heroine dash through Grand Central Station while commuters wink out of existence left and right.Refreshingly, the New York locations aren't the usual hip or glamorous places. Joel and Clementine live in Rockville Centre, Long Island, and their apartments look just like homes of college students or artistic types trying to inject Soho style into suburbia. The filmmakers also make splendid use of the stark beauty of Montauk beaches in winter.For Carrey fans seeking slapstick and belly laughs, ...SUNSHINE... may seem to drag on eternally; its humor is more in the rueful TRUMAN SHOW vein, shot through with Kaufman's trademark surrealism. If you want a love story that will make you laugh knowingly and think about the way people approach relationships, ...SUNSHINE... is worth seeing. Hopefully it will convince you that counseling is a better approach to your relationship problems than science-fiction gadgetry!",7,8,15,19 March 2004
Stranger Than Fiction," Helm and Forster: The New Kaufman and Jonze?
","I saw STRANGER THAN FICTION (STF) on its opening weekend, and I think it's one of the most engaging, funny, poignant movies about writing, the creative process, and human nature I've seen since ADAPTATION. While Will Ferrell is a fave in our household, I must admit this is the first time I've seen him in a movie and thought of him as the character he's playing, not as Will Ferrell. Toning down his screechy/crazy qualities without losing his ability to make audiences laugh, Ferrell stars as unassuming IRS agent Harold Crick, who loves his job, so you know his life needs an overhaul! :-) Even Harold's curly-topped sidewall haircut seems to hint that his well-ordered life is about to dissolve into craziness. One morning, it does, amid FIGHT CLUB-style captions and the plummy, ironic tones of a British female narrator accompanying Harold's thoughts and actions in the opening scene -- narration that Harold can hear along with those of us in the audience. Our increasingly puzzled, alarmed hero soon realizes he's the protagonist in a novelist's new book-in-progress -- not just any novelist, but the reclusive Karen 'Kay' Eiffel (Emma Thompson), who's been suffering from writer's block for 10 years and whose novels always end with her protagonists dying! As Kay's publisher sends compassionate but no-nonsense troubleshooter Penny Escher (Queen Latifah) to help unblock her, Harold seeks help from literary professor Jules Hilbert (Dustin Hoffman), an expert on the problematic author's favorite phrase 'Little did he know...' It might be a subject especially dear to a writer's heart (especially in gags like Hilbert questioning Harold on standard literary devices to see if he's the hero of a comedy or a tragedy: 'Have you been invited to a country house and had to solve a murder?...To find out what story you're in, I have to find out what stories you're *not* in...'), but I found STF funny, touching, and playfully surreal as director Marc Forster and screenwriter Zach Helm prove to be the new Spike Jonze and Charlie Kaufman, only with a touch of sweetness. In addition to the excellent Ferrell, Hoffman, Thompson, and Queen Latifah, the great cast includes Linda Hunt and an all-but-unrecognizable Tom Hulce as well-meaning but unhelpful psychiatrists, and Maggie Gyllenhaal as Ana, an anti-establishment baker who refuses to pay taxes on munitions (The Clash's 'Death or Glory' plays in the background when Harold visits her bakery to audit her, only to be booed and heckled by Ana and her customers. Later, Harold wins Ana over by bringing her flours -- that's right, flours, not flowers! :-). There's nice location shooting in Chicago, too. STF is well worth heading out to a theater to see, and when it inevitably comes out on home video, it'll definitely be in the Writers' Movies section of my DVD collection alongside ADAPTATION, THE SINGING DETECTIVE, and the underrated ALEX AND EMMA!",9,80,113,25 November 2006
Casino Royale," Daniel Craig: Blond, Brutish, Short, and the Best Bond in Years!
","I saw the new, gritty, pulse-pounding CASINO ROYALE (CR) on opening weekend, and *IT ROCKS!!!* I sat grinning smugly from ear to ear, my faith in Daniel Craig as the new James Bond proving well-founded as the pumped audience cheered and carried on! After seeing him in LAYER CAKE and MUNICH, I knew Craig would make an awesome 007, despite all those tiny minds out there ready to reject him as being too blond, brutish, and short. :-) CR totally reboots the Bond series. Right from its spectacular, stylish black-and-white opening sequence in which Bond earns his 'license to kill' status and then some, this movie kick-starts James Bond as an ass-kicker with shades of vulnerability and reserves of ruthlessness that do both Ian Fleming and Sean Connery proud! Even my mom, who swore she'd never love another Bond after her fave Pierce Brosnan, gushed about Craig after seeing CR, and there's much to gush about. For one thing, Craig's got the rugged good looks of a Cro-Magnon Steve McQueen, with bristly blond hair and laser-sharp blue eyes that could drill right through you, plus a buff physique that's shown off delightfully when he emerges from the surf in the Bahamas. It's the male version of Ursula Andress' introductory scene in DR. NO -- yes-s-s! :-) Heck, Craig's naked body is so amazing to behold, even villain Le Chiffre (Mads Mikkelsen, who'd be an intimidating presence even without Le Chiffre's unnerving tears of blood, the result of an old eye injury) makes approving remarks about Bond's build as he tortures him in a scene that's faithful to Fleming's original novel while improving on it at the same time. However, I didn't appreciate the decision to change the film's high-stakes baccarat game to Texas Hold 'Em poker. Maybe they thought more moviegoers would identify with a poker game, but it seems to me that the sophistication of baccarat is more appropriate for a Bond movie. Despite that quibble, in addition to balancing intensity and dry wit that deftly kids the time-honored Bond movie traditions/clichés (as opposed to the overdone, forced jokiness that's plagued the series off and on since the Roger Moore years), Craig has a humanity that I feared had been formula'd out of 007. Take Bond's ever-evolving relationship with British Treasury Agent Vesper Lynd, as played by THE DREAMERS' Eva Green. While Green doesn't quite possess the screen presence or charisma of such classic Bond leading ladies as Andress, Honor Blackman, or Jane Seymour, she and Craig still strike enough sparks to be a good match physically and emotionally, each of them hardened loners who slowly grow to love each other (the result of Oscar-winner Paul Haggis contributing to the script, perhaps?), plus I like the wry twinkle in Green's aquamarine eyes. Most of the cast is terrific, including Dame Judi Dench returning as no-nonsense spymaster M (the flinty relationship between Dench's M and Craig's Bond feels more like a battle of wills here -- wholly appropriate, since this is essentially Bond's first case as a Double-0 agent), and Giancarlo Giannini as the shifty Mathis. Jeffrey Wright, another fave in our household, has a nice moment or two as Felix Leiter, Bond's CIA contact, but overall he gets surprisingly little to do. Oh, well, maybe Wright had scenes left on the cutting room floor, or maybe he'll have more to do in subsequent Bond films. The action scenes owe more to films like RESERVOIR DOGS than previous Bond films (which should make original CASINO ROYALE fan Quentin Tarantino happy :-), and I'm not just saying that because two of these scenes take place in bathrooms! :-) There's a down-and-dirty, kinetic fleetness to CR's action scenes (with some cool and unexpected locations, including the macabre Body Worlds exhibit and the Miami Airport. Between CR and the 2002 comedy BIG TROUBLE, the Miami Airport is certainly an embattled place, at least on film! :-), especially a wild foot chase between Craig and Sebastien Foucan that takes them through a construction site and into Foucan's embassy -- and with this new, no-holds-barred Bond, if this creep thought he'd be safe in his embassy, he was kidding himself! Forget Shaft -- the new Daniel Craig version of James Bond is a bad mutherf***er! :-) Long may he reign!",9,4,7,25 November 2006
The Producers," This Quotable Classic is Still One of Mel Brooks' Very Best
","I know more people who quote lines from THE PRODUCERS than from Shakespeare; make of that what you will! :-) That said, people seem to either love it or hate it, but most folks I know agree this nutzoid farce has, to quote groovy LSD (delightful Dick Shawn), 'Love Power!' Writer/director Mel Brooks' insanely zany yet strangely sweet tale of down-on-his-luck Broadway producer Max Bialystock (the great Zero Mostel, who should have been nominated for an Oscar himself) who uses his powers of persuasion (and wheedling, and bellowing, and conning :-) to convince meek accountant Leo Bloom (justifiably Oscar-nominated Gene Wilder) to help him make a surefire Broadway flop that, if their nutty book-cooking scheme works, will land them in Rio -- or, if it doesn't work, Sing Sing. This screamingly funny, no-holds-barred comedy won Mel Brooks an Oscar for Best Screenplay and put the former YOUR SHOW OF SHOWS writer on the map as a filmmaker. Anyone trying to make a comedy depending on controversy and questionable taste for its laughs should watch THE PRODUCERS first and see how a master does it! For that matter, Mel Brooks and Gene Wilder ought to watch it again themselves; after the duds they were churning out for a while there, maybe they need a refresher course in how to be funny. (Hell, it might be as simple as them teaming up again; Wilder seemed able to temper Brooks's mania for poo-poo humor and Brooks seemed able to help Wilder to better balance out his trademark blend of shrill hysteria and sweetness.) Much as my family and I also loved the Broadway and film editions of the musical version co-written by Brooks and Thomas Meehan and starring the incomparable Nathan Lane and Matthew Broderick (even though I felt that Broderick wasn't quite as good as Leo Bloom as Lane was as Max Bialystock. That said, together they have great buddy chemistry), the original is still the champ.",10,21,27,18 April 2007
Rear Window," Reading from Top to Bottom...Hitchcock's Sophisticated Masterpiece
","Not only does REAR WINDOW (RW) have Alfred Hitchcock's trademark wit, suspense, and romance (with a touch of friction) in spades, but it's one of his most well-crafted, cleverly-staged movies; in fact, even though RW is based on a Cornell Woolrich story, I can't imagine this story being told as effectively in any medium other than cinema. However, the technical accomplishments (explained most entertainingly in the DVD's documentaries) would be nothing without the engaging characters. James Stewart's neighbors are interesting enough to warrant their own movies, and in addition to providing a wry microcosm of New York City life (the only dated thing about it is the lack of air conditioning), they all reflect possible outcomes for the somewhat stormy romance between laid-up shutterbug Stewart and the luminous Grace Kelly as his upscale fashion maven inamorata. As Brent Spiner said while hosting a showing of RW on TNT, the real perversion of the film is Stewart's reluctance to commit to the irresistible Kelly! In fact, one of the things I like about the movie is the way it shows these two very different people gradually learning to compromise and work together. The piquant final shot shows that a woman can have a happy relationship with a man without submerging her own personality -- refreshing for the 1950s! Great supporting cast, too, including Wendell Corey, Raymond Burr in one of his last bad-guy roles before PERRY MASON, and the scene-stealing Thelma Ritter. Incidentally, the restored special edition RW DVD was put together just in time to include Georgine Darcy ('Miss Torso'), then one of the last surviving cast members. Darcy died earlier this year; she will be missed.",10,141,203,24 November 2004
The Thin Red Line," World War II Soldiers as Walk-Ons in the Theater of War
","THE THIN RED LINE (TTRL), writer/director Terrence Malick's Oscar-nominated World War II drama based on James Jones' book, is notable not only for its introspective approach to its subject, but also as the film that was initially supposed to make Adrien Brody a star in his pre-PIANIST days. Brody trained at boot camp for his portrayal of Cpl. Fife (the character based on James Jones himself) and was hyped to the skies as Hollywood's Next Big Thing. No sooner was Brody included on the cover of VANITY FAIR Magazine's 1998 Hollywood issue than he discovered that many of his scenes, chiefly those involving dialogue, wound up on the cutting room floor. I got the feeling that Brody wasn't the only TTRL cast member victimized by the editing process, though. While Sean Penn, Ben Chaplin, and Jim Caviezel have substantial screen time as the audience gets to see and hear their thoughts, the rest of the all-star/star-to-be cast come across as extras in their own movie, with everybody from John Cusack to John Travolta to Nick Nolte to George Clooney (among many others) getting one or two memorable scenes at most and then moving right along. Perhaps that's Malick's point; maybe he's saying that combat dehumanizes men until they're just walk-ons and bit players in the theater of war. This might also explain why most of TTRL's characters have one-syllable names that soon start to sound alike: Welsh, Whyte, Witt, Fife, Gaff, Tall, Tills, Bell, Doll... Indeed, as the soldiers of Charlie Company become increasingly filthy and exhausted during their traumatic tour of duty in Guadalcanal (some of it filmed on location), it gets increasingly difficult to tell one from the other. As my husband Vin and I played 'Spot the Adrien,' Vin kept thinking he saw him because, as he said, 'It's like everyone in this movie has thick eyebrows and big noses!' Once you actually spot Brody in TTRL, however, it's hard to forget him, and I'm not just saying that because I'm a fan of the man. While Brody doesn't say a word until the final reel (Vin and I were amazed: 'Finally! Brody speaks!' :-), his expressive face and eyes and his considerable screen presence make up for his lost dialogue as he hovers anxiously in the background; Brody haunts the film like The Ghost of War Past, Present, & Future. You'd think they'd release a special-edition DVD with Brody's cut scenes, now that he's an Oscar-winning star! :-) Even if you're not on the lookout for your favorite actors, TTRL dazzles the eye and touches the soul with imagery that is at once grim and poetically beautiful, as well as poignant Melanesian native music that acts as a moving counterpoint to the soldiers' ordeals. If you're looking for rock-'em-sock-'em action and people getting blown up real good, you may find yourself getting impatient at TTRL's leisurely pace and 170-minute running time, but if you like your war movies intelligent and thought-provoking, TTRL is worth renting.",8,4,9,9 October 2004
