movie_title,title,review,rating,helpful,total,date
The Village," WARNING! SPOILERS AHEAD! Who Are THE VILLAGE's True Monsters?
","THE VILLAGE is flawed, but better than it gets credit for. People were probably disappointed because the film was sold as a thriller when it's a mood piece about how fear and paranoia impact a community, a timely theme in our post 9/11 world. Instead of misrepresenting THE VILLAGE as a twisty shocker a la THE SIXTH SENSE, the marketing department should've tried another approach: 'M. Night Shyamalan as you've never seen him before!' :-)Unlike MNS's previous films, it's easier to see through this story about the citizens of Covington Woods, an 1890s-style farm community, who won't venture beyond their village's borders because of their uneasy 'truce' with the 'creatures' outside, including jettisoning anything colored red, the 'bad color' that purportedly attracts these creatures. The narrative transparency causes the dreamlike effect of MNS's usual leisurely pace to peter out too soon. Fortunately, the stellar cast, beautiful Pennsylvania scenery, and eerie atmosphere held my attention. Former co-stars William Hurt and Sigourney Weaver reunite as village elders Edward Walker and Alice Hunt; for once Hurt's slightly dazed soft-spokenness suits his character! :-) Joaquin Phoenix, re-teaming with his SIGNS director, radiates quiet strength and intensity as Lucius Hunt, who tries to cross the village borders into 'the towns' for medicine to combat the community's recent rash of illnesses and deaths. Phoenix is well-matched by Bryce Dallas Howard, lovely and endearing in her film debut as Walker's blind daughter Ivy. I liked Ivy's subtle boldness as she saves the day after the guys who accompany her to the village borders chicken out. No surprise that Adrien Brody signed on for the role of mentally-challenged Noah Percy (or as his character has been dubbed by smart-alecks, 'the VILLAGE idiot') as his first post-Oscar role. It gave him an opportunity to work with a hot director (turning MNS down at this point in his career would've been like turning down Alfred Hitchcock in the 1940s and '50s), and most actors can't resist playing handicapped characters. Brody did a fine job with a role more complex than it first seems. In Brody's able hands, overgrown child Noah simultaneously breaks your heart, makes you laugh, and creeps you out. His behavior reminded me of autistic/ADHD children I've known, so I was particularly moved when Lucius wonders if 'the towns' might have medicines to help Noah 'sit still and learn.' (Seeing Brody in 1890s-style clothing got me thinking how great he'd be as Ichabod Crane if somebody films ...SLEEPY HOLLOW again!) The finest moment in Brody's performance comes after Lucius and Ivy's engagement is announced. Up until this point, Lucius, Ivy, and Noah have been a trio, with Noah responding affectionately to Ivy's kindness. That changes forever after the engagement, when Noah turns up on Lucius' doorstep with grief in his heart, tears in his eyes -- and a knife in his hand. After the attack, Noah's parents find him rocking agitatedly on the porch, frightened of 'the bad color' on his bloodstained hands. When Ivy finds out, she confronts Noah, who holds his arms out to her, clearly sorry and hoping for forgiveness, only to have Ivy start shrieking and hitting him until she's dragged off him. Although what Noah did was horribly, unforgivably wrong, his howls of anguish and wrenching sobs almost brought me to tears. (I'd love to see Brody's and Howard's performances get award nominations!) When Lucius' wounds become infected, Ivy must trek to 'the towns' to get medicine. Here's where the twist (and the *SPOILER*) comes in: Walker gives his daughter what turns out to be a prescription, and the foreshadowing (particularly various Villagers' revelations of losing loved ones violently in 'the towns' in their pre-Village lives) pays off. Our villagers *don't* live in the 1890s. The time is now...the village is a sanctuary from today's world, created by the town elders to raise their children away from the tragedy and heartbreak of their former modern city lives...the creatures were fabricated to keep the young people in line and in the dark, with various townspeople -- including Noah in mischievous-child mode -- donning creature costumes and skinning small animals periodically to scare everybody. And Walker masterminded it all! A history teacher from a powerful family, Walker used his inherited wealth to establish this quasi-Brigadoon in an isolated area of the Walker family's game preserve, with the adults conspiring to keep the village going with various deceptions. I liked the idea that Walker's rich enough to pull this off, with the preserve personnel on board with the ruse (when the young ranger Ivy meets outside the game preserve realizes she's a Walker, he quickly agrees to help her); I'm all for the idea of living in one's own little homemade world! :-) But why the hell would supposedly intelligent modern people like Walker & Company set their new community in an ersatz 1890s (even the gravestones list 1890s dates!), a time without *antibiotics?!* The film begins at the funeral of a little boy who, it's made clear, is one of several children who died of illnesses that could've been cured with the right medicine. I can't believe Walker and the town doctor didn't take precautions to have modern meds available just in case, to say nothing of medicine/treatments that might have helped poor mentally-stunted Noah and maybe even Ivy's blindness! It's unconscionable that, however well-meant Walker's power trip is, he and the others would let their children die or be damaged for life rather than go into 'the towns' for help, even if it means their elaborate ruse might collapse around them! (Amish people come to cities for supplies or trade in real life, so why couldn't Walker and the villagers do the same?) THE VILLAGE would've been more compelling had the script delved deeper into that aspect of it, with the secrets, lies, and power the elders have, but at such a terrible cost. Then MNS might have had a future classic on his hands, not just the cinematic equivalent of a nice try.",7,8,11,8 October 2004
North by Northwest," From The Master of Suspense Came the Daddy of the Modern Adventure Thrillers
","Many feel this is Alfred Hitchcock's greatest American movie, and I agree! NORTH BY NORTHWEST is the Hitchcock film to end all Hitch films, with all his pet themes covered with maximum wit, panache, and suspense, as well as a romance between Cary Grant and a soignée Eva Marie Saint that's as tender as it is sexy. Grant has never been more engaging and dashing (literally and figuratively :-), though the smoothly villainous James Mason nearly out-suaves him. My husband and I have joked that if Mason had played Thornhill, the film would have been over in mere moments. With all due respect to Grant, if the imperious, unshakably confident Mason asked the Glen Cove police, 'Do you honestly believe that this happened the way you think it did?' they would immediately reply, 'No, sir, you must be right, you're free to go, sorry we bothered you.' :-) Also boasts a great early performance by a reptilian young Martin Landau as Mason's possessive henchman, as well as one of Oscar nominee Ernest Lehman's best screenplays (in fact, he borrowed liberally from it for his script for the film version of THE PRIZE starring Paul Newman) and one of Bernard Herrmann's finest scores. Anybody who wants to write or direct a chase thriller should watch NORTH BY NORTHWEST first to see how it's done!",10,50,73,7 February 2004
Quantum of Solace," Riveting Craig, Great Action Make Up for Uneven Plotting & Characterization
","In his second James Bond film, QUANTUM OF SOLACE (QoS), the riveting Daniel Craig again proves he's the most ruthless 007 since Sean Connery, blasting the Bond formula with a breath of fresh air -- that is, when he and the cast can catch their breath between great rock'em-sock'em action scenes that wouldn't be out of place in the BOURNE movies (no surprise, since some of the BOURNE personnel were on board)! Although director Marc Forster effectively films all of QoS's running, jumping, and doing, I would have liked the movie even more if the plotting and characterization had gotten as much screen time as the frenzied action sequences, like the excellent CASINO ROYALE. (I know I'm dating myself here, but it's still hard for me to invoke the title 'CASINO ROYALE' without thinking of the 1967 comedy version. :-) But I digress...) I do hope the next Bond film has a better balance of action, plot, characterization and emotion, otherwise we might as well be watching a video game. I liked the stern yet warm-beneath-the-surface, almost mother-son relationship that Craig's Bond and Dame Judi Dench's M are developing (Bond wryly acknowledges this in a throwaway line). I also liked Olga Kurylenko as Bond's revenge-minded main love interest, Camille; she's one of the few good-guy Bond girls who can take care of herself instead of 'Oh, James!'-ing all over the place. I wish they'd made better use of the winsome Gemma Arterton, though; she deserved to do more than just invoke GOLDFINGER. Heck, with all the running around the characters did on screen, I didn't even realize Ms. Fields' first name was Strawberry until I saw it in the closing credits! I wish they'd done more with Arterton's character, but at least she got endearingly naked with Bond. Giancarlo Giannini and Jeffrey Wright return and are most welcome, although Wright still doesn't get as much to do in the role of Felix Leiter as he should. Ah, well, now that Bond has avenged his beloved Vesper's death and gotten the dying-of-thirst Dominic Greene (reminiscent of his MUNICH character) to drink oil, maybe the next Bond film can concentrate on new plots and scenarios with a better balance of all the elements that make 007 fun to watch, and they'll let Daniel Craig crack a smile -- or at least a cool, knowing smirk -- more often. :-)",7,11,19,27 January 2009
No Country for Old Men," A Career Best for the Coens, and the Scariest Oscar Nominee Since SILENCE OF THE LAMBS
","The Coen Brothers turn back to crime in their stark, stunning, justifiably Oscar-nominated adaptation of Cormac McCarthy's novel NO COUNTRY FOR OLD MEN (NCfOM). There's a Sam Peckinpah feel to this gripping 1980-set thriller. It's a morality play and a tense suspense story rolled into one  the leaner, meaner, more vicious brother of the Coens' previous great thrillers BLOOD SIMPLE and FARGO.NCfOM's protagonist is Vietnam vet Llewellyn Moss (Josh Brolin in a brooding, laconic, star-making performance), who goes hunting near the Rio Grande and finds himself embroiled in nightmarish mayhem and violence, Texas prairie style. Instead of bagging wild game, Llewellyn bags $2 million in drug money after stumbling across the aftermath of a drug deal gone wrong, complete with corpses, even a dead dog. (It's chilling to see the bodies in the process of decaying as others happen upon the scene over the course of the movie.) Llewellyn thinks he can just take off with the money, dodge whoever might come after it, and live happily ever after with his sweet wife Carla Jean (played with a letter-perfect Texas accent by winsome Scottish actress Kelly Macdonald. Brolin and Macdonald make a wryly endearing couple. The rare times Llewellyn smiles, it's usually when he's talking with Carla Jean). To his peril, Llewellyn doesn't figure on being pursued by the likes of murderous bounty hunter Anton Chigurh (Javier Bardem), a mysterious figure with a pneumatic cattle gun, a penchant for using a coin toss to decide whether someone should live or die, and a voice that sounds like it's coming not from a human being, but from the bowels of Hell itself. Chigurh relentlessly pursues the equally dogged Llewellyn through Texas as the compassionate, sad-eyed Sheriff Ed Tom Bell (Tommy Lee Jones as the film's voice of reason) tries to catch up, feeling overmatched by the sheer implacable evil of the 'ghost' that is Chigurh.The film's pacing is deliberate, but for me that simply increased the suspense as I wondered what Chigurh would do next and if Llewellyn had a chance in hell of eluding him for good, especially with his ever-increasing number of injuries. The suspense scenes are real nail-biters. There's a thrilling chase with Llewellyn pursued at night, first by a monster truck, then into the rapids by dogs. Pit bulls don't stand a chance against bullets! :-) One of my favorite scenes finds Llewellyn in his motel room in the dark. The only lights are the glowing tracking transmitter he finds in the drug money and the light under the door from the hall outside -- until a pair of feet appear on the hall side. All we hear is the transmitter...and the sound of a light bulb in the hall being unscrewed, resulting in more darkness...and I can say no more!It's a tribute to the power of Bardem's portrayal of Chigurh that his unflattering Beatles moptop-cum-Prince Valiant pageboy haircut doesn't stop him from being one of the most terrifying villains in movie history. It got so that every time Chigurh showed up, I'd watch the rest of the scene between the fingers covering my face, because I knew Bad Things Were About To Happen. Bardem's Chigurh is all the scarier because he can seem utterly calm and casual even as he blows people's brains out with that pneumatic cattle gun of his. The thing can blow out locks as well as brains, so its versatility makes up for its cumbersomeness. :-) As good as all of this year's Best Supporting Actor nominees are, I'm rooting hardest for Bardem to win the Oscar.There's some humor in the dialogue (taken mostly from the novel), but it's of the low-key, matter-of-fact variety. My favorite is the exchange between the deputy and Sheriff Bell: 'It's a mess, ain't it, Sheriff?' 'If it ain't, it'll do till the mess gets here.' My favorite black-humored sight gag: after Chigurh launches a protracted attack in which a cop is killed, the camera pulls back to show that the floor is completely covered with scuff marks from the dead man's shoes flailing and scraping against the floor during the struggle.Be warned, NCfOM is not for the squeamish or for those who like their endings neat and tidy, with everyone getting what they deserve. Nevertheless, it still haunts me, to the point where I happily paid to see it in a theater for a second time (with relatives who were as blown away by it as I was). Could NCfOM end up being the bloodiest, most suspenseful Best Picture Oscar winner since THE SILENCE OF THE LAMBS? I feel that NCfOM is not only one of the best films of 2007, but one of the best films the Coens have ever made, richly deserving its 8 Oscar nominations. It's still playing in theaters as of this writing, so by all means, get out of the house and into a theater to see it for yourself!",10,6,12,26 January 2008
The Pianist," Adrien Brody's Minimalist Acting Packs Maximum Emotional Punch
","This wrenching yet ultimately uplifting fact-based drama won Adrien Brody his Academy Award and finally made him a star (along with his gracious yet heartfelt Oscar speech and That Kiss :-) -- rightly so, since title character Wladyslaw Szpilman is a challenging role in so many ways!  It's not easy to command the screen when your character often has to be passive, deliberately trying not to draw attention to himself to keep from falling into Nazi hands in war-torn Poland, but Brody pulls it off.  It helps that Brody is absolutely stellar at acting with his eyes, plus his body language speaks volumes; these fill in the emotional cracks, especially in scenes where Szpilman, alone and in hiding, can't speak or even move around much for fear of giving himself away.  (Brody is the youngest actor to date to win the Best Actor Oscar, BTW, having gotten his little gold man only a month before his 30th birthday.) While there's no lack of haunting scenes, thanks to the deservedly Oscar-winning work of director Roman Polanski and screenwriter Ronald Harwood, the one that always gets me is the one where Szpilman discovers the apartment serving as his latest `safe house' has a piano. We see Szpilman sit at the piano; we see him in a head-and-shoulders shot, shoulders moving; we hear piano music and gasp as we fear his love and longing for music is about to give him away -- and then we see his hands moving in the air just above the keyboard and realize, with both relief and a pang of regret, that the music is only in Szpilman's head.  Terrific as the other 2002 Best Actor nominees were, now that I've seen THE PIANIST (as well as the fascinating making-of documentary on the DVD's flip side, showing what a physically and emotionally grueling experience Brody's job often was), I'd be really p***ed off if anybody but Adrien Brody had won! (Besides, the rest of the 2002 Best Actor nominees already won Oscars -- this time it was dark horse Brody's turn! :-)",10,139,176,9 January 2004
Cloudy with a Chance of Meatballs," Big Food and Big Fun in Animated Adaptation of Beloved Book
","CLOUDY WITH A CHANCE OF MEATBALLS (CWACOM), based on the beloved 1978 children's book by Judi and Ron Barrett, is almost Pixar-level good! My family and I saw this animated treat in 2D rather than 3D because we wanted to take advantage of a local theater's morning matinée. However, we didn't miss the 3D effects in this vivid, playful, rollicking adaptation; we were having too much fun! Written and directed by Phil Lord and Christopher Miller, CWACOM deftly combines the warmth of a Pixar film with the zany sight gags of a Looney Tunes cartoon. The movie also expands entertainingly on the book's premise about the little town of Chewandswallow (in the film, the town is part of an economically-depressed island, Swallow Falls), where food drops from the sky like rain, with surreally madcap results. The film gives the townspeople more personality, including an endearingly awkward protagonist, young scientist wannabe Flint Lockwood (voiced by Bill Hader). When Flint hits on a way to convert water into all manner of foodstuffs, saving his town from poverty and an all-sardine diet, he finally becomes a town hero after years of having his inventions laughed at. To our hero's frustration, his laconic but well-meaning dad isn't quite on board with his son's success yet, fearing he hasn't thought through the possible consequences. (This being an animated film, of course Flint's mom is the only person who believes in him, and of course she dies young.) Flint teams up with aspiring weather-gal Sam Sparks (Anna Faris), who's as ambitious and eager for acceptance as Flint is; merciless childhood teasing led Sam to hide her smarts behind her pretty face and perky personality. The film makes some good points about the pros and cons of craving other people's approval and over-sized food portions. Happily, Lord and Miller put all of this across with a light touch, a refreshing lack of sap and snark, and a super-size helping of hilarity and wit. We were pleasantly surprised to see that the majority of the laugh-out-loud funny gags aren't so ridiculously topical that they'll feel dated by the time the DVD comes out. :-) There are tips of the hat to classic science fiction movies, but those scenes will still be fun even if you've never seen the films in question. The gags aren't just funny, they're plentiful. In fact, our family would love to see CWACOM again to look for all the uproarious background sight gags we missed the first time around! Even Flint's posters of his scientist heroes are funny and clever, drawn to look like rock star pin-ups. There's a side-splitting payoff to every little running gag -- sometimes literally, like with the walking TV Flint invented. As chaos reigns late in the film, a looter carries off a TV -- and Flint's walking TV carries off the guy! (THE TWONKY, anyone? :-)) Spaghetti tornadoes with meatball meteors, feral Gummi bears on the attack, schools closed on account of falling giant pancakes -- what's not to like? The voice cast is terrific, too; in addition to Hader and Faris, we loved James Caan's imitation of James Gandolfini as Flint's dad; Bruce Campbell as the self-serving mayor; Andy Samberg as former sardine factory icon Baby Brent; Mr. T. as gung-ho cop and loving dad Earl; and my favorite, Benjamin Bratt, who's deadpan funny (yes, both Bratt's voice and his animated character's face are deadpan, smarty :-)) as an unassuming bystander who turns out to be a doctor, saving Earl's young son from his food coma: 'I came from Guatemala for a better life. Good thing, huh?' As a side note, one plot element that particularly hit home for our family was Sam's peanut allergy; during a climactic action scene, she's scratched by knife-like shards of peanut brittle, resulting in a race against time to get her back to their ride so she can use her Epi-Pen before anaphylactic shock sets in. Our daughter could relate because of her own peanut/tree nut/sesame allergies. Of course, she carries her Epi-Pen everywhere (good girl)!",10,5,10,19 September 2009
Charlie and the Chocolate Factory," Tim Burton and Roald Dahl: A Movie Marriage Made in Candyland
","When my husband and I heard that Tim Burton was making a new film version of Roald Dahl's CHARLIE AND THE CHOCOLATE FACTORY starring his favorite leading man Johnny Depp as Willy Wonka, the world's quirkiest candy maker, we knew it would be a perfect match of filmmaker and source material, and indeed it is! Burton's inventive imagination and dark, twisted sense of humor suits Dahl's gleeful misogyny perfectly, yet still results in a family-friendly film simply because, like Depp's Willy Wonka, it doesn't pander to the young'uns. Indeed, Wonka doesn't even seem to like the golden-ticket-winning kids he invites to his weird and wonderful confection factory, though in his own oddball way Wonka eventually warms up to our hero Charlie Bucket (Freddie Highmore). Who wouldn't like the selfless, poor-but-thankful-for-his-blessings Charlie, especially compared to the four spoiled brats competing against him for the 'special prize' Wonka dangles before them? The kids' acting styles work well, with young Highmore's un-actorish down-to-earth quality playing off well against the appropriately flamboyant brattiness of AnnaSophia Robb (as super-competitive Violet Beauregarde), Julia Winter (Veruca Salt, the overindulged rich kid), Jordan Fry (Mike Teevee, now an aggressive video game freak as well as a television addict) and Philip Wiegratz (Augustus Gloop, a sweet-faced but selfish glutton). Wonka is also given a back story of funny yet poignant strife with dad Christopher Lee, a dentist (!) who takes his work just a little too seriously. This angle could have been as overly sweet as a bad piece of candy, but the cast, Burton, and screenwriter John August work it gracefully into the family theme. Unlike Wonka, Charlie has a loving relationship with his eccentric family (all played with warmth and wit by a cast of fascinating faces, especially David Kelly as Grandpa Joe, Noah Taylor as Charlie's dad, and Helena Bonham Carter as Charlie's cabbage-soup-making mom). It helps that Depp and Highmore have good chemistry. (Fun Fact: Depp recommended Highmore to Burton after working with the lad in FINDING NEVERLAND. Another FN veteran in the cast: Eileen Essell of DUPLEX fame, playing Charlie's Grandma Josephine.) With Alex McDowell's production design, Philippe Rousselot's lush photography, and Gabriella Pescucci's costume design, the movie is deliriously gorgeous to look at, like a collaboration between Edward Gory and Peter Max. Thanks to the deadpan performance (or should I say performances? :-) of a CGI-multiplied Deep Roy, along with Danny Elfman's fabulously fun score -- with songs based on lyrics from Roald Dahl himself, yet reminiscent of Elfman's work with Oingo Boingo -- the Oompa-Loompas' production numbers are a delight to watch and listen to (no cover version of 'The Candy Man,' sorry! :-). Our whole family had a blast -- CHARLIE... is the tastiest sweet-and-sour sugar rush of the summer!",9,5,8,18 July 2005
