movie_title,title,review,rating,helpful,total,date
Logan," Excellent movie but not super hero movie
","Logan may not be a perfect film, it is most certainly a perfect comic book film. LOGAN feels like the Wolverine movie Hugh Jackman has been waiting (and training) for 17 years to make. What makes this one of the finest superhero movies ever produced is the big, messy, somewhat broken heart beating at its core.In the year 2029, mutants are on the brink of extinction, with no new mutants having been born in 25 years. James 'Logan' Howlett, formerly known as Wolverine, spends his days working as a chauffeur in Texas. His healing factor has been severely weakened and he has aged due to the adamantium on his bones beginning to poison him. Logan lives with mutant tracker Caliban in an abandoned smelting plant across the Mexican border, where they care for Professor Charles Xavier, who is suffering from a neurodegenerative disease which causes him to lose control of his telepathic abilities to devastating effect. One day, Logan is approached by Gabriela Lopez, a nurse for biotechnology corporation Alkali-Transigen, who wants him to escort her and an 11-year-old girl named Laura to a place in North Dakota called 'Eden'.After reluctantly accepting the job from Gabriela, Logan discovers that she has been murdered. Logan and Xavier learn that Laura is one of several mutant children Transigen was breeding using DNA samples from several mutants for the 'X-23' project, and that upon completion of the 'X-24' project, the children were deemed obsolete and were to be euthanized. Gabriela helped several children escape from the Transigen compound before smuggling Laura, who is revealed to be Logan's biological daughter, across the border.The Reavers catch up with them in Oklahoma City, but Xavier suffers a seizure and telepathically freezes everyone in their hotel, allowing Logan to kill the attackers before injecting Xavier with a suppressant and escaping. While on the highway, the trio helps farmer Will Munson and his family after a traffic incident. The Munsons invite them over for dinner, and they accept under the guise of being a trigenerational family. When a nearby pipe springs a leak, Logan and Will leave the house to fix it.While Logan is gone, X-24 stabs Xavier through the chest before slaughtering the Munson family. When Logan returns, Xavier succumbs to his wound and Caliban sacrifices himself by setting off two grenades to destroy the Transigen van in which he is being held captive. Logan engages X-24, which gains the upper hand, but Will impales X-24 and shoots it before dying, allowing Logan and Laura to escape.After burying Xavier, Logan passes out from exhaustion. He wakes up in a clinic that Laura had driven him to, but refuses to get further treatment and wants to abandon the trip. Laura convinces him to complete it, and they arrive at Eden, a safe haven run by Rictor and the other Transigen test subjects that managed to escape. Logan learns that the children plan to journey across the Canadian border and decides to part ways with them. However, when the children are intercepted by the Reavers, Logan intervenes. Dr. Zander Rice, the head of Transigen, pacifies Logan and reveals that the destruction of mutantkind is due to a genetic dampener created by his corporation. Logan shoots Rice dead.Logan and Laura fight X-24, with Rictor using his seismic powers to help them. However, X-24 brutally impales Logan on the branches of a fallen tree. While X-24 is trying to finish Logan, Laura shoots X-24 dead with an adamantium bullet Logan had been keeping. Fatally wounded, Logan tells Laura not to be the weapon she was made to be before dying in her arms. Laura and the other children mourn his death and hold a somber burial. Laura adjusts the cross on his grave to form an 'X' before continuing on their journey across the border in search of a new beginning.",10,4,10,3 April 2017
Beauty and the Beast," Disappoint movie
","As a fan of the original Disney film (Personally I feel it's their masterpiece) I was taken aback to the fact that a recent version was in the making. Still excited I had high hopes for the film. Most of was shattered in the first 10 minutes. Campy acting with badly performed singing starts off a long journey holding hands with some of the worst CGI Hollywood have managed to but to screen in ages. This movie is the disappoint.When the prince refuses the rose from stranger and stranger turn to fairy, she transforms him into a monstrous beast and his servants into household objects, and erases the castle from the memories of their loved ones. She casts a spell on the rose and warns the prince that, unless he learns to love another and earn their love in return before the last petal falls, he and his servants will lose their humanity forever.Lost in the forest, Belle's father Maurice seeks refuge in the Beast's castle, but the Beast imprisons him for stealing a rose. Belle ventures out in search for him and finds him locked in the castle dungeon. The Beast agrees to let her take Maurice's place (her father place).Belle befriends the castle's servants, who treat her to a spectacular dinner. When she wanders into the forbidden west wing and finds the rose, the Beast, enraged, scares her into the woods. She is cornered by wolves, but the Beast rescues her and is injured in the process. A friendship develops as Belle nurses his wounds. The Beast shows Belle a gift from the enchantress, a book that transports readers wherever they want. Belle uses it to visit her childhood home in Paris, where she discovers a plague doctor mask. Belle realizes that she and her father were forced to leave her mother's deathbed because of her mother succumbed to the plague. Bell's father come back to village to seek the help, but no one believe him. Gaston sees rescuing Belle as an opportunity to win her hand in marriage and agrees to help Maurice. However, when Gaston go with Bell's father to forest, he loses temper because bell's father forgot the way to beast castle; Gaston then abandons him to the wolves. Maurice is rescued by a beggar, but when he tells the townsfolk of Gaston's crime, Gaston convinces them to send him to an insane asylum. After sharing a romantic dance with the Beast, Belle discovers her father's predicament using a magic mirror. The Beast releases her to save Maurice, giving her the mirror to remember him with. At Villeneuve, Belle proves Maurice's sanity by revealing the Beast in the mirror to the townsfolk. Realizing that Belle loves the Beast, Gaston has her thrown into the asylum carriage with her father and rallies the villagers to follow him to the castle to slay the Beast. Maurice and Belle escape and Belle rushes back to the castle.During the battle, Gaston abandons his companion LeFou, who sides with the servants to fend off the villagers. Gaston attacks the Beast in his tower, who is too depressed to fight back, but regains his will upon seeing Belle return. He spares Gaston's life before reuniting with Belle. However, Gaston shoots the Beast from a bridge, but it collapses when the castle crumbles and he falls to his death. The Beast dies as the last petal falls and the servants become inanimate. When Belle tearfully professes her love to him, Agathe reveals herself as the enchantress and undoes the curse, repairing the crumbling castle and restoring the Beast's and servants' human forms and the villagers' memories. The Prince and Belle host a ball for the kingdom, where they dance happily.",3,1,4,30 May 2017
Kong: Skull Island," This is call kong movie
","Some people go to the movies to be wowed by the superb acting, heart wrenching and well written story, and overall solid production. This is an all out creature feature...It is called Skull Island because that's where the action takes place with all the neat creatures. There is a LOT of screen time devoted to Kong and the monsters. Kong: Skull Island is the perfect monster movie. It's an epic display of what a popcorn movie should be.In 1944, in the midst of World War II, two fighter pilots – an American soldier named Hank Marlow and a Japanese soldier named Gunpei Ikari – parachute onto an island in the South Pacific after a dogfight. They both engage in close combat, with Ikari gaining the upper hand, but the fight is interrupted by a behemoth ape known as Kong.In 1973, U.S. government agent Bill Randa hires former British Special Air Service Captain James Conrad, a skilled tracker, to guide an expedition to map out an island known as 'Skull Island' and with a Vietnam War helicopter squadron led by Lieutenant Colonel Preston Packard and his subordinates, Major Jack Chapman and Captain Earl Cole. Upon arrival at Skull Island, Packard's men begin dropping explosives developed by seismologist Houston Brooks to map out the island. However, the air unit is attacked by Kong, who kills a number of military personnel and scatters the others across the island.After being confronted by Packard, Randa reveals his affiliation to the secret government organization Monarch, which was trying to prove the existence of monsters and determine their threat to humanity. The other survivors (Conrad, Weaver, Brooks, biologist San Lin, soldier Reg Slivko, and Landsat employee Victor Nieves) try to get to a rendezvous point to meet a resupply team arriving in three days' time. They encounter the local Iwi natives and an older Marlow. He reveals that Kong is the island's guardian, worshiped as a god by the natives for protecting the island's inhabitants from many predators, including reptilian underground monsters dubbed 'Skullcrawlers'. They have killed Kong's ancestors, leaving him as the last of his kind, and that one of the Skullcrawlers killed Ikari.Packard's group begins making their way to Chapman, whose helicopter crash-landed elsewhere. Meanwhile, Chapman is ambushed and eaten by a Skullcrawler. Jame Conrad's group helps Marlow complete a boat built from parts scavenged from Marlow and Ikari's downed planes. They ride the boat down the river, and manage to secure communication with Packard's group, but the boat is attacked by pterosaur-like creatures which kill Nieves. They regroup with Packard, who insists on searching for Chapman, though his true objective is to find and kill Kong.There, the same Skullcrawler that devoured Chapman attacks the group, killing Randa and many soldiers before dying in a flammable gas explosion triggered by Weaver. Learning about Chapman's death, a vengeful Packard blames Kong for the deaths of his men and becomes determined to kill Kong. The two groups part ways, with Packard's group laying a trap for Kong, while the non-military personnel head back to the boat. As Conrad and Weaver encounter Kong, Packard's group triggers napalm explosions to lure him in. Kong charges to the lake, where they manage to incapacitate him with ignited gasoline, though Woodward is killed. Conrad's group arrives and persuades the other soldiers to spare Kong, but Packard refuses to stand down. Then, a massive Skullcrawler. Emerges from the lake. Packard is crushed to death by a recovering Kong. The Skullcrawler overpowers Kong in a brief battle and then chases the survivors. Kong returns to rescue the others and with help from the humans, kills the beast by ripping out its innards. He saves Weaver from drowning, and allows the surviving humans to leave the island.During the credits, Marlow returns home, reuniting with his wife, meeting his son for the first time, and watching a Chicago Cubs game on television. In a post-credits scene, Conrad and Weaver are detained by Monarch and informed by Brooks and Lin that Kong is not the only monster to roam the world. As proof, they are shown archive footage of cave paintings depicting Godzilla, Rodan, Mothra, and King Ghidorah.",9,2,5,17 April 2017
The Secret Life of Pets," Excellent movie for family
","I was waiting for this movie since first trailer was launched. And when i had opportunity to watch it, i was more than happy. Great story line, It was funny silly and my favorite illumination movie it's worth a watch and it is definitely better than minions it is fun for the whole family. I could not stop laughing at this movie it so many great characters. Very fun and entertaining movie for the whole family, this movie took me off guard and laughed so much at the roles the characters had. It was such an adorable movie.A Jack Russell Terrier named Max lives with his owner Katie in a Manhattan apartment. While she is at work during the day, he hangs out with other pets in the building: tabby cat Chloe, pug dog Mel, dachshund dog Buddy, and budgerigar birb Sweetpea. One day, Katie adopts Duke, the big brown dog from the pound, leaving Max jealous because of her larger focus on Duke. One day, because of attitude max toward Duke, the duke draped Max to alley and abandon Max there; however, they are both attacked by a gang of alley cats led by Sphynx cat Ozone. The cats remove both dogs' collars and leave them to be caught by Animal Control. They are rescued by a rabbit named Snowball, the leader of 'The Flushed Pets'– a gang of sewer-dwelling animals who hate humans. After Max and Duke pretend to despise humans as much as they do, the Flushed Pets invite them to join. Before they can prove their loyalty to Snowball, The two dogs escape the sewers. Snowball vows to kill them and leads the Flushed Pets after them.A white dog who has a crush on Max, discovers that he is missing, and recruits red-tailed hawk, Gidget (the white dog) and Tiberius (the hawk) then enlist Mel (The fat dog), Buddy(a sarcastic dachshund dog), Chloe(a gray cat), guinea pig Norman(a guinea pig), Sweetpea(a small birb), and a paralyzed old base hound named Pops to begin searching Max. The group encounters Snowball, who vows to kill them as well, and Norman (a guinea pig) is captured as the rest of Gidget(the white dog )'s team flees. In Brooklyn, Max and Duke begin to get along with each other. Duke tells Max about his previous owner, Fred, an elderly man, live with him with happy life. One day, Duke got lost while chasing a butterfly and was picked up by Animal Control. Max convinces him to visit Fred's house in a nearby neighborhood, confident that Fred will still love him. When they arrive, though, they learn from a resident cat named Reginald that Fred has died. Resentful and angry, Duke accuses Max of attempting to get rid of him and barks at the new homeowners who call Animal Control. The handlers catch Max, but Duke interferes for him to escape and ends up being captured instead. While trying to rescue Duke as he follows the Animal Control van, Max is attacked by Snowball and his comrades. However, Snowball's gang are captured by animal control, and Snowball decides to help Max rescue them. They drive by a city bus and crash into the van of animal control on the Brooklyn Bridge, stopping traffic. The animal control van falls into the East River with Max and Duke inside. Max is unable to get the keys to Duke's cage, so Snowball jumps into the river to retrieve them, allowing Max and Duke to escape the sinking van. The entire group return to the apartment by taxi. Max expresses his appreciation toward Gidget. Snowball and the Flushed Pets then come up with a new plan to annihilate all humans, but Snowball is then adopted by a little girl named Molly. At first, Snowball resists, but gives in to her sweetness and lets himself be adopted by her. Max and Duke finally reunite with Katie, sparking a true friendship.",10,10,16,19 September 2016
Arrival," Best fiction movie
","Last night I saw Arrival at TIFF and my mind was blown. This is by far Villeneuve's biggest film he has tackled yet with so many strong universal themes but yet also feels very emotional and intimate from the perspective of Amy Adams's character. Arrival is unlike any movie I've ever seen. It's about love, loss, tolerance, language and non-linear time, wrapped in a science fiction story about our first encounter with extraterrestrials. This movie is the best movie.Louise is lecturing at a university; twelve extraterrestrial spacecraft appear across the planet. U.S. Army Colonel Weber asks her to join a team, with physicist Ian Donnelly, to decipher their language and find out why they have come to Earth. The team is brought to a U.S. military camp in Montana near one of the spacecraft. They call two alien which is nicknames them Abbott and Costello. Louise discovers that they have a written language of complicated circular symbols, and begins to learn the symbols that correspond to a basic vocabulary. As she becomes more proficient, she starts to see and dream vivid images of herself with her daughter. When Louise is able to ask what the aliens want, they answer: 'offer weapon'. A similar translation 'use weapon' is received by one of the other sites. Fear of a potential threat from the aliens leads other nations to close down communications on the project, and some prepare their military for attack. However, Louise thinks that the symbol interpreted as 'weapon' might have an alternative translation, such as 'tool' or 'technology'.Rogue soldiers plant explosives in the spacecraft. Unaware, Louise and Ian re-enter to communicate with Abbott and Costello again. The aliens give them a much larger and more complex message. Abbott ejects Ian and Louise from the craft as the explosion occurs, which leaves them unconscious.After Lan and Louise wake up, Ian works out that the symbols relate to the concept of time, and that it is one-twelfth of the whole 'gift'; they conclude that the aliens must want nations to cooperate.Louise rushes back to the spacecraft, which sends down a shuttle to take her inside. She meets Costello, who communicates that Abbott is dying. Louise asks about her visions of a daughter, and Costello explains that she is seeing the future, revealing to her that her 'visions' were not flashbacks but flash forwards. Costello also communicates that they have come to help humanity by sharing their language, which is the 'weapon' or 'tool' because it changes the mind's perception of time. The aliens know that 3000 years into the future they will need humanity's help in return. They ask her to use her 'weapon' - her ability to see into the future.Louise returns as the camp is being evacuated. Louise use her future power to know Shang's wife last words and she use to that to stop Shang's military power (China power). The planned Chinese attack is called off and the other nations resume contact with each other, as the spacecraft disappear from Earth.When packing to leave the camp, Ian admits his love for Louise. They discuss life choices, and whether they would change them if they knew the future. Louise foresees that Ian will father her daughter Hannah, whose name is an intentional palindrome, and leave her after discovering that she knew their daughter would die before adulthood. Despite also seeing that Ian will leave her when she eventually reveals their daughter's future, when Ian asks her if she wants to have a baby, Louise agrees.",10,2,14,30 January 2017
Wonder Woman," good movie but boring in the first half
","As a lot of People disliked the film, I liked it. It was a little slow, but overall it set up how wonder woman grew up and go outside the world and kill god of war.Diana was raised on the hidden island of Themyscira, home to the Amazon race of warrior women created by the gods of Mount Olympus to protect humankind. In the distant past, Ares, the god of war, slew all his fellow gods, but his father, Zeus, struck him down. Before succumbing to his injuries, Zeus left the Amazons a weapon capable of killing his renegade son: the 'Godkiller', presented as a ceremonial sword. Queen Hippolyta, Diana's mother, believes that Ares will never return and forbids Diana from training as a warrior, but Diana and her aunt General Antiope defy the queen and begin training in secret. When the two are discovered by Hippolyta, Antiope convinces her sister to allow Diana's training.As a young woman in 1918, Diana rescues American pilot Captain Steve Trevor after his plane crashes off Themyscira's coast. The island is soon invaded by the landing party of a German cruiser pursuing Steve. The Amazons engage and kill all of the German sailors, but Antiope sacrifices herself to save Diana by intercepting a bullet meant for her. Interrogated with the Lasso of Hestia, Steve reveals that 'The War to End All Wars' is raging in the outside world, and that he is an Allied spy. He has stolen a notebook with valuable information from the Spanish chief chemist Isabel Maru, who is attempting to engineer a deadlier form of mustard gas under the orders of General Erich Ludendorff, from a weapons facility in the Ottoman Empire. Believing Ares is responsible for the war, Diana arms herself with the sword and leaves Themyscira with Steve to find and destroy Ares.Diana translates Maru's notes and reveals that the Germans plan to release the deadly gas at the warfront. Although forbidden by his commanders to act, Steve, with secret funding from Sir Patrick, recruits spy Sameer, marksman Charlie, and smuggler Chief to help prevent the gas from being released. When the team reaches the Western Front in Belgium, they are halted by the enemy lines, but Diana pushes alone through no man's land and rallies the Allied forces behind her to liberate the village of Veld. The team briefly celebrates and takes the group photograph from the beginning of the film. That night, Diana and Steve become intimate and share a kiss.The team learns a gala will be held at the nearby German High Command. Steve and Diana each infiltrate the party, he intending to locate the gas and destroy it, she intending to kill Ludendorff, believing he is Ares and that killing him will end the war. Steve stops her to avoid destroy his plan. Ludendorff unleashes the gas on Veld, killing its inhabitants. Diana blames Steve for intervening and pursues Ludendorff to a base where the gas is being loaded into a bomber aircraft bound for London. Diana fights and kills Ludendorff but is confused when his death does not stop the war.Sir Patrick appears, revealing himself as Ares and tells Diana that although he has subtly given humans The evil ideas and evil inspirations which is ultimately their decision to cause violence as they are inherently corrupt. He destroys the ceremonial sword, revealing Diana is the true 'Godkiller' as she is Zeus' daughter, then tries to persuade her to help him destroy humankind to restore paradise on Earth. While the two battles and the rest of Steve's team destroy Maru's laboratory, Steve pilots the bomber carrying the gas to a safe altitude and detonates it, sacrificing himself in the process. Ares attempts to harness Diana's rage and grief at Steve's death by convincing her to kill Maru, but her memories of Steve cause her to decide that humans have good within them. She spares Maru and kills Ares.Later in Trafalgar Square, the team celebrates the end of the war.",8,2,7,13 July 2017
