movie_title,title,review,rating,helpful,total,date
First Man," TAKE A DEEP BREATH AND DIVE IN..
","Forget about sci-fi or spaceships or any armageddon-like scenarios when you go inside the theater.
This is the behind-the-scenes story. From a personal point of view this story comes out.
You will feel like on of the crew of aplollo 11, with the the turbulence and the sweat.
To keep it short, it is such an amazing movie to watch. I would recommend it over any other movie this year, period!!!",9,0,1,17 October 2018
