movie_title,title,review,rating,helpful,total,date
District 9," Science Fiction Matserpiece
","The first genuine science fiction masterpiece I have seen, as many critics have already said, District 9 really is the unsung hero of our time. With Avatar having stolen the sci-fi hot spot, while it is still a brilliant movie, Peter Jackson's District 9 is in every way a superior film.The first half of the film incorporates an extremely realistic documentary-like feel, all about the fact that aliens have taken refuge on earth for many years. The second half is more focused on the main protagonists, Wikus and Christopher Johnson, but retains a realistic feel and has a larger emotional feel. Despite this divide in the style of the film, it all felt natural and the documentary-style was done seriously and added to the suspense of the main plot, creating a unique kind of film I have never seen before. It adds a grittiness to the world of the film, even to the point where I believed the events of the film were very possible.The story itself is outstanding. Peter Jackson intended to show human beings in a truthful light. Upon their arrival on earth, rather than giving the aliens temporary shelter and help them leave the planet, as humans would the government became obsessed with alien technology and intended to harness their superior weaponry for warfare. As for the aliens, or 'prawns' as they are nicknamed, they were given relatively comfortable homes for several years. But the story opens with Wikus (the protagonist) being assigned to evict the prawns from District 9, into a concentration-camp-like area where the prawns would be isolated from humans. Harsh? Oh yes, and the events of the film kick off from here. Iwon't reveal anything as it really is a film you have to experience, but the pacing of the film finally picks up as the main story begins. The story tackles the issues of corruption, trust, betrayal and cruelty as well as the emotional struggle Wikus is forced to deal with. I loved the fact that the second protagonist is a prawn named Christopher, as well as his young son, who have been planning something for a long time. As for the special effects, the film truly is perfect. The prawns are 100 per cent convincing as creatures, as well as the technology and prawn space craft. With some beautiful shots of South Africa, District 9 is in the shadow of Avatar. It deserves to be in the light.",9,1,3,5 May 2011
Unknown," Taking the Unknown Identity.
","Having loved Liam Neeson in Taken I would have been mad to have missed this. Having seen it, it's not hard to notice the film felt like a mixture of The Bourne movies and Taken. Despite this, the film stood firmly on it's own two feet as a solid and enjoyable action movie.Prior to seeing this I was worried Liam Neeson would play the part of the protagonist (Dr. Martin Harris) too similarly to the one he played in Taken, but this was not the case at all. Although he still plays a character who has excellent skills in combat, Martin Harris is a victim who has lost quite literally everything and must fight in order to take it back. Neeson clearly depicts this to the audience, making you sympathise with his desperate situation and personally I wanted to help him find out what happened.The film felt like a journey of steady progression towards finding the truth behind his apparent memory loss, but it is far from an easy journey as whenever Harris comes to some sort of logical answer, he is tripped up either by armed henchman breaking down the door and chasing him through the streets, betrayal, and unexpected turns in the plot. It is understandable if some viewers would become frustrated by this, but I found it increased the tension building towards the end of the film.The ending itself was not too surprising, but rather a logical answer that made sense. I am glad, however, the writers chose this approach over a far more confusing and possibly over-the-top ending. I felt satisfied with what I had seen and believed the approach to be necessary, even if it was not over-whelming.With some great shots of Berlin, tense and fun action scenes it is a solid experience, even if this concept has been used before. I don't know much about the making of the film, but it is likely they used 'The Bourne Identity' as a starting point. But don't let this put you off this brilliant entertainer!",7,1,4,5 April 2011
The Adjustment Bureau," It's not Inception, but it's pretty good.
","I've always been a fan of high-concept films, Inception being my favourite of the lot. I love the originality and brilliant new ideas the script writers put forward. The Adjustment Bureau puts forward a brilliant idea that raises questions, but the film's story does not quite live up to the potential of the brilliant ideas put forward.The basic bulk of the story is a simple but satisfying love story. The real fun begins when a group of mysterious suit-wearing gentlemen show up interfere in the life of the protagonist. Their arrival raises questions as to how much choice we really have as human beings, if history is written, and even goes so far as to suggest the existence of god. In the end, who or what the (adjustment bureau) are is a matter of the audience's opinion and interpretation. My only real gripe with this movie is just as it starts to get deeper into the concept itself, we are still left wondering, with only a few questions answered.As for the acting, I thought Matt Damon and Emily Blunt both played their roles perfectly on screen and the chemistry between them was great. In fact, I personally couldn't find any bad acting here.It's well worth a watch, and 7/10 does feel a little harsh. I just really wish I could have discovered more about this mysterious organisation....",7,1,2,21 March 2011
Thor," 'I'll take one of those large enough to ride'
","Well, you don't need me to tell you Marvel movies have been on pretty good form lately. The Iron Man Movies were successful, and the new X-Men looks promising.As for Thor? Hammer Throwing goodness! Now, this movie is just pure entertainment. From an ancient battle on earth, to the towering city of Asguard, Thor has some very impressive background settings.The film is strongly inspired by a mixture of Roman and Viking civilisations, creating Asguard and Thor's species the Asguardian's. It is an interesting mix of alien and historic cultures, and compare's our culture to one of strict rules and responsibilities.The storyline is simple, but will keep you entertained. It is understandable if fans will see the ending as a bit of an anti-climax,but the main bulk of the film is a good mix of comedy and action, although it does have a few flaws when it comes to a slightly cheesy and unrealistic romance between Thor and Natalie Portman's character Jane. Speaking of which, I felt Natalie Portman had a slight absence of dialogue and her character seemed more like a background character rather than a secondary protagonist.Chris Hemsworth and Antony Hopkins both had outstanding performances (Hopkins goes without saying) and if the story fails, the relationship between Thor and Odin will surely keep you watching.With some nice references linking the film within the same world of Iron Man, and an ending that begins to set up Thor's relationship with Shield, I look forward to his return in the Avengers.Fan of Marvel or not, this is good old fashioned summer blockbusting.",8,4,8,19 May 2011
The Dark Knight Rises," A satisfying conclusion to a classic trilogy
","What is fundamentally the most impressive thing about The Dark Knight Rises is that director Christopher Nolan approached the project with the intention of creating a satisfying conclusion to the story built up in the previous two films, and that is exactly what this film is. The film fulfils its very goal, and is an incredibly satisfying ending to the story. If you are unwilling to accept this before seeing the film, you probably won't enjoy the film as much as I did.Eight years after the events of The Dark Knight Gotham is enjoying a period of peace built on the lie which is 'The Harvey Dent Act', a lie which has eaten away at Bruce and Gordon for the last eight years. Gordon has been left to clean up Gotham without Batman's help, and Bruce has become a physically and mentally traumatised hermit living within the rebuilt Wayne Manor, confined to using a cane as a result of doing nothing for all that time. What is an instantly recognisable change from the film's predecessors is the speed in pacing, the film beginning with a brief speech by Gordon, moving on to an impressively visual and ambitious prologue sequence, then swiftly moving to a celebration at Wayne Manor in which the film introduces a number of new characters. Despite this fast-pacing and new-cast onslaught, the story felt like it was moving far too slowly, and I wondered when something was actually going to happen. Fortunately, both of these flaws can be explained, my instantly negative reaction to the fast-pacing being a negative in human nature as opposes to the film- this unforeseen change actually serves the movie well, allowing Christopher Nolan to make three hours fly-by. The slow-start soon picks up, and I understand it was a good, realistic decision to hold off on putting Bruce back into the bat-suit too early in the film, as the film's premise is questioning whether Batman should return, and what consequences this action will have. The onslaught of new characters does feel like they have been forced down the audience's throat, and non are given any real affective role to play, however the final resolve reveals all characters are fundamental to the plot. In other words, patience whilst watching this movie will pay off.My personal enjoyment of the film was not derived by the film itself so much as certain aspects of the film, namely Tom Hardy's outstanding portrayal as the villain Bane and the character in general. I had high hopes for Bane, being a fan of Hardy's work prior to watching the film, but being confident the character would not be as successful as Heath Ledger's untouchable performance as The Joker. Having watched the film I found Bane to be far more intriguing than I previously predicted as well as being just as quotable and thrilling to watch as The Joker, though Bane is a completely different kind of villain, the focus being on physical intimidation, sheer intelligence and his level of control over people. Though Hardy's performance is not at the same level as Ledger's and his performance is restricted by a mask covering half of his face, but his performance is anything but restrictive, an emphasis on physicality, conveying intimidation through body movements and emotion through his eyes, as well as a wonderfully memorable and unnerving voice, which has unfortunately been over-edited in post production. As well as the performance, Bane's origin story, or at least what little we learn from the film, is very intriguing; however I would have liked more emphasis on the character's origin , as Bane is, like all Batman's villains, a version of Batman himself. Anne Hathaway's performance as Selina Kyle can also not be commended enough, giving the best Selina Kyle/ Catwoman to date, her performance perfectly fitting in with Nolan's realistic vision of the character, her feisty yet sexy performance stealing each scene with elegance as Hardy steals it with intimidation.Previous speculation and hype have given great expectation to the film being a revelatory masterpiece in terms of storyline. I always felt this sounded like a risky approach, and whilst there are moments of plot revelation, the film is never pretentious of itself, Nolan keeping true to his word of creating a story-based final instalment. Like the previous two, The Dark Knight Rises is an art-house movie posing as a summer blockbuster, the real focus being on the script and story, the action aiding the storyline- the exact opposite of a Michael Bay film. The film never insults the intelligence of the audience and, like Inception, expects the audience to keep up. In other words, Nolan has so much respect for his audience that he created this film with the idea that the audience is as his intelligent as himself. It is a wonderful story-based film, not overly-pretentious of itself whilst keeping viewers on edge the entire 2 hours and 45 minute run-time. Personally, I found this flew by, and would have gladly sat through at least another hour.It has its flaws, and though I hate to say it, is not above criticism, but when truly appreciated for what it is, The Dark Knight Rises is a great film, and a poetic but satisfying conclusion to a classic trilogy, an emphasis on story as opposed to a revelatory-filled epic. Nolan has created not only the best 'Batman' movies ever made, but a classic trilogy that should be viewed first and foremost as art-house movies, secondly as Batman movies. The final chapter will leave you emotionally drained, but satisfied by the conclusion, as opposed to feeling exhausted by an overly-pretentious epic finale.",9,4,9,9 August 2012
Iron Man," Adrenaline-fuelled fun and a pleasant surprise
","Typically Iron Man is not the type of superhero movie I would enjoy, the only 'light' superhero movies I have genuinely enjoyed in the past being the first two Sam Raimi Spider-Man movies. With Christopher Nolan's dark realistic Batman movies paving the way of example to other films in the superhero genre, director Jon Favreau embraces a realistic tone whilst keeping the movie far lighter and more humorous in tone than Batman. And like most, I was pleasantly surprised with Iron Man, and despite its notable flaws, the film has made its way to being one of my favourite superhero films of all time. The film is, first and foremost, a long title sequence telling the origin story of Iron Man, the film's key fundamental theme being about realisation and – for past sins. In this case, the sins of billionaire playboy Tony Stark, played by the perfectly-cast Robert Downey Jr. Tony Stark is an arrogant, but made very likable due to Robert Downey Jr.'s fine performance, who is kidnapped by terrorists using the weapons he created, and imprisoned in a cave where he is forced to build a deadly weapon- The Jericho Missile- to help the terrorists in their plot. During this time, Stark is given a wake-up call in which he realises he must take responsibility for the power these terrorists hold, having previously been blindingly ignorant to what is being sold on the black market. There is a bittersweet irony in, not only the realisation that the terrorists gained power through his creations, but the fact that Tony's heart was injured by one of his own weapons- an injury which requires him to wear a power cell-like 'arc reactor' to keep him alive for the rest of his life. This makes not only for an interesting story, but a great motivation for Tony Stark to fight this evil, and a motivation the audience can feel equally enthusiastic about. As the films progresses and Tony returns to his home in America, the story continues the same concept by revealing more about how Stark's company has supplied these terrorists with weapons, but refuses to go in any other direction. For a summer blockbuster the storyline is lacking in fuel to keep itself going, the current story- that feels more like a concept, designed as an excuse to put Tony in the Iron Man suit and place a few action scenes in the film- wears down quickly, leading to a messy Transformers-like climax which feels out of tone with the rest of the film. The action scenes themselves were impressive, with incredibly realistic CGI on the Iron Man suit, beautiful cinematography and were genuinely adrenaline-fuelled fun, with exception to the clunky finale. However, the scenes were rationed throughout the films, appearing as a quick 'rush' in the film's pacing, before reverting back to a regular movie. Appreciating Jon Favreau's comfort zone and experience lies in the field of comedy, it was a good safe decision to ration the action scenes like he did, but the fact that they were so fun to watch and well-shot left me wanting more.The strength of the film really lies in Tony's physical and metaphorical transformation into Iron Man and the chemistry between the three central characters- Downey Jr.'s Tony Stark, Gwyneth Paltrow's Pepper Potts and Jeff Bridges villainous Obadiah Stane. All three give top-class performances, and prevent the movie's pacing from falling flat. Composer Ramin Djawadi's score for the film is also highly commended, giving a suitable mixture of modern and orchestral, reflecting the film's swapping between Tony Stark and Iron Man/ smaller scenes and action scenes. Ultimately it feels very special, adds a good dose of humour and enjoys itself whist taking the core themes seriously, features great acting, but really could have done with a better ending than two people in suits engaging in a fist-fight.",8,2,3,8 August 2012
Casino Royale," Bond returns, so does quality
","A fresh start in the 'Bond' series, Casino Royale takes Bond back to his roots in a story based on Ian Fleming's original novel. Having never been a fan of the previous Bond movies, which are famed for their focus on gadgets and an incredibly suave, almost fantastical portrayal of Bond, I was impressed to hear Casino Royale would return to Ian Fleming's original vision of a tough, cold, brutal and more realistic Bond.Not only is the film a success, but it has converted me to being a fan of the series. What makes Casino Royale so successful is its loyalty to Fleming's original vision and Daniel Craig's outstanding performance as Bond. Whilst all the previous actors to play the part have all been great in their own ways, Daniel Craig portrays the real James Bond, realistically playing a cold and brutal character whilst keeping the audience invested and interest in the character on an emotional level. Not only is he great in the role in smaller, more acting-oriented scenes, but he is incredibly entertaining to watch during the ambitious action sequences the film boasts, and it is easy to tell Mr. Craig is more than comfortable in the shoes of 007.At its core, Casino Royale is Bond at the very start of his career, and as the film progresses Bond goes through several learning-curves. The film makes an impact in the sense that you feel the pain Bond goes through, every fight feels brutal and painful, the action feels genuinely real and you are always aware of the incredible threat surrounding Bond. There are scenes dedicated to the aftermath of Bond's fights, and you really sense this is a human character going through very human emotions, and allows you to gain more of a sense of who Bond is. Personally, the film gave me the impression that the character is punishing himself, despite his straight-faced talks that killing does not bother him. That is another thing I found made the film so successful- all the mystery of the character remains, yet we understand more about him than ever before.Speaking about the film itself, the entire piece boasts incredible landscapes that have always been unique to the Bond films, utilising the various settings to be incorporated into stunning wide-shots, camera angles and action sequences, all to their full capacity. Two prime examples include a section in which Bond is chasing a bomb-maker through Madagascar, the climax of the chase taking them to a top of a tall crane overlooking the island, another being an action sequence taking place in Venice within a sinking building. It is undoubtedly a very ambitious film, trying to remain true to the classic exciting action-sequences of the classic films whilst not crossing the line of 'over-the-top'. Fortunately, the film balances it perfectly, making all the action sequences thrilling but believable. Performance wise the film was top standard, particular credit going to Mads Mikkelsen who portrays the films chilling and iconic-looking villain, Le Chiffre. Judi Dench reprises her role as M (ignore her previous portrayals, this is a new story) distorting the time-line, but the film would feel incomplete without her strict presence. Eva Green portrays Vesper Lynd, the 'Bond-Girl' of the story, with a key difference- she is the woman Bond falls in love with, and is ultimately the reason for his coldness towards others.For the most part, the film flows brilliantly, which is an achievement in itself considering this is a film centred on a card game. Even if you are unfamiliar with the rules of 'Texas Hold 'Em', the film makes short work of making it engaging, overcoming the challenge of making a card game feel exciting to the audience. As I said, the film is entertaining for the most part, however I felt it dropped dramatically during the film's third act and actually felt slightly bored as the film started to trudge its way towards the end. Though I am aware this part of the story is necessary in the continuity, paving the way for Bond's future behaviour, but it just felt out of place in a Bond film. With no real flaws, Casino Royale succeeds in achieving its goal: Bringing Bond back to his routes whilst making a great film. Daniel Craig portrays the way Bond was always intended to be seen, whilst staring in an incredibly engaging film. Credit must be given to the film's focus on Bond's pain and the ambitious action sequences, however be prepared for a rather average final act. Not to worry though- the classic 'Bond Theme' is played in the credits!",8,3,5,16 August 2012
