movie_title,title,review,rating,helpful,total,date
Eternal Sunshine of the Spotless Mind," Unfulfilled promises
","The premise is intriguing. Girl gets tired of a declining relationship and has all memory of boyfriend erased. Boyfriend finds out and decides he can't live with that: gets himself erased as well. In the middle of the procedure, which he experiences as a kind of dream, he becomes lucid, realizes what's going on and decides he doesn't want this to happen. But it's too late; despite all his efforts his memory is erased. Fate in the shape of an accidental post- erasure meeting and the other actions of other characters involved twists the plot around and brings them together again.The cast: a director's dream. Jim Carrey, Kate Winslett, Kirsten Dunst, Mark Ruffalo. How can you go wrong? Well, you can, and something did. I've been trying to work out what, because there are so many factors that nuked this movie.First of all what went right: Carrey and the rest of the cast were amazing, even if most of them never got a chance to actually evince what you might call 'depth of character'. Carrey and Winslett do get that chance in the first part, where 'Joel' and 'Clementine' meet again, and those few minutes alone make the movie worth watching; after that it's mostly downhill: the story falls apart in the same way that 'Being John Malkovic' ultimately does, except that here at least the story has somewhere to go, though the writer, director and editor seem to have no idea about how to get there, but ultimately fumble themselves through to an ending.There were some elements with incredible potential: for example the whole dream-like erasure process, with the built-in flashes of lucidity, followed by lapses back into non- awareness. Anybody who's had lucid dreams will recognize the process. Then there's what amounts to a mental chase and battle of wits, as Joel tries to hide his memories in places where the hi-tech backed pursuit cannot find it. The whole thing throws up a whole plethora of troublesome questions related to cognitive research and philosophy, and especially the nature of 'identity'. The suffocating predicament Joel got himself into (by surrendering control of his mind to someone else) and can't get himself our of. The twists and turns of contingency as, despite all this, it all appears to turn out all right.The flaw at the heart of this movie is that someone forgot what story to tell, and instead tried to tell too many, and in the process the movie lost its soul. The editing completed the job that the directing started. It was so VISIBLE as to become detrimental to the actors: in its contrived cleverness it erased much of the depth they could have brought to the characters. Sometimes I had the feeling that there actually WAS something more to this moment or that; but then it usually got zapped, as if the editor was chasing that precious something down like Stan was doing to Joel's memories.The cinematography was trying to be so clever that one could almost touch it. In conjunction with the awful editing, almost every 'cut-to' became a painful jarring of this viewer's attempt to relate to the story and the characters, and made the thing into a cinematographic, rather than an emotional experience.Without this, maybe the other problems of the movie would have been non-existent. I don't know, because the movie is as it is, and we can play 'what if' games forever and speculate into a vacuum. But I'd like to think that maybe in the hands of someone less keen to 'make a movie' and more interested in people and telling a story, we might actually have some emotional understanding of why Joel and Clementine needed to be together, and why it was right that in the end they were. Don't misunderstand me: give me ANY reason for an upbeat ending and I'll embrace it joyfully. So why, in this instance, did I feel that the ending was tacked-on, contrived, artificial? The back-together-despite-all-the-odds simply rings false, if only because the only reason why they are is contingency, sheer dumb luck, twists of fate. They get a second chance and maybe they'll work it out this time. But did they do anything to earn it? In particular, did Clementine, who evinces no sign of actually thinking that there was something wrong with her method to opt out of a situation with the minimum of pain? Do these people actually love each other, and if they do, is that love enough or shown as even indicatively sufficient to bridge the gap they've created in their past and through their actions of surrendering their power of their minds to someone else?Finally, there is something offensive about the general attitude by director and editor towards the actors: in this case a dream-cast, whose potential was mostly edited out of existence. There is a school of film-makers who see actors as a kind of cinematographic element, like a piece of landscape or a prop. As long as they perform the correct motions and say the right things at some time or during some take, there's probably a way to edit it together so that it looks right. That's OK if the actors actually need such treatment. There is another school who believes that actors are to be considered not just essential, but next to the director the dominant visible participants in any decent story-telling process. To demean them into becoming just pieces in a mosaic of self-important film-making is degrading. That Carrey, Winslett and the rest of the cast still manage to shine is a testimony to their professionalism and consummate skill. That aspect was the one truly bright spark in an otherwise disappointing flick.Till Noever, Author: KEAEN, www.owlglass.com10/10 for the actors 2/10 for the film-maker/editor",5,14,33,9 January 2005
National Treasure," Indiana Jones minus the gore
","This one gets my vote for the most enjoyable flick of 2004 (together with The Indredibles). You'd think it's just for kiddies, but any adult capable of just going to the cinema to enjoy themselves should be able to sit back, gobble the popcorn, suck the straw, nibble on the ice- cream and just have a couple of hours of unproblematic maniaÂ—with good and bad guys, daring thefts, lost treasures, romance, chases, near escapes, disasters and rescues and everything you'd expect in this kind of Bruckheimer production. The whole thing is paced just right, the villains are just bad enough, and the goodies are nobles with a roguish streak. The cheesy bits are mellowed with a dash of wry humor, and those that aren't: well, just take them, don't cringe and, again, have fun!I came out of this movie smiling, as did my wife and elder daughter (that would make all of us into definite 'adults'). Since a smile was what we all wanted that day, we got exactly what we asked for.",9,122,184,11 January 2005
Transformers: Revenge of the Fallen," Cool
","Well, just for a change I got to see a really cool movie just a few days after its release (here in Australia anyway), and on what touts itself as the biggest screen in Brisbane; which, by the way, is smaller than the biggest screen in Dunedin, New Zealand. So, take that, Brisbane! Anyway, it turns out (SPOILERS!) that Megatron isn't the real big cheese after all, but there's this creepy megalomaniac dude, lurking somewhere in a giant ship near Saturn, who's really got it in for the 'Primes', of which Optimus is the last. He's also got it in for Earth and humans and all that fleshy stuff. And, yes, he's...well, 'displeased'...and supported by a major phalanx of Decepticons.The mythology is getting way out of hand, but who cares! As long it supports yet another very cool flick, with lots of real big robots talking and walking like humans and talking smack, but fighting like robots with huge bits and pieces flying here and there and always missing the good guys; a cool basic-hero-this-is-your-destiny dude wisecracking and bumbling, but ultimately being a hero, his way through the story; a sultry female providing him with a foil and more than just support, but almost managing 'equality'; a crack team of our Ranger buddies from the first movie really laying it on this time; some major military hardware being terminally damaged, while other hardware does its America-saves-the-world stuff...all that and the product-placement car—though I do prefer the old, original Camaro from the first movie. Shame on you, Megan Fox, for sitting on Shia's lap and forever taking the original Bumblebee out of the equation with your 'If he's like, this super-advanced robot, why does he transform into this piece-of-crap Camaro?' Friends of ours had an issue with the first movie, where they thought they spotted—correctly—lots of US military hardware and just generally America-saves-the-world. Well, if they had a problem there, they certainly will this time; tenfold. But should that spoil a perfectly good fun movie; or should all that product placement divert from just enjoying oneself? On the contrary I say. Verisimilitude demands that one is true to what is. There was a brief reference to evacuating 'President Obama' from the White House to some place of safety as well; and the National Security adviser and his presidentially imposed mission was just the kind of thing I wold have expected from an Obama flunkie. Just like the previous president, in the first Transformer flick, was depicted as a bit of an asshole, in that immortal line, requested from one of his attendants on Air Force One to 'rustle me up some Ding Dongs'. You gotta love Michael Bay. He's on good terms with the US Mil and obviously thinks highly of them, and especially the people who do the real work—reminds me of Ridley Scott that way—but I think his opinion of politicians is somewhere at the bottom of an aircraft carrier's bilge. Well, mine's even lower; so good on ya, Michael! Anyway, if a movie is about the present and if you can get money for it by creating a context in which products that actually exist today are being used; what's wrong with that? It's verisimilitude, people; so stop bitching about it, those of you who do, and enjoy the ride, for crikey's sake! Bottom line, XF2 rocked. Haven't had so much just-fun since...well, since XF1, really. I take that back in the same breath: I thought Star Trek was also right up there in the super-geek-fun league, but it was definitely more adult. Movies like XF1 and XF2 will allow everybody, from 7 to 70, to have fun.There's something—in my case not even 'guiltily'!—atavistically and profoundly pleasurable about just turning off all the dumbwit plot and character analysis mode and what we are told we should think and what makes sense (the Transformers mythology makes none at all, but what mythology actually does, I ask!) and what is A and B and C grade and whatever other crap floats around in your head. It's like a mental holiday; no pressure to think this or that or whatnot; just go with the flow...and when you come out of the cinema and you drive back home, all the cars around you and every bit of machinery, really, start to look...well, kinda different. After the absolutely brilliant homage to Spielberg's classic, Gremlins, near the start of XF2, not even our kitchen will ever look the same to me.If you don't enjoy XF2, you're either living in a very impoverished universe, or you're just emotionally...well, whatever; or there simply are some things in this world that you don't 'get' and possibly never will. Poor bastards...",9,1,4,8 July 2009
Shooter," On target
","WARNING: SPOILERS.Antoine Fuqua doesn't like government or politicians, and the bigger they get the less he likes them. Shooter, as if evidence were needed, is an anti-government polemic wrapped up in an action flick, with a hero (Mark Wahlberg) Bob Lee Swagger, a former sniper and a man possessed of simple ethics and deadly skills. The government is a present-day one, instantiated in a grossly-overweight 'US Senator' (Ned Beatty)who likes to proclaim this every now and then like a creed and declaration of his license to act with impunityplus his henchmen, led by Danny Glover, as Colonel Johnson, as an ice-cold opportunist and manipulator. Not many shades of gray here. You know who the bad guys are and who to cheer for.Bob, after having been used and left to die by his government in a mission behind enemy lines and seeing his friend and spotter die beside him as a result, manages to escape and tries to live a life alone in the mountains somewhere. He's sought out by and manipulated into becoming a patsy/fall-guy for the assassination of a foreign leader, though it looks like he was after the US President. Hunted by everyone and sundry, and with the assistance of his former partner's wife (Kate Mara) and an FBI agent (Michael Peña), whom Swagger declined to kill when he might have, and who as a result starts thinking the wrong (right) thoughts.Though Swagger must realize in the end, as must the audience, that here indeed, as the bad guys explain several times, we don't live in a world anymoreif ever! not on the large scale anywaywhere the sheriff can fix the problems of his town with a few judicious killings, he does his best to make sure that, at least insofar as he himself and one other person he might still care about is concerned, he'll make sure that things are set as much to right as they can be.As usualas in Tears of the Sun and King Arthur, for exampleunderneath the action flick there lurks a polemic that pays homage to the 'simple' soldier; the man without grand agendas, who just, for whatever reason, wants to do the job he volunteered for or was dragged into by contingency; while being deeply cynical about the motives of anybody much above the rank of the truly 'operational' soldierthat being the ones who end up in actual battle, rather than watching it from a distanceand definitely of those elevated to the status of 'leaders' of human societies; be these leaders in the nature of 'emperors', as in King Arthur, or of democratically elected politicians, as in Tears of the Sun or Shooter.I happen to share Fuqua's cynicism of these people, and indeed of everybody in 'politics', and so sympathize with the sentiments of the movie. But I also understand that a lot of people will ultimately find it uncomfortable and therefore will probably turn off it. This might also apply to many who otherwise would agree with Fuqua when it comes to specific politicians they despise, however, because he does not proselytize and pretend that there's actually much hope to change the world either. It is what it is, and though individuals may win their personal battles, the result is at best a glitch in the system, barely glimpsed and forgotten by the next breath. As such, Shooter is a bleak vision. Very satisfying on one level, because we see the scales of cosmic justice tipped a bit closet to the point of equilibrium; but we also realize that they remain disconcertingly askew, with little hope for change.The movie is rated 'R' (in New Zealand, where I saw it, 'R-16'); not, I suspect, just because of the violence and the heads exploding with well-placed sniper rounds; not because of the sex, of which there isn't any; but mainly because in the end Swagger does something that many, who would otherwise have sided with him, must surely find disturbing, despite all the bad things the evildoers have done, as he goes on a calculated final killing spree. It is lawless and ultimately denying that in some things there can be any hope for justiceor, in this case, the assurance of personal safetyand that sometimes there is only one solution to certain problems. The audience will have to take that home and ponder itif they see past the action/conspiracy flick at all!and decide how they feel about it.",10,1,5,22 April 2007
Music and Lyrics," Charming
","M&L is driven by several major sources of energy, if you will, mixed together with skill and a fine sense of timing: absurd comedy, parody, utter predictability and an overwhelming charm that only a romantic-comedy hater could resist. As for me, I was...well 'charmed'. Hugh Grant, as my wife noted, basically always plays the same character: a mix of hapless but amusing bumbler with a self-effacing sense of insight into his own bumbler-ness and maybe human nature in general. In anybody else this endearingness would be annoyingand do not doubt that there are a lot of Hugh-Grant-haters out there; and good for you, because I know where you're coming from. It's just that I'm not with you on this.Drew Barrymore has always had a slight inherent cluelessness and innocence, mixed it with a twinkle of the actress's own life-ups-and-downs, that made her perfect for this little flick. This is in contrast to another not-so-recent movie Ever After, which was very likable and charming, but I wished the Cinderella character had been someone else, because the US accent just gratedjust as did, for example, the accents in The Three Musketeers and especially Chris O'Donnell's D'Artagnan. I can't abide that kind of sloppiness. But here, Barrymore was perfect.They spent a lot of time on music numbers in this one, playing songs almost all the way through. This normally would have annoyed me for I would have thought of it as the time-filler it might have been. If it was, well in this instance I don't care, because it worked as well. And the ditty Way Back Into Love is a real earworm. It made the whole thing almost believablebelievable enough at the time to allow, for me at least, effortless suspension of disbelief.Last, but not least, this is the kind of movie I could never make or script. I don't have the disposition for it. Because of that I really have no notion of how to make it betterand that's a good thing, because I wasn't sitting there, asking myself 'but why didn't they...', which is what I sometimes do in flicks that I might have written, but in which I detect serious flaws. If this thing here had flaws, well, I don't care. It was fun and games and lots of laughs. And yes, call me whatever you want to, but I was humming that damn tune when I came out.Till Noever, owlglass.com",9,5,13,19 February 2007
The Bourne Supremacy," Almost very good
","Saving myself the summary...Fast-paced action flick, which I enjoyed very much, despite its flaws. The car chase in Moscow must rank among the most violent ever filmed. Are these Russian cars really built like tanks?Flaws, inter alia:1) The camera work: the director overdid the 'shaky' bits. First, it make you nauseous when you're exposed to it on a large screen (and I saw it on a LARGE screen). It's OK for TV and NYPD, but not here. The nausea plus the overuse of the effect diminishes its impact in those instances where it could have been useful. It was a lousy directorial decision.2) Why did they have to kill off Marie? To motivate Bourne? Cliché, and in your face - and that basically means crappy, lazy story-telling. I could think off-hand of at least five other, less stereotypical, ways of achieving the same aim; can't you? Or was it just because the screenwriters didn't know what to do with the romance angle? Does God exist? Who invented the doggy-bag? Some questions have no answers, I guess.Never mind. I still enjoyed it, and didn't consider it a waste of either my money or my time.3.5/5Till NoeverAuthor: KEAEN, Edge Science Fiction and Fantasy Publishing, www.owlglass.com",7,0,1,29 August 2004
The Island," One of the three best movies of 2005
","The Island, together with King Kong (my #1) and Serenity (struggling with The Island for #2 place), are my favorite movies of 2005. Each has left a profound impression on me. I'm not going to summarize the plot, since it's been discussed at length before. Instead, here are some points that need to me mentioned in order to do the film justice.The Island, if one feels bound to refer to other movies, is basically Logan's Run meeting Bladerunner. It asks some of the same questions; most significantly one of profound philosophical import: how do you define a 'human being'? Sidebar: The often-mentioned Gattaca, on the other handand I'm pointing this out this for the benefit of those reviewers still struggling with comprehension of the fundamental difference between the moviesasked if the value of human beings depends on their genetic makeup; just like one might ask if a handicapped person is of equal value as one who isn't.Should a cloned ('replicated', 'copied') but conscious human being be accorded the same rights as one created and brought into this world in a more conventional manner? What is consciousness anyway? How do you detect it? How far will human beings go to preserve their lives? (There's a truly disturbing part in Michael Bay's commentary on the DVD regarding this. Truth apparently is even more sickening than the occasionally quite troubling fiction of The Island.) The Island deals with these issues in all seriousness; but not in a pretentious or 'arty' manner, or with the ponderous gravitas that might have eventuated in the hands of a 'serious' director. It also answers them; at least as much as it is possiblefor, after all, who _can_ say what 'consciousness' actually 'is'? We all _know_ what it is, but try to _define_ it and you're instantly stepping on philosophical quicksand. All this is accomplished in the context for an 'action' movie, and one by Michael Bay at that. That instantly gets a lot of folks' hackles up; for Michael Bay can't possibly make a movie with depth, right? Well, think again, for this one is. An object lesson, if we need one, to teach us that not every action film has to be a one-dimensional Tom Cruise or Will Smith vehicle. The Island strikes an exquisite balance between the relief provided by humor and the physical- ness of some very well done action, moments of reflection, and a multi-layered plot with lots of hidden meanings and question marks, as well as a satisfying denouement. Above alland unlike Gattaca, which was a very 'self centered' movie; with the protagonist really only interested in himself and his own plans and tribulationsThe Island ultimately went beyond that and toward displaying a sense of social responsibility. One of the most touching moments of the movie occurs when Lincoln and Jordan spin dreams of what they would like to do, and how they could just go far away and live like 'real people'; and then he says '...but after...', meaning after having tried to help 'all those people we left behind', who are about to be destroyed (well, 'killed' or 'murdered' would be more appropriate) as their makers try to 'start over' a new generation of clones with less troublesome predilections. The decision to risk their future for the sake of their fellow clones, is the ultimate proof of Lincoln's and Jordan's humanity; and in the process they help to redeem the one who has hunted them relentlessly, and who rediscovers his own humanity as a result of his interaction with them.One issue has raised justifiable questions: how did the clones 'know' all these things they knew? Or, how did not just they, but apparently another whole lot, become infected with apparently spontaneously-generated memories of their 'sponsors', that is the people they were cloned from?One possible answer is that memories are encoded in the DNA of a personbut that doesn't make much sense. There is nothing to suggest in current scientific research that this is either possible or that it happens. Another theoryand this is where 'speculation' enters the fray is that (slightly extending theories such as those developed by the likes of Rupert Sheldrake or Roger Penrose) people with identical genetic makeup have a 'connection' that goes beyond mere genetics; that they are 'linked' (telepathically?) in some way. Maybe that's how their 'memories' seemed to have 'grown' spontaneously over the lifetimes of the clones. Maybe that's also why, in some ways, the clonesand especially Lincolnseemed to have acquired certain characteristics of their 'sponsors'.I don't know and neither did the God-potentate Merrick, who was highly and unpleasantly surprised by this turn of events; though for a few moments he appeared to be genuinely stimulated by the notion, until he realized that it was interfering with his carefully laid-out plans and DOD funding. He never found the explanation, before he died at the hands of one of his creations. So, is there a suggestion here that there's more to life and humanity and the mind and every- damn-thing than is currently accepted by science? I know some people aren't comfortable with that notion, and, being an atheist myself, I'm not bringing God into this eitherbut is the notion that we haven't figured out the fundamentals of 'human nature' really so preposterous? Is it unreasonable for a movie, and especially one so unashamedly 'entertainment', to suggest that maybe we don't know everything, and that our ignorance, combined with the delusions of omniscience in some, is likely to come and bite us in the butt? I think not. This theme, by the way, is also picked up in that other cinematographic gem, Serenity, though from a slightly different angle.Till Noever owlglass.com Author: Keaen, Continuity Slip, Seladiënna",10,0,2,29 January 2006
