movie_title,title,review,rating,helpful,total,date
Friends with Benefits," Leave it to Justin and Mila to make a better 'No Strings Attached'
","So is Friends With Benefits better than No Strings Attached? Yes. And if that's all you needed to settle a bet with your friend, you can go call him up now and plan a trip to the theater July 22 to find out why.Justin Timberlake has proved once again that he can actually act... Pretty well, actually. And that automatically puts him lightyears ahead of Ashton Kutcher. Additionally, Justin and Mila have some excellent and convincing chemistry that really supports the film, along with a handful of jokes and hilarious cameos that make for some good laughs. But the story falls flat where it tries to parody the typical romance movie because ultimately, it adheres to the exact same chick-flick formula: Guy meets girl, they hit it off, complications arise, they fall apart, they resolve their issues, and voilà... happily ever after. And Mila's mother in the movie... where have we seen her character before? Oh that's right, literally copy+pasted from Easy A. I suppose you probably wouldn't expect anything more out of this movie than the run-of-the-mill romance comedy, but it's a solid one at that and worth your while if you're interested! 7/10",7,27,51,16 June 2011
Super 8," J.J. Abrams does it again!
","As you might expect, J. J. Abrams has churned out another exhilarating experience with solid entertainment. Imagine, if you will, a combination of The Goonies + Cloverfield and you will get Super 8, the story of a young boy and his friends that witness a creature escaping a crashed military train while filming with a super 8 camera. As I heard an audience member say after the screening, J. J. Abrams put his fingerprint on this movie, then smeared it all over. The mysterious creature is only glimpsed a handful of times during the first half of the film, and the story will keep you constantly guessing and engaged. With the aid of some fantastic special effects, Super 8 will no doubt be one of the most exciting films of this summer, additionally offering a nostalgic reminder of the times of Spielberg's E.T. and Close Encounters of the Third Kind. So the bottom line is: Super 8 is good, and if you're watching it as a J. J. Abrams fan, you're in for a real treat.But the film is not without its flaws. Within this young cast you can sense a lot of rising stars but that's just it. They're still 'rising'. It is a common problem to have some amateur acting with kids. The story is not entirely original either. However, these are only minor complaints against the movie. The main issue with Super 8 is that it can't decide what it wants to be. Is it a coming-of-age drama? Is it an alien action film? Is it horror mystery? Alien and horror and mystery genres can mix quite nicely, but unfortunately coming-of-age not so much. One aspect of the film focuses on the adventure of kids in a rural town while another focuses on a violently rampaging alien. The result is a schizophrenic jumble of genres that has you shifting uncomfortably in your seat at the idea of kids watching certain scenes. For this reason, I STRONGLY caution adults taking their kids to see this movie. Super 8 had more blood, cursing, and blatant drug references than any movie I have seen in a while. IT's a bit like walking into Kick-ass expecting a child's movie. In my honest opinion Super 8 should have been rated R, but Abrams was careful when pushing the limits of PG-13 rules. Indeed, this movie was a wonderful throwback to the days of E.T., but perhaps should only be viewed by those who watched E.T. when it came out. Don't forget that the Abrams touch is violent, as well as mysterious! 8/10",8,4,12,8 June 2011
Rango," Nickelodeon bares its fangs
","So a slight blurb about how surprised I was that Nickelodeon was tackling several mature themes: Rango boasted quite a number of darker undertones that you wouldn't normally expect from a PG, animated Nickelodeon movie. Such areas included language (sporting such lines as 'You son of a-'!, 'Go to hell!', and 'Can I gut-shoot someone?'), violence (an impressive amount of shooting and dying), sexual themes (making references to how 'active' one's mother was and a joke about a mammogram), and the film's portrayal of death (where characters constantly expect Rango's death and at one point, parody death by hanging). That is, you could arguably find just as much material in other animated films, such as The Incredibles- but it just goes to show that Nickelodeon is ready to experiment with a braver sort of film, much like Disney did with Pirates of the Caribbean. Okay, disclaimer over. Rango is beautiful film that, regardless of its content, gave everyone in the theater a darn good time. Borrowing heavily from classic Westerns (The Good, The Bad, and The Ugly) and Western comedies (The Three Amigos), the film brings reinvents a past formula in an amusingly creative way. Rango, a pet chameleon unsure about how he wants his identity to develop, is suddenly cast to into the life of the wild wild west and decides to assume the duties of the sheriff in a troubled town. When the gunslingin' enemies arrive, the trouble begins...If anything, the film is revolutionary in its animation. The quality and textures of the animals and landscape is simply spot-on and never ceases to amaze. By far this is the movie's greatest strength- and supporting the beautiful visuals is a whole slew of jokes. Like I said before, sometimes the humor is a bit awkward for its targeted audience (there were definitely a lot of times adults laughed instead of the kids) but for the most part the theater as a whole enjoyed the comedic spots. The voice acting cast is of course lively and fun, bringing a unique quality to each and every animal character. And lastly, the score by Hans Zimmer is once again majestic and exciting (influences from his work in Pirates and Sherlock Holmes are easily heard, but with a Mexican twist!).Overall, Rango is a beautiful and exciting western adventure that you shouldn't miss! As long as you know what you're in for, the humor and the visuals will take you for an unforgettably pleasing ride. 8/10",8,80,113,2 March 2011
Harry Potter and the Deathly Hallows: Part 2," A Magical End to an Incredible Saga
","I salute you, Potter fans. This moment has taken 10 years to find you, and now the wait is finally over. I can tell you the wait was worth it. Maybe you want to know exactly what happens to Voldemort in the movie or exactly how a battle specifically goes down, but spoilers for this movie (good or bad) are simply not worth knowing. Get in line and don't ruin the experience for yourself.I know what your big (generic) questions are... Is Part 2 fantastically more epic than the previous films? Does it loyally mirror the book to the very last page? Has Daniel Radcliffe's acting improved? I know you definitely don't want to hear it, and I definitely don't want to say it, but the answer is No. If you have come this far after watching seven Harry Potter movies and still have no clue what to expect, then I don't know what to tell you. In whatever regard you held Part 1, you will probably think similarly of Part 2. They are made of the same quality,,, Unfortunately, that means I can guarantee there will be moments that cause you to shift uncomfortably in your seat and think to yourself, 'That's not how it happened in the book'; you'll see chunks of the story removed for the sake of runtime; some parts, namely the romances, will feel rushed and awkward; what consisted of pages of dialogue in the book are awarded a single line in the movie; the smothering relationship with Hollywood style leads to silly fist fights and corny one-liners. Even the epilogue is quite laughable because someone in the costume department thought '19 years later' only meant '19 pies and a Big Mac later'. Again, these are all defects you should have come to expect in the series... But do not despair! I can also guarantee that after these fleeting mistakes pass, you will shrug your shoulders and realize that these are Harry's last days. The Deathly Hallows Part 2 is perhaps the only possible movie that, despite however unsatisfying some scenes might be, the film as a whole will leave you with a grand sense of fulfillment in your mind and with a feeling of nostalgic happiness tugging at your heartstrings. You will STILL be rooting for your favorite heroes, be wow-ed by excellent special effects, and squirm with delight at the sight of the long-awaited kiss. It is ultimately a bombastic conclusion befitting of one of the greatest literary and film series in history - No one can argue with that. Harry Potter's life on the screen may be over, but the boy who lived will continue to live in our hearts forever.",7,3,9,12 July 2011
